{"id":87870059,"isReadOnly":false,"metaTags":null,"headHtml":null,"customCss":null,"headerHtml":"<section class=\"u-clearfix u-custom-color-2 u-header u-block-5698-1\" custom-posts-hash=\"[]\" data-style=\"header-imglogo-menu\" data-post-id=\"post1\" data-section-properties=\"{&quot;grid-spacing&quot;:&quot;0&quot;,&quot;align&quot;:&quot;left&quot;,&quot;stretch&quot;:true}\" id=\"sec-eced\" data-source=\"\" data-id=\"5698\">\n  <div class=\"u-clearfix u-sheet u-block-5698-2\">\n    \n    \n  <p class=\"u-text u-text-default u-block-5698-34\">GAMER<br>&nbsp;CAVE.</p><nav class=\"u-menu u-menu-one-level u-offcanvas u-block-5698-23\" data-products-link=\"none\">\n    <div class=\"menu-collapse\">\n        <a class=\"u-button-style u-custom-text-color u-nav-link\" href=\"#\"><svg class=\"u-svg-link\" viewBox=\"0 0 24 24\"><use xlink:href=\"#svg-1957\"></use></svg><svg class=\"u-svg-content\" version=\"1.1\" id=\"svg-1957\" viewBox=\"0 0 16 16\" x=\"0px\" y=\"0px\" xmlns:xlink=\"http://www.w3.org/1999/xlink\" xmlns=\"http://www.w3.org/2000/svg\">    <g>        <rect y=\"1\" width=\"16\" height=\"2\"></rect>        <rect y=\"7\" width=\"16\" height=\"2\"></rect>        <rect y=\"13\" width=\"16\" height=\"2\"></rect>    </g></svg></a>\n    </div>\n    <div class=\"u-custom-menu u-nav-container\">\n        <ul class=\"u-nav u-unstyled u-block-5698-24\"><li class=\"u-nav-item\"><a class=\"u-button-style u-nav-link u-text-custom-color-4\" href=\"Inicio.html\" data-page-id=\"66313835\">Inicio</a><div class=\"fake u-nav-popup u-block-5698-35\"><ul class=\"u-h-spacing-20 u-nav u-unstyled u-v-spacing-10 u-block-5698-36\"><li class=\"u-nav-item\"><a class=\"u-button-style u-nav-link u-white\" href=\"#\">Opción del menú1</a></li><li class=\"u-nav-item\"><a class=\"u-button-style u-nav-link u-white\" href=\"#\">Opción del menú2</a></li><li class=\"u-nav-item\"><a class=\"u-button-style u-nav-link u-white\" href=\"#\">Opción del menú3</a></li></ul></div></li><li class=\"u-nav-item\"><a class=\"u-button-style u-nav-link u-text-custom-color-4\" href=\"Servicios.html\" data-page-id=\"776573\">Servicios</a></li><li class=\"u-nav-item\"><a class=\"u-button-style u-nav-link u-text-custom-color-4\" href=\"nosotros.html\" data-page-id=\"566308215\">Nosotros</a></li><li class=\"u-nav-item\"><a class=\"u-button-style u-nav-link u-text-custom-color-4\" href=\"Blog-Template.html\" data-page-id=\"199946547\">Blog</a></li><li class=\"u-nav-item\"><a class=\"u-button-style u-nav-link u-text-custom-color-4\" href=\"Acceder.html\" data-page-id=\"643215768\">Acceder</a></li></ul>\n    </div>\n    <div class=\"u-custom-menu u-nav-container-collapse\">\n        <div class=\"u-black u-container-style u-inner-container-layout u-opacity u-opacity-95 u-sidenav u-block-5698-27\">\n            <div class=\"u-inner-container-layout u-sidenav-overflow\">\n                <div class=\"u-menu-close u-block-5698-28\"></div>\n                <ul class=\"u-align-center u-nav u-popupmenu-items u-unstyled u-block-5698-29\"><li class=\"u-nav-item\"><a class=\"u-button-style u-nav-link\" href=\"Inicio.html\" data-page-id=\"66313835\">Inicio</a><div class=\"fake u-nav-popup u-block-5698-37\"><ul class=\"u-h-spacing-20 u-nav u-unstyled u-v-spacing-10 u-block-5698-38\"><li class=\"u-nav-item\"><a class=\"u-button-style u-nav-link\" href=\"#\">Opción del menú1</a></li><li class=\"u-nav-item\"><a class=\"u-button-style u-nav-link\" href=\"#\">Opción del menú2</a></li><li class=\"u-nav-item\"><a class=\"u-button-style u-nav-link\" href=\"#\">Opción del menú3</a></li></ul></div></li><li class=\"u-nav-item\"><a class=\"u-button-style u-nav-link\" href=\"Servicios.html\" data-page-id=\"776573\">Servicios</a></li><li class=\"u-nav-item\"><a class=\"u-button-style u-nav-link\" href=\"nosotros.html\" data-page-id=\"566308215\">Nosotros</a></li><li class=\"u-nav-item\"><a class=\"u-button-style u-nav-link\" href=\"Blog-Template.html\" data-page-id=\"199946547\">Blog</a></li><li class=\"u-nav-item\"><a class=\"u-button-style u-nav-link\" href=\"Acceder.html\" data-page-id=\"643215768\">Acceder</a></li></ul>\n            </div>\n        </div>\n        <div class=\"u-black u-menu-overlay u-opacity u-opacity-70\"></div>\n    </div>\n</nav><nav class=\"u-menu u-menu-hamburger u-offcanvas u-block-5698-11\" data-responsive-from=\"XL\" data-products-link=\"none\">\n      <div class=\"menu-collapse\" style=\"font-size: 1rem; letter-spacing: 0px; font-weight: 700; text-transform: uppercase;\" wfd-invisible=\"true\">\n        <a class=\"u-button-style u-custom-active-border-color u-custom-border u-custom-border-color u-custom-borders u-custom-color u-custom-hover-border-color u-custom-left-right-menu-spacing u-custom-padding-bottom u-custom-text-active-color u-custom-text-color u-custom-text-hover-color u-custom-top-bottom-menu-spacing u-nav-link u-text-active-palette-1-base u-text-custom-color-4 u-text-hover-palette-2-base\" href=\"#\"><svg class=\"u-svg-link\" viewBox=\"0 0 24 24\"><use xlink:href=\"#menu-hamburger\"></use></svg><svg class=\"u-svg-content\" version=\"1.1\" id=\"menu-hamburger\" viewBox=\"0 0 16 16\" x=\"0px\" y=\"0px\" xmlns:xlink=\"http://www.w3.org/1999/xlink\" xmlns=\"http://www.w3.org/2000/svg\">    <g>        <rect y=\"1\" width=\"16\" height=\"2\"></rect>        <rect y=\"7\" width=\"16\" height=\"2\"></rect>        <rect y=\"13\" width=\"16\" height=\"2\"></rect>    </g></svg></a>\n      </div>\n      <div class=\"u-custom-menu u-nav-container\" wfd-invisible=\"true\">\n        <ul class=\"u-nav u-spacing-30 u-unstyled u-block-5698-18\"><li class=\"u-nav-item\"><a class=\"u-border-2 u-border-active-palette-2-base u-border-hover-palette-2-base u-border-no-left u-border-no-right u-border-no-top u-button-style u-custom-color-4 u-nav-link u-text-active-palette-2-base u-text-grey-90 u-text-hover-grey-90\" href=\"Inicio.html\" data-page-id=\"66313835\" style=\"padding: 10px 0px;\">Inicio</a><div class=\"fake u-nav-popup u-block-5698-39\"><ul class=\"u-h-spacing-20 u-nav u-unstyled u-v-spacing-10 u-block-5698-40\"><li class=\"u-nav-item\"><a class=\"u-button-style u-nav-link u-white\" href=\"#\">Opción del menú1</a></li><li class=\"u-nav-item\"><a class=\"u-button-style u-nav-link u-white\" href=\"#\">Opción del menú2</a></li><li class=\"u-nav-item\"><a class=\"u-button-style u-nav-link u-white\" href=\"#\">Opción del menú3</a></li></ul></div></li><li class=\"u-nav-item\"><a class=\"u-border-2 u-border-active-palette-2-base u-border-hover-palette-2-base u-border-no-left u-border-no-right u-border-no-top u-button-style u-custom-color-4 u-nav-link u-text-active-palette-2-base u-text-grey-90 u-text-hover-grey-90\" href=\"nosotros.html\" data-page-id=\"566308215\" style=\"padding: 10px 0px;\">nosotros</a></li><li class=\"u-nav-item\"><a class=\"u-border-2 u-border-active-palette-2-base u-border-hover-palette-2-base u-border-no-left u-border-no-right u-border-no-top u-button-style u-custom-color-4 u-nav-link u-text-active-palette-2-base u-text-grey-90 u-text-hover-grey-90\" href=\"Blog.html\" data-page-id=\"156504422\" style=\"padding: 10px 0px;\">Blog</a></li><li class=\"u-nav-item\"><a class=\"u-border-2 u-border-active-palette-2-base u-border-hover-palette-2-base u-border-no-left u-border-no-right u-border-no-top u-button-style u-custom-color-4 u-nav-link u-text-active-palette-2-base u-text-grey-90 u-text-hover-grey-90\" href=\"Servicios.html\" data-page-id=\"776573\" style=\"padding: 10px 0px;\">Servicios</a></li><li class=\"u-nav-item\"><a class=\"u-border-2 u-border-active-palette-2-base u-border-hover-palette-2-base u-border-no-left u-border-no-right u-border-no-top u-button-style u-custom-color-4 u-nav-link u-text-active-palette-2-base u-text-grey-90 u-text-hover-grey-90\" href=\"Acceder.html\" data-page-id=\"643215768\" style=\"padding: 10px 0px;\">Acceder</a></li></ul>\n      </div>\n      <div class=\"u-custom-menu u-nav-container-collapse\" wfd-invisible=\"true\">\n        <div class=\"u-black u-container-style u-inner-container-layout u-opacity u-opacity-95 u-sidenav u-block-5698-14\">\n          <div class=\"u-inner-container-layout u-sidenav-overflow\">\n            <div class=\"u-menu-close u-block-5698-15\"></div>\n            <ul class=\"u-align-center u-nav u-popupmenu-items u-unstyled u-block-5698-16\"><li class=\"u-nav-item\"><a class=\"u-button-style u-nav-link\" href=\"Inicio.html\" data-page-id=\"66313835\">Inicio</a><div class=\"fake u-nav-popup u-block-5698-41\"><ul class=\"u-h-spacing-20 u-nav u-unstyled u-v-spacing-10 u-block-5698-42\"><li class=\"u-nav-item\"><a class=\"u-button-style u-nav-link\" href=\"#\">Opción del menú1</a></li><li class=\"u-nav-item\"><a class=\"u-button-style u-nav-link\" href=\"#\">Opción del menú2</a></li><li class=\"u-nav-item\"><a class=\"u-button-style u-nav-link\" href=\"#\">Opción del menú3</a></li></ul></div></li><li class=\"u-nav-item\"><a class=\"u-button-style u-nav-link\" href=\"nosotros.html\" data-page-id=\"566308215\">nosotros</a></li><li class=\"u-nav-item\"><a class=\"u-button-style u-nav-link\" href=\"Blog.html\" data-page-id=\"156504422\">Blog</a></li><li class=\"u-nav-item\"><a class=\"u-button-style u-nav-link\" href=\"Servicios.html\" data-page-id=\"776573\">Servicios</a></li><li class=\"u-nav-item\"><a class=\"u-button-style u-nav-link\" href=\"Acceder.html\" data-page-id=\"643215768\">Acceder</a></li></ul>\n          </div>\n        </div>\n        <div class=\"u-black u-menu-overlay u-opacity u-opacity-70\" wfd-invisible=\"true\"></div>\n      </div>\n    </nav></div>\n  <style data-mode=\"XL\" wfd-invisible=\"true\" data-visited=\"true\">@media (min-width: 1200px){ .u-block-5698-1 {background-image: none}\n.u-block-5698-2 {min-height: 88px}\n.u-block-5698-34 {margin-top: 12.5px; margin-right: auto; margin-bottom: 0px; margin-left: 36.0626px}\n.u-block-5698-23 {margin-top: -37.7px; margin-left: auto; margin-right: auto; margin-bottom: 0px}\n.u-block-5698-29 {font-size: 1.25rem}\n.u-block-5698-11 {margin-top: -38.9875px; margin-right: 0px; margin-bottom: 32.9877px; margin-left: auto}\n.u-block-5698-18 {font-weight: 700; font-size: 1rem; text-transform: uppercase}\n.u-block-5698-16 {font-size: 1.25rem} }</style>\n  <style data-mode=\"LG\" wfd-invisible=\"true\">@media (max-width: 1199px) and (min-width: 992px){ .u-block-5698-1 {background-image: none}\n.u-block-5698-2 {min-height: 88px}\n.u-block-5698-34 {margin-top: 12.5px; margin-right: auto; margin-bottom: 0px; margin-left: 36px}\n.u-block-5698-23 {margin-top: -38px; margin-right: auto; margin-bottom: 0px; margin-left: auto}\n.u-block-5698-29 {font-size: 1.25rem}\n.u-block-5698-11 {margin-top: -39px; margin-right: 0px; margin-bottom: 32.9877px; margin-left: auto}\n.u-block-5698-18 {font-size: 1rem; letter-spacing: normal; font-weight: 700; text-transform: uppercase}\n.u-block-5698-16 {font-size: 1.25rem} }</style>\n  <style data-mode=\"MD\" wfd-invisible=\"true\" data-visited=\"true\">@media (max-width: 991px) and (min-width: 768px){ .u-block-5698-1 {background-image: none}\n.u-block-5698-2 {min-height: 88px}\n.u-block-5698-34 {margin-top: 12.5px; margin-right: auto; margin-bottom: 0px; margin-left: 36px}\n.u-block-5698-23 {width: auto; margin-top: -45px; margin-right: -0.0001px; margin-bottom: 0px; margin-left: auto}\n.u-block-5698-29 {font-size: 1.25rem}\n.u-block-5698-11 {margin-top: -32px; margin-right: 0px; margin-bottom: 37.3px; margin-left: auto}\n.u-block-5698-18 {font-size: 1rem; letter-spacing: normal; font-weight: 700; text-transform: uppercase}\n.u-block-5698-16 {font-size: 1.25rem} }</style>\n  <style data-mode=\"SM\" wfd-invisible=\"true\">@media (max-width: 767px) and (min-width: 576px){ .u-block-5698-1 {background-image: none}\n.u-block-5698-2 {min-height: 88px}\n.u-block-5698-34 {margin-top: 12.5px; margin-right: auto; margin-bottom: 0px; margin-left: 36px}\n.u-block-5698-23 {margin-top: -45px; margin-right: 0px; margin-bottom: 0px; margin-left: auto; width: auto}\n.u-block-5698-29 {font-size: 1.25rem}\n.u-block-5698-11 {margin-top: -32px; margin-right: 0px; margin-bottom: 37.3px; margin-left: auto}\n.u-block-5698-18 {font-size: 1rem; letter-spacing: normal; font-weight: 700; text-transform: uppercase}\n.u-block-5698-16 {font-size: 1.25rem} }</style>\n  <style data-mode=\"XS\" wfd-invisible=\"true\" data-visited=\"true\">@media (max-width: 575px){ .u-block-5698-1 {background-image: none}\n.u-block-5698-2 {min-height: 88px}\n.u-block-5698-34 {margin-top: 12.5px; margin-right: auto; margin-bottom: 0px; margin-left: 36px}\n.u-block-5698-23 {margin-top: -45px; margin-right: 0px; margin-bottom: 0px; margin-left: auto; width: auto}\n.u-block-5698-29 {font-size: 1.25rem}\n.u-block-5698-11 {margin-top: -32px; margin-right: 0px; margin-bottom: 37.3px; margin-left: auto}\n.u-block-5698-18 {font-size: 1rem; letter-spacing: normal; font-weight: 700; text-transform: uppercase}\n.u-block-5698-16 {font-size: 1.25rem} }</style>\n</section>","footerHtml":"<section class=\"u-align-center u-clearfix u-custom-color-1 u-footer u-block-f226-1\" custom-posts-hash=\"T\" data-style=\"footer-1-text\" data-post-id=\"post10\" data-section-properties=\"{&quot;grid-spacing&quot;:&quot;30&quot;,&quot;spacingAdditional&quot;:&quot;none&quot;,&quot;align&quot;:&quot;&quot;,&quot;stretch&quot;:true}\" id=\"sec-65c1\" data-source=\"\" data-id=\"f226\">\n  <div class=\"u-clearfix u-sheet u-block-f226-2\">\n    \n  <a href=\"#\" class=\"u-active-none u-btn u-btn-rectangle u-button-style u-hover-none u-none u-block-f226-7\">​​<span class=\"u-icon u-block-f226-8\"><svg xmlns=\"http://www.w3.org/2000/svg\" xmlns:xlink=\"http://www.w3.org/1999/xlink\" version=\"1.1\" xml:space=\"preserve\" class=\"u-svg-content\" viewBox=\"0 0 405.333 405.333\" x=\"0px\" y=\"0px\" style=\"width: 1em; height: 1em;\" data-color=\"#000000\"><path d=\"M373.333,266.88c-25.003,0-49.493-3.904-72.704-11.563c-11.328-3.904-24.192-0.896-31.637,6.699l-46.016,34.752    c-52.8-28.181-86.592-61.952-114.389-114.368l33.813-44.928c8.512-8.512,11.563-20.971,7.915-32.64    C142.592,81.472,138.667,56.96,138.667,32c0-17.643-14.357-32-32-32H32C14.357,0,0,14.357,0,32    c0,205.845,167.488,373.333,373.333,373.333c17.643,0,32-14.357,32-32V298.88C405.333,281.237,390.976,266.88,373.333,266.88z\"></path></svg></span>&nbsp;+1 ​809-256-8802</a><div class=\"u-clearfix u-group-elements u-block-f226-12\">\n<div class=\"u-shape u-shape-svg u-text-white u-block-f226-13\"><svg class=\"u-svg-link\" preserveAspectRatio=\"none\" viewBox=\"0 0 110 160\" style=\"\"><use xlink:href=\"#svg-e527\"></use></svg><svg xmlns=\"http://www.w3.org/2000/svg\" xmlns:xlink=\"http://www.w3.org/1999/xlink\" version=\"1.1\" xml:space=\"preserve\" class=\"u-svg-content\" viewBox=\"0 0 110 160\" x=\"0px\" y=\"0px\" id=\"svg-e527\" data-color=\"#000000\"><path d=\"M55,0C24.6,0,0,24.6,0,55s55,105,55,105s55-74.6,55-105S85.4,0,55,0z M55,80c-13.8,0-25-11.2-25-25s11.2-25,25-25\n\ts25,11.2,25,25S68.8,80,55,80z\"></path></svg></div><p class=\"u-text u-block-f226-14\">Calle Penetración esq. Rojas #25</p></div><div class=\"u-clearfix u-group-elements u-block-f226-9\">\n<div class=\"u-shape u-shape-svg u-text-white u-block-f226-10\"><svg class=\"u-svg-link\" preserveAspectRatio=\"none\" viewBox=\"0 0 160 120\" style=\"\"><use xlink:href=\"#svg-949a\"></use></svg><svg xmlns=\"http://www.w3.org/2000/svg\" xmlns:xlink=\"http://www.w3.org/1999/xlink\" version=\"1.1\" xml:space=\"preserve\" class=\"u-svg-content\" viewBox=\"0 0 160 120\" x=\"0px\" y=\"0px\" id=\"svg-949a\" style=\"enable-background:new 0 0 160 120;\" data-color=\"#000000\"><g>\n\t<path d=\"M159.9,12.2c0-0.2,0.1-0.4,0.1-0.6l-48.8,49.5L160,109c0-0.3-0.1-0.7-0.1-1V12.2L159.9,12.2z\"></path>\n\t<path d=\"M103.7,68.7L83.8,88.9c-1,1-2.3,1.5-3.6,1.5c-1.3,0-2.6-0.5-3.6-1.5L56.7,69.4L7.6,119.2c1.2,0.5,2.5,0.8,3.8,0.8h137.4\n\t\tc2,0,3.9-0.6,5.5-1.6L103.7,68.7z\"></path>\n\t<path d=\"M80.1,77.4l74.5-75.6c-1.7-1.1-3.7-1.8-5.8-1.8H11.5C8.8,0,6.2,1.1,4.3,2.8L80.1,77.4z\"></path>\n\t<path d=\"M0,14v94c0,1.1,0.2,2.1,0.5,3.1L49,62L0,14z\"></path>\n</g></svg></div><p class=\"u-text u-block-f226-11\">Info@gamercave.com</p></div><p class=\"u-text u-block-f226-15\">Nuestro blog siempre se complace en responderles:</p><h2 class=\"u-text u-text-default u-block-f226-16\">SIGUENOS EN NUESTRAS REDES</h2><div class=\"u-social-icons u-spacing-20 u-block-f226-17\">\n                <a class=\"u-social-url\" title=\"facebook\" target=\"_blank\" href=\"https://facebook.com/name\"><span class=\"u-icon u-social-facebook u-social-icon u-text-custom-color-4 u-block-f226-18\"><svg class=\"u-svg-link\" preserveAspectRatio=\"xMidYMin slice\" viewBox=\"0 0 512 512\" style=\"\"><use xmlns:xlink=\"http://www.w3.org/1999/xlink\" xlink:href=\"#svg-37d5\"></use></svg><svg xmlns=\"http://www.w3.org/2000/svg\" xmlns:xlink=\"http://www.w3.org/1999/xlink\" version=\"1.1\" xml:space=\"preserve\" class=\"u-svg-content\" viewBox=\"0 0 512 512\" id=\"svg-37d5\" data-color=\"rgb(0, 0, 0)\"><path d=\"m512 256c0-141.4-114.6-256-256-256s-256 114.6-256 256 114.6 256 256 256c1.5 0 3 0 4.5-.1v-199.2h-55v-64.1h55v-47.2c0-54.7 33.4-84.5 82.2-84.5 23.4 0 43.5 1.7 49.3 2.5v57.2h-33.6c-26.5 0-31.7 12.6-31.7 31.1v40.8h63.5l-8.3 64.1h-55.2v189.5c107-30.7 185.3-129.2 185.3-246.1z\"></path></svg></span>\n                </a>\n                <a class=\"u-social-url\" title=\"twitter\" target=\"_blank\" href=\"https://twitter.com/name\"><span class=\"u-icon u-social-icon u-social-twitter u-text-custom-color-4 u-block-f226-19\"><svg class=\"u-svg-link\" preserveAspectRatio=\"xMidYMin slice\" viewBox=\"0 0 1200 1200\" style=\"\"><use xmlns:xlink=\"http://www.w3.org/1999/xlink\" xlink:href=\"#svg-86da\"></use></svg><svg xmlns=\"http://www.w3.org/2000/svg\" xmlns:xlink=\"http://www.w3.org/1999/xlink\" version=\"1.1\" xml:space=\"preserve\" class=\"u-svg-content\" viewBox=\"0 0 1200 1200\" x=\"0px\" y=\"0px\" id=\"svg-86da\" style=\"enable-background:new 0 0 1200 1200;\" data-color=\"#000000\"><g><polygon points=\"334.1,309.2 769.1,890.8 867.6,890.8 432.6,309.2 \t\"></polygon><path d=\"M600,18C278.6,18,18,278.6,18,600s260.6,582,582,582s582-260.6,582-582S921.4,18,600,18z M745.9,937.2l-198-264.8\n\t\tL302.7,937.2h-63l279.9-302.4l-278.2-372h214.4l182.4,243.8L864,262.8h63L666.4,544.3l293.8,392.9H745.9z\"></path>\n</g></svg></span>\n                </a>\n                <a class=\"u-social-url\" title=\"instagram\" target=\"_blank\" href=\"https://instagram.com/name\"><span class=\"u-icon u-social-icon u-social-instagram u-text-custom-color-4 u-block-f226-20\"><svg class=\"u-svg-link\" preserveAspectRatio=\"xMidYMin slice\" viewBox=\"0 0 512 512\" style=\"\"><use xmlns:xlink=\"http://www.w3.org/1999/xlink\" xlink:href=\"#svg-cc06\"></use></svg><svg xmlns=\"http://www.w3.org/2000/svg\" xmlns:xlink=\"http://www.w3.org/1999/xlink\" version=\"1.1\" xml:space=\"preserve\" class=\"u-svg-content\" viewBox=\"0 0 512 512\" id=\"svg-cc06\" data-color=\"rgb(0, 0, 0)\"><path d=\"m305 256c0 27.0625-21.9375 49-49 49s-49-21.9375-49-49 21.9375-49 49-49 49 21.9375 49 49zm0 0\"></path><path d=\"m370.59375 169.304688c-2.355469-6.382813-6.113281-12.160157-10.996094-16.902344-4.742187-4.882813-10.515625-8.640625-16.902344-10.996094-5.179687-2.011719-12.960937-4.40625-27.292968-5.058594-15.503906-.707031-20.152344-.859375-59.402344-.859375-39.253906 0-43.902344.148438-59.402344.855469-14.332031.65625-22.117187 3.050781-27.292968 5.0625-6.386719 2.355469-12.164063 6.113281-16.902344 10.996094-4.882813 4.742187-8.640625 10.515625-11 16.902344-2.011719 5.179687-4.40625 12.964843-5.058594 27.296874-.707031 15.5-.859375 20.148438-.859375 59.402344 0 39.25.152344 43.898438.859375 59.402344.652344 14.332031 3.046875 22.113281 5.058594 27.292969 2.359375 6.386719 6.113281 12.160156 10.996094 16.902343 4.742187 4.882813 10.515624 8.640626 16.902343 10.996094 5.179688 2.015625 12.964844 4.410156 27.296875 5.0625 15.5.707032 20.144532.855469 59.398438.855469 39.257812 0 43.90625-.148437 59.402344-.855469 14.332031-.652344 22.117187-3.046875 27.296874-5.0625 12.820313-4.945312 22.953126-15.078125 27.898438-27.898437 2.011719-5.179688 4.40625-12.960938 5.0625-27.292969.707031-15.503906.855469-20.152344.855469-59.402344 0-39.253906-.148438-43.902344-.855469-59.402344-.652344-14.332031-3.046875-22.117187-5.0625-27.296874zm-114.59375 162.179687c-41.691406 0-75.488281-33.792969-75.488281-75.484375s33.796875-75.484375 75.488281-75.484375c41.6875 0 75.484375 33.792969 75.484375 75.484375s-33.796875 75.484375-75.484375 75.484375zm78.46875-136.3125c-9.742188 0-17.640625-7.898437-17.640625-17.640625s7.898437-17.640625 17.640625-17.640625 17.640625 7.898437 17.640625 17.640625c-.003906 9.742188-7.898437 17.640625-17.640625 17.640625zm0 0\"></path><path d=\"m256 0c-141.363281 0-256 114.636719-256 256s114.636719 256 256 256 256-114.636719 256-256-114.636719-256-256-256zm146.113281 316.605469c-.710937 15.648437-3.199219 26.332031-6.832031 35.683593-7.636719 19.746094-23.246094 35.355469-42.992188 42.992188-9.347656 3.632812-20.035156 6.117188-35.679687 6.832031-15.675781.714844-20.683594.886719-60.605469.886719-39.925781 0-44.929687-.171875-60.609375-.886719-15.644531-.714843-26.332031-3.199219-35.679687-6.832031-9.8125-3.691406-18.695313-9.476562-26.039063-16.957031-7.476562-7.339844-13.261719-16.226563-16.953125-26.035157-3.632812-9.347656-6.121094-20.035156-6.832031-35.679687-.722656-15.679687-.890625-20.6875-.890625-60.609375s.167969-44.929688.886719-60.605469c.710937-15.648437 3.195312-26.332031 6.828125-35.683593 3.691406-9.808594 9.480468-18.695313 16.960937-26.035157 7.339844-7.480469 16.226563-13.265625 26.035157-16.957031 9.351562-3.632812 20.035156-6.117188 35.683593-6.832031 15.675781-.714844 20.683594-.886719 60.605469-.886719s44.929688.171875 60.605469.890625c15.648437.710937 26.332031 3.195313 35.683593 6.824219 9.808594 3.691406 18.695313 9.480468 26.039063 16.960937 7.476563 7.34375 13.265625 16.226563 16.953125 26.035157 3.636719 9.351562 6.121094 20.035156 6.835938 35.683593.714843 15.675781.882812 20.683594.882812 60.605469s-.167969 44.929688-.886719 60.605469zm0 0\"></path></svg></span>\n                </a>\n                <a class=\"u-social-url\" target=\"_blank\" data-type=\"Custom\" title=\"linkedin\" href=\"https://linkedin.com/name\"><span class=\"u-icon u-social-custom u-social-icon u-text-custom-color-4 u-block-f226-21\"><svg class=\"u-svg-link\" preserveAspectRatio=\"xMidYMin slice\" viewBox=\"0 0 512 512\" style=\"\"><use xmlns:xlink=\"http://www.w3.org/1999/xlink\" xlink:href=\"#svg-3165\"></use></svg><svg xmlns=\"http://www.w3.org/2000/svg\" xmlns:xlink=\"http://www.w3.org/1999/xlink\" version=\"1.1\" xml:space=\"preserve\" class=\"u-svg-content\" viewBox=\"0 0 512 512\" id=\"svg-3165\" data-color=\"rgb(0, 0, 0)\"><path d=\"m256 0c-141.363281 0-256 114.636719-256 256s114.636719 256 256 256 256-114.636719 256-256-114.636719-256-256-256zm-74.390625 387h-62.347656v-187.574219h62.347656zm-31.171875-213.1875h-.40625c-20.921875 0-34.453125-14.402344-34.453125-32.402344 0-18.40625 13.945313-32.410156 35.273437-32.410156 21.328126 0 34.453126 14.003906 34.859376 32.410156 0 18-13.53125 32.402344-35.273438 32.402344zm255.984375 213.1875h-62.339844v-100.347656c0-25.21875-9.027343-42.417969-31.585937-42.417969-17.222656 0-27.480469 11.601563-31.988282 22.800781-1.648437 4.007813-2.050781 9.609375-2.050781 15.214844v104.75h-62.34375s.816407-169.976562 0-187.574219h62.34375v26.558594c8.285157-12.78125 23.109375-30.960937 56.1875-30.960937 41.019531 0 71.777344 26.808593 71.777344 84.421874zm0 0\"></path></svg></span>\n                </a>\n                <a class=\"u-social-url\" target=\"_blank\" data-type=\"Custom\" title=\"pinterest\" href=\"https://pinterest.com/name\"><span class=\"u-icon u-social-custom u-social-icon u-text-custom-color-4 u-block-f226-22\"><svg class=\"u-svg-link\" preserveAspectRatio=\"xMidYMin slice\" viewBox=\"0 0 97.75 97.75\" style=\"\"><use xmlns:xlink=\"http://www.w3.org/1999/xlink\" xlink:href=\"#svg-0a2f\"></use></svg><svg xmlns=\"http://www.w3.org/2000/svg\" xmlns:xlink=\"http://www.w3.org/1999/xlink\" version=\"1.1\" xml:space=\"preserve\" class=\"u-svg-content\" viewBox=\"0 0 97.75 97.75\" x=\"0px\" y=\"0px\" id=\"svg-0a2f\" style=\"enable-background:new 0 0 97.75 97.75;\" data-color=\"rgb(255, 255, 255)\"><g><path d=\"M48.875,0C21.883,0,0,21.882,0,48.875S21.883,97.75,48.875,97.75S97.75,75.868,97.75,48.875S75.867,0,48.875,0z    M54.499,65.109c-4.521,0-8.773-2.444-10.229-5.219c0,0-2.432,9.645-2.943,11.506c-1.813,6.58-7.146,13.162-7.561,13.701   c-0.289,0.375-0.928,0.258-0.994-0.24c-0.113-0.838-1.475-9.139,0.127-15.909c0.801-3.4,5.383-22.814,5.383-22.814   s-1.334-2.673-1.334-6.625c0-6.205,3.596-10.837,8.074-10.837c3.807,0,5.645,2.859,5.645,6.286c0,3.828-2.436,9.552-3.693,14.856   c-1.051,4.441,2.225,8.064,6.605,8.064c7.933,0,13.272-10.188,13.272-22.261c0-9.174-6.176-16.044-17.418-16.044   c-12.697,0-20.615,9.471-20.615,20.052c0,3.646,1.078,6.221,2.764,8.21c0.773,0.915,0.883,1.283,0.602,2.333   c-0.203,0.771-0.66,2.625-0.854,3.358c-0.279,1.062-1.137,1.44-2.098,1.049c-5.846-2.387-8.572-8.793-8.572-15.994   c0-11.893,10.029-26.154,29.922-26.154c15.985,0,26.506,11.566,26.506,23.984C77.089,52.839,67.956,65.109,54.499,65.109z\"></path>\n</g></svg></span>\n                </a>\n              </div><a href=\"#\" class=\"u-btn u-btn-round u-button-style u-custom-color-4 u-hover-custom-color-5 u-radius u-block-f226-23\">Enviar preguntas​</a><p class=\"u-small-text u-text u-text-variant u-block-f226-6\">Derechos Reservados, GAMERCAVE 2024</p></div>\n  <style data-mode=\"XL\" wfd-invisible=\"true\" data-visited=\"true\">@media (min-width: 1200px){ .u-block-f226-1 {background-image: none}\n.u-block-f226-2 {min-height: 459px}\n.u-block-f226-7 {background-image: none; font-size: 1.25rem; margin-top: 29.2px; margin-right: 24.625px; margin-bottom: 0px; margin-left: auto; padding-top: 0px; padding-bottom: 0px; padding-left: 0px; padding-right: 0px}\n.u-block-f226-12 {width: 284px; min-height: 25.6px; height: auto; margin-top: -34.0126px; margin-right: 378px; margin-bottom: 0px; margin-left: auto}\n.u-block-f226-13 {width: 20px; height: 23px; margin-top: 0; margin-right: auto; margin-bottom: 0; margin-left: 0}\n.u-block-f226-14 {margin-top: -23px; margin-right: -0.0001px; margin-bottom: 0px; margin-left: 27px}\n.u-block-f226-9 {width: 305px; min-height: 28px; height: auto; margin-top: -22.6px; margin-right: auto; margin-bottom: 0px; margin-left: 29px}\n.u-block-f226-10 {width: 35px; height: 28px; margin-top: 0; margin-right: auto; margin-bottom: 0; margin-left: 0}\n.u-block-f226-11 {margin-top: -27px; margin-right: 0; margin-bottom: 0; margin-left: 48px}\n.u-block-f226-15 {font-size: 2.25rem; margin-top: 59.4px; margin-right: 521px; margin-bottom: 0px; margin-left: 0px}\n.u-block-f226-16 {letter-spacing: 4px; font-size: 1.125rem; text-transform: uppercase; font-weight: 400; margin-top: -93.0626px; margin-right: 15px; margin-bottom: 0px; margin-left: auto}\n.u-block-f226-17 {height: 62px; min-height: 16px; width: 390px; min-width: 160px; margin-top: 75.8625px; margin-right: 22.5px; margin-bottom: 0px; margin-left: auto}\n.u-block-f226-19 {height: 48px}\n.u-block-f226-21 {height: 100%}\n.u-block-f226-22 {height: 100%}\n.u-block-f226-23 {--radius: 50px; font-weight: 700; font-size: 0.875rem; letter-spacing: 1px; background-image: none; margin-top: -34px; margin-right: auto; margin-bottom: 0px; margin-left: 0px; padding-top: 10px; padding-right: 212px; padding-bottom: 10px; padding-left: 210px}\n.u-block-f226-6 {width: 417px; margin-top: 100.6px; margin-left: auto; margin-right: auto; margin-bottom: 28.3998px} }</style>\n  <style data-mode=\"LG\" wfd-invisible=\"true\" data-visited=\"true\">@media (max-width: 1199px) and (min-width: 992px){ .u-block-f226-1 {background-image: none}\n.u-block-f226-2 {min-height: 473.471px}\n.u-block-f226-7 {background-image: none; font-size: 1.25rem; margin-top: 29.2px; margin-right: 0px; margin-bottom: 0px; margin-left: 583.125px; padding-top: 0px; padding-bottom: 0px; padding-left: 0px; padding-right: 0px}\n.u-block-f226-12 {width: 284px; min-height: 25.6px; height: auto; margin-top: -34px; margin-right: 378px; margin-bottom: 0px; margin-left: 298.125px}\n.u-block-f226-13 {width: 20px; height: 23px; margin-top: 0; margin-right: auto; margin-bottom: 0; margin-left: 0}\n.u-block-f226-14 {margin-top: -23px; margin-right: -0.0001px; margin-bottom: 0px; margin-left: 27px}\n.u-block-f226-9 {width: 305px; min-height: 28px; height: auto; margin-top: -22.6px; margin-right: auto; margin-bottom: 0px; margin-left: -58.875px}\n.u-block-f226-10 {width: 35px; height: 28px; margin-top: 0; margin-right: auto; margin-bottom: 0; margin-left: 0}\n.u-block-f226-11 {margin-top: -27px; margin-right: 0; margin-bottom: 0; margin-left: 48px}\n.u-block-f226-15 {font-size: 2.25rem; margin-top: 59.2px; margin-right: 410.875px; margin-bottom: 0px; margin-left: -89.875px}\n.u-block-f226-16 {letter-spacing: 4px; font-size: 1.125rem; text-transform: uppercase; font-weight: 400; margin-top: 20px; margin-right: 15px; margin-bottom: 0px; margin-left: 517.125px}\n.u-block-f226-17 {height: 62px; min-height: 16px; width: 390px; min-width: 160px; margin-top: 34px; margin-right: 22.5px; margin-bottom: 0px; margin-left: 639.891px}\n.u-block-f226-19 {height: 48px}\n.u-block-f226-21 {height: 100%}\n.u-block-f226-22 {height: 100%}\n.u-block-f226-23 {--radius: 50px; font-weight: 700; font-size: 0.875rem; letter-spacing: 1px; background-image: none; margin-top: -41.7751px; margin-right: auto; margin-bottom: 0px; margin-left: -89.875px; padding-top: 10px; padding-right: 212px; padding-bottom: 10px; padding-left: 210px}\n.u-block-f226-6 {width: 417px; margin-top: 36.5626px; margin-left: auto; margin-right: auto; margin-bottom: 60px} }</style>\n  <style data-mode=\"MD\" data-visited=\"true\" wfd-invisible=\"true\">@media (max-width: 991px) and (min-width: 768px){ .u-block-f226-1 {background-image: none}\n.u-block-f226-2 {min-height: 459px}\n.u-block-f226-7 {background-image: none; font-size: 1.25rem; margin-top: 32.1876px; margin-right: 255.113px; margin-bottom: 0px; margin-left: auto; padding-top: 0px; padding-bottom: 0px; padding-left: 0px; padding-right: 0px}\n.u-block-f226-12 {width: 284px; min-height: 25.6px; height: auto; margin-top: -31.0001px; margin-right: -39.475px; margin-bottom: 0px; margin-left: auto}\n.u-block-f226-13 {width: 20px; height: 23px; margin-top: 0; margin-right: auto; margin-bottom: 0; margin-left: 0}\n.u-block-f226-14 {margin-top: -23px; margin-right: -0.0001px; margin-bottom: 0px; margin-left: 27px}\n.u-block-f226-9 {width: 305px; min-height: 28px; height: auto; margin-top: -25.6002px; margin-right: auto; margin-bottom: 0px; margin-left: 0px}\n.u-block-f226-10 {width: 35px; height: 28px; margin-top: 0; margin-right: auto; margin-bottom: 0; margin-left: 0}\n.u-block-f226-11 {margin-top: -27px; margin-right: 0; margin-bottom: 0; margin-left: 48px}\n.u-block-f226-15 {font-size: 2.25rem; width: auto; margin-top: 62.2px; margin-right: 35.5px; margin-bottom: 0px; margin-left: 65.5px}\n.u-block-f226-16 {letter-spacing: 4px; font-size: 1.125rem; text-transform: uppercase; font-weight: 400; width: auto; margin-top: 80.2375px; margin-right: 128.5px; margin-bottom: 0px; margin-left: auto}\n.u-block-f226-17 {height: 62px; min-height: 16px; width: 390px; min-width: 160px; margin-top: 20.9626px; margin-right: 136px; margin-bottom: 0px; margin-left: auto}\n.u-block-f226-19 {height: 48px}\n.u-block-f226-21 {height: 100%}\n.u-block-f226-22 {height: 100%}\n.u-block-f226-23 {--radius: 50px; font-weight: 700; font-size: 0.875rem; letter-spacing: 1px; background-image: none; margin-top: -176.55px; margin-right: 57.15px; margin-bottom: 0px; margin-left: auto; padding-top: 10px; padding-right: 212px; padding-bottom: 10px; padding-left: 210px}\n.u-block-f226-6 {width: auto; margin-top: 195.963px; margin-right: 115px; margin-bottom: 10.6px; margin-left: 188px} }</style>\n  <style data-mode=\"SM\" wfd-invisible=\"true\" data-visited=\"true\">@media (max-width: 767px) and (min-width: 576px){ .u-block-f226-1 {background-image: none}\n.u-block-f226-2 {min-height: 459px}\n.u-block-f226-7 {background-image: none; font-size: 1.25rem; margin-top: 32.1876px; margin-right: 75px; margin-bottom: 0px; margin-left: -16.875px; padding-top: 0px; padding-bottom: 0px; padding-left: 0px; padding-right: 0px}\n.u-block-f226-12 {width: 284px; min-height: 25.6px; height: auto; margin-top: 20px; margin-right: 256px; margin-bottom: 0px; margin-left: -33.8749px}\n.u-block-f226-13 {width: 20px; height: 23px; margin-top: 0; margin-right: auto; margin-bottom: 0; margin-left: 0}\n.u-block-f226-14 {margin-top: -23px; margin-right: -0.0001px; margin-bottom: 0px; margin-left: 27px}\n.u-block-f226-9 {width: 305px; min-height: 28px; height: auto; margin-top: -25.6002px; margin-right: auto; margin-bottom: 0px; margin-left: -258.875px}\n.u-block-f226-10 {width: 35px; height: 28px; margin-top: 0; margin-right: auto; margin-bottom: 0; margin-left: 0}\n.u-block-f226-11 {margin-top: -27px; margin-right: 0; margin-bottom: 0; margin-left: 48px}\n.u-block-f226-15 {font-size: 2.25rem; width: auto; margin-top: 62.2px; margin-right: 289.875px; margin-bottom: 0px; margin-left: -289.875px}\n.u-block-f226-16 {letter-spacing: 4px; font-size: 1.125rem; text-transform: uppercase; font-weight: 400; width: auto; margin-top: 80.2375px; margin-right: 129px; margin-bottom: 0px; margin-left: 59.125px}\n.u-block-f226-17 {height: 62px; min-height: 16px; width: 390px; min-width: 160px; margin-top: 20.9626px; margin-right: 136px; margin-bottom: 0px; margin-left: 439.891px}\n.u-block-f226-19 {height: 48px}\n.u-block-f226-21 {height: 100%}\n.u-block-f226-22 {height: 100%}\n.u-block-f226-23 {--radius: 50px; font-weight: 700; font-size: 0.875rem; letter-spacing: 1px; background-image: none; margin-top: -41.7501px; margin-right: 0px; margin-bottom: 0px; margin-left: -289.875px; padding-top: 10px; padding-right: 212px; padding-bottom: 10px; padding-left: 210px}\n.u-block-f226-6 {width: auto; margin-top: 195.963px; margin-right: 25px; margin-bottom: 10.6px; margin-left: 98px} }</style>\n  <style data-mode=\"XS\" wfd-invisible=\"true\" data-visited=\"true\">@media (max-width: 575px){ .u-block-f226-1 {background-image: none}\n.u-block-f226-2 {min-height: 730px}\n.u-block-f226-7 {background-image: none; font-size: 1.25rem; margin-top: 103.95px; margin-left: auto; margin-right: auto; margin-bottom: 0px; padding-top: 0px; padding-bottom: 0px; padding-left: 0px; padding-right: 0px}\n.u-block-f226-12 {width: 284px; min-height: 25.6px; height: auto; margin-top: -71.0001px; margin-left: auto; margin-right: auto; margin-bottom: 0px}\n.u-block-f226-13 {width: 20px; height: 23px; margin-top: 0; margin-right: auto; margin-bottom: 0; margin-left: 0}\n.u-block-f226-14 {margin-top: -23px; margin-right: -0.0001px; margin-bottom: 0px; margin-left: 27px}\n.u-block-f226-9 {width: 305px; min-height: 28px; height: auto; margin-top: -70.5625px; margin-left: auto; margin-right: auto; margin-bottom: 0px}\n.u-block-f226-10 {width: 35px; height: 28px; margin-top: 0; margin-right: auto; margin-bottom: 0; margin-left: 0}\n.u-block-f226-11 {margin-top: -27px; margin-right: 0; margin-bottom: 0; margin-left: 48px}\n.u-block-f226-15 {font-size: 1.25rem; width: auto; margin-top: 179.55px; margin-left: 0px; margin-right: 0px; margin-bottom: 0px}\n.u-block-f226-16 {letter-spacing: 4px; font-size: 1.125rem; text-transform: uppercase; font-weight: 400; width: auto; margin-top: 162.5px; margin-right: auto; margin-bottom: 0px; margin-left: -9.0001px}\n.u-block-f226-17 {height: 39px; min-height: 16px; width: 275px; min-width: 160px; margin-top: 11.7998px; margin-left: auto; margin-right: auto; margin-bottom: 0px}\n.u-block-f226-19 {height: 48px}\n.u-block-f226-21 {height: 100%}\n.u-block-f226-22 {height: 100%}\n.u-block-f226-23 {--radius: 50px; font-weight: 700; font-size: 0.875rem; letter-spacing: 1px; background-image: none; margin-top: -230.9px; margin-left: auto; margin-right: auto; margin-bottom: 0px; padding-top: 10px; padding-right: 93.0344px; padding-bottom: 10px; padding-left: 93px}\n.u-block-f226-6 {width: auto; margin-top: 320.05px; margin-left: auto; margin-right: auto; margin-bottom: 29.7748px} }</style>\n</section>","hideBacklink":null,"dateUpdated":1723172871705,"settings":"{\"colorScheme\":{\"bodyColors\":[\"#111111\",\"#ffffff\"],\"bgColor\":\"#ffffff\",\"colors\":[\"#654aff\",\"#5338ec\",\"#f1c50e\",\"#2cccc4\",\"#b9c1cc\"],\"customColors\":[{\"color\":\"#1b1447\",\"status\":0,\"transparency\":1,\"index\":0},{\"color\":\"#1b1447\",\"status\":1,\"transparency\":1,\"index\":1},{\"color\":\"#a5a5a5\",\"status\":0,\"transparency\":1,\"index\":2},{\"color\":\"#32e81d\",\"status\":0,\"transparency\":1,\"index\":3},{\"color\":\"#3ad228\",\"status\":0,\"transparency\":1,\"index\":4},{\"color\":\"#e0e0e0\",\"status\":0,\"transparency\":1,\"index\":5},{\"color\":\"#3bd12a\",\"status\":0,\"transparency\":1,\"index\":6}],\"shadingContrast\":\"body-alt-color\",\"whiteContrast\":\"body-color\",\"bgContrast\":\"body-color\",\"name\":\"u13\"},\"fontScheme\":{\"name\":\"Montserrat-Raleway\",\"isDefault\":true,\"fonts\":{\"heading\":\"Montserrat, sans-serif\",\"text\":\"Raleway, sans-serif\",\"accent\":\"Arial, sans-serif\",\"headingTitle\":\"Montserrat\",\"textTitle\":\"Raleway\"}},\"typography\":{\"name\":\"custom-page-typography-3\",\"title\":{\"font-size\":4.5,\"line-height\":\"1_1\",\"margin-top\":20,\"margin-bottom\":20,\"SM\":{\"font-size\":3.75},\"XS\":{\"font-size\":3},\"font-weight\":\"800\"},\"subtitle\":{\"font-weight\":\"400\",\"font-size\":2.25,\"line-height\":\"1_1\",\"margin-top\":20,\"margin-bottom\":20,\"XS\":{\"font-size\":1.5}},\"h1\":{\"font-size\":3,\"line-height\":\"1_1\",\"margin-top\":20,\"margin-bottom\":20,\"XS\":{\"font-size\":2.25},\"font-weight\":\"800\"},\"h2\":{\"font-size\":3,\"line-height\":\"1_1\",\"margin-top\":20,\"margin-bottom\":20,\"XS\":{\"font-size\":1.5},\"font-weight\":800,\"font-style\":\"\",\"text-decoration\":\"\",\"text-transform\":\"\",\"letter-spacing\":\"\",\"text-color\":\"\",\"border-color\":\"\",\"border-style\":\"\",\"color\":\"\",\"border\":\"\",\"button-shape\":\"\",\"border-radius\":\"\",\"underline\":\"\",\"gradient\":\"\",\"list-icon-src\":\"\",\"list-icon-spacing\":\"0.3\",\"list-icon-size\":\"0.8\",\"font\":\"heading-font\"},\"h3\":{\"font-size\":1.875,\"line-height\":\"1_2\",\"margin-top\":20,\"margin-bottom\":20,\"XS\":{\"font-size\":1.5},\"font-weight\":\"800\"},\"h4\":{\"font-weight\":\"400\",\"font-size\":1.5,\"line-height\":\"1_2\",\"margin-top\":20,\"margin-bottom\":20},\"h5\":{\"font-weight\":\"400\",\"font-size\":1.25,\"line-height\":\"1_2\",\"margin-top\":20,\"margin-bottom\":20},\"h6\":{\"font-weight\":\"400\",\"font-size\":1.125,\"line-height\":\"1_2\",\"margin-top\":20,\"margin-bottom\":20},\"largeText\":{\"font-size\":1.25,\"margin-top\":20,\"margin-bottom\":20},\"smallText\":{\"font-size\":0.875,\"margin-top\":20,\"margin-bottom\":20},\"text\":{\"margin-top\":20,\"margin-bottom\":20,\"font-size\":0,\"font-style\":\"\",\"text-decoration\":\"\",\"text-transform\":\"\",\"line-height\":1.6,\"letter-spacing\":\"\",\"text-color\":\"\",\"border-color\":\"\",\"border-style\":\"\",\"color\":\"\",\"border\":\"\",\"button-shape\":\"\",\"border-radius\":\"\",\"underline\":\"\",\"gradient\":\"\",\"list-icon-src\":\"\",\"list-icon-spacing\":\"0.3\",\"list-icon-size\":\"0.8\",\"font\":\"\",\"font-weight\":400},\"hyperlink\":{\"text-color\":\"palette-1-base\"},\"link\":{},\"button\":{\"color\":\"palette-2-base\",\"margin-top\":20,\"margin-bottom\":20,\"text-transform\":\"uppercase\"},\"blockquote\":{\"font-style\":\"italic\",\"indent\":20,\"border\":4,\"border-color\":\"palette-1-base\",\"margin-top\":20,\"margin-bottom\":20},\"metadata\":{\"margin-top\":20,\"margin-bottom\":20},\"list\":{\"margin-top\":20,\"margin-bottom\":20},\"orderedlist\":{\"margin-top\":20,\"margin-bottom\":20},\"postContent\":{\"margin-top\":20,\"margin-bottom\":20},\"theme\":{\"gradient\":\"\",\"image\":\"\",\"sheet-width-xl\":1140,\"sheet-width-lg\":940,\"sheet-width-md\":720,\"sheet-width-sm\":540,\"sheet-width-xs\":340},\"htmlBaseSize\":16,\"form-input\":{\"border\":1,\"border-color\":\"grey-30\",\"borders\":\"top right bottom left\",\"color\":\"white\",\"text-color\":\"black\"}},\"backToTop\":\"<span style=\\\"height: 64px; width: 64px; margin-left: 0px; margin-right: auto; margin-top: 0px; background-image: none; right: 20px; bottom: 20px; padding: 27px;\\\" class=\\\"u-back-to-top u-icon u-icon-circle u-opacity u-opacity-85 u-palette-1-base\\\" data-href=\\\"#\\\">\\n        <svg class=\\\"u-svg-link\\\" preserveAspectRatio=\\\"xMidYMin slice\\\" viewBox=\\\"0 0 551.13 551.13\\\">\\n            <use xmlns:xlink=\\\"http://www.w3.org/1999/xlink\\\" xlink:href=\\\"#svg-1d98\\\"></use>\\n        </svg>\\n        <svg class=\\\"u-svg-content\\\" enable-background=\\\"new 0 0 551.13 551.13\\\" viewBox=\\\"0 0 551.13 551.13\\\" xmlns=\\\"http://www.w3.org/2000/svg\\\" id=\\\"svg-1d98\\\">\\n            <path d=\\\"m275.565 189.451 223.897 223.897h51.668l-275.565-275.565-275.565 275.565h51.668z\\\"></path>\\n        </svg>\\n    </span>\",\"themeBackLinks\":\"{\\\"data-wp-back-link\\\":\\\"https://nicepage.com/wordpress-themes\\\",\\\"data-wp-back-link-title\\\":\\\"Free WordPress Themes\\\",\\\"data-jm-back-link\\\":\\\"https://nicepage.com/joomla-templates\\\",\\\"data-jm-back-link-title\\\":\\\"Joomla Templates\\\"}\",\"lang\":\"es\",\"dialog\":[{\"id\":\"1\",\"name\":\"Ventana emergente de Pago\",\"type\":\"payment\",\"sectionAnchorId\":\"sec-178a\",\"html\":\"<section class=\\\"u-black u-clearfix u-container-style u-dialog-block u-dialog-open u-opacity u-opacity-70 u-payment-dialog u-valign-middle u-block-b61c-1\\\" style=\\\"\\\" data-id=\\\"b61c\\\" data-posts-content=\\\"[{'images':[],'maps':[],'videos':[],'icons':[{}],'textWidth':'','textHeight':'','id':1,'groupId':1,'headingProp':'h5','textProp':'text'},{'images':[],'maps':[],'videos':[],'icons':[],'textWidth':'','textHeight':'','id':2,'groupId':1,'headingProp':'h5','textProp':'text'}]\\\" custom-posts-hash=\\\"[T,T,T]\\\" data-section-content=\\\"{'images':[],'headings':[{'repeater':true,'length':44,'cellsCount':1},{'repeater':false,'length':30,'cellsCount':1}],'texts':[{'repeater':true,'length':120,'cellsCount':1}],'tables':[],'customLists':[],'accordions':[],'textGroupCount':3,'textLength':168}\\\" data-style=\\\"payment-dialog\\\" id=\\\"sec-178a\\\" data-source=\\\"Sketch\\\">\\n  <div style=\\\"width: 570px; min-height: 578px; height: auto; box-shadow: 0px 0px 8px 0px rgba(var(--black-r),var(--black-g),var(--black-b),0.2); margin-top: 60px; margin-bottom: 60px; margin-left: auto; margin-right: auto\\\" class=\\\"u-align-center u-container-style u-dialog u-radius-25 u-shape-round u-white u-block-b61c-2\\\">\\n    <div class=\\\"u-container-layout u-valign-top u-block-b61c-3\\\" style=\\\"padding-top: 34px; padding-bottom: 34px; padding-left: 35px; padding-right: 35px\\\">\\n      <h5 class=\\\"u-align-left u-text u-block-b61c-26\\\" style=\\\"font-weight: 700; margin-top: 0px; margin-right: 165.016px; margin-bottom: 0px; margin-left: 0px\\\">Buy Now</h5>\\n      <div class=\\\"u-expanded-width u-products u-block-b61c-5\\\" style=\\\"margin-top: 30px; margin-bottom: 0px\\\" data-site-sorting-prop=\\\"created\\\" data-site-sorting-order=\\\"desc\\\">\\n        <div class=\\\"u-list-control\\\"></div>\\n        <div class=\\\"u-repeater u-block-b61c-6\\\" style=\\\"grid-template-columns: 100%; min-height: 206px; grid-gap: 10px\\\">\\n          <div class=\\\"u-container-style u-products-item u-repeater-item u-block-b61c-7\\\" style=\\\"\\\">\\n            <div class=\\\"u-container-layout u-similar-container u-block-b61c-8\\\" style=\\\"padding-top: 0px; padding-left: 0px; padding-right: 0px; padding-bottom: 30px\\\">\\n              <h5 class=\\\"u-align-left u-product-control u-text u-block-b61c-27\\\" style=\\\"background-image: none; margin-top: 0px; margin-bottom: 0px; margin-left: 0px; margin-right: 0px\\\">\\n                <a class=\\\"u-product-title-link\\\" href=\\\"#\\\">Product 1 Title</a>\\n              </h5>\\n              <div class=\\\"u-align-left u-product-control u-product-desc u-text u-block-b61c-29\\\" style=\\\"font-size: 0.875rem; margin-top: 20px; margin-left: 0px; margin-right: 0px; margin-bottom: 0px\\\">\\n                <p>Sample text. Lorem ipsum dolor sit amet, consectetur adipiscing elit nullam nunc justo sagittis suscipit ultrices.</p>\\n              </div>\\n              <div class=\\\"u-align-left u-product-control u-product-quantity u-block-b61c-35\\\" style=\\\"width: 125px; margin-top: 30px; margin-right: auto; margin-bottom: 0px; margin-left: 0px\\\">\\n                <div class=\\\"u-hidden u-quantity-label\\\">Quantity</div>\\n                <div class=\\\"u-border-1 u-border-grey-30 u-quantity-input u-radius-50\\\">\\n                  <a class=\\\"disabled minus u-button-style u-quantity-button u-text-body-color\\\">\\n                    <svg xmlns=\\\"http://www.w3.org/2000/svg\\\" viewBox=\\\"0 0 16 16\\\"><path d=\\\"m 4 8 h 8\\\" fill=\\\"none\\\" stroke=\\\"currentColor\\\" stroke-width=\\\"1\\\" fill-rule=\\\"evenodd\\\"></path></svg>\\n                  </a>\\n                  <input class=\\\"u-input u-block-b61c-36\\\" type=\\\"text\\\" value=\\\"1\\\" pattern=\\\"[0-9]+\\\" style=\\\"\\\">\\n                  <a class=\\\"plus u-button-style u-quantity-button u-text-body-color\\\">\\n                    <svg xmlns=\\\"http://www.w3.org/2000/svg\\\" viewBox=\\\"0 0 16 16\\\"><path d=\\\"m 4 8 h 8 M 8 4 v 8\\\" fill=\\\"none\\\" stroke=\\\"currentColor\\\" stroke-width=\\\"1\\\" fill-rule=\\\"evenodd\\\"></path></svg>\\n                  </a>\\n                </div>\\n              </div>\\n              <div data-add-zero-cents=\\\"true\\\" class=\\\"u-align-left u-product-control u-product-price u-block-b61c-12\\\" style=\\\"margin-top: -34px; margin-right: 0px; margin-bottom: 0px; margin-left: auto\\\">\\n                <div class=\\\"u-price-wrapper u-spacing-10\\\">\\n                  <div class=\\\"u-old-price\\\" style=\\\"text-decoration: line-through !important;\\\">$20.00</div>\\n                  <div class=\\\"u-price\\\" style=\\\"font-size: 1.25rem; font-weight: 700;\\\">$17.00</div>\\n                </div>\\n              </div>\\n            </div>\\n          </div>\\n        </div>\\n        <div class=\\\"u-list-control\\\"></div>\\n      </div>\\n      <div class=\\\"u-expanded-width u-payment-services u-tab-links-align-justify u-tab-payment u-tab-vertical u-tabs u-block-b61c-38\\\" data-payment-order-approved-message=\\\"Your order has been approved. Thank you!\\\" data-payment-order-cancelled-message=\\\"Unable to process your order. Please try again later.\\\" style=\\\"min-height: 250px; min-width: 50px; margin-top: 0px; margin-bottom: 0px; margin-left: 0px; margin-right: 0px\\\">\\n        <ul class=\\\"u-tab-list u-unstyled u-block-b61c-39\\\" role=\\\"tablist\\\" style=\\\"\\\"><li class=\\\"u-tab-item u-block-b61c-40\\\" role=\\\"presentation\\\" style=\\\"\\\"><a class=\\\"active u-active-grey-10 u-button-style u-payment-paypal u-tab-link u-text-body-color u-block-b61c-41\\\" id=\\\"link-tab-9cb3\\\" href=\\\"#tab-9cb3\\\" role=\\\"tab\\\" aria-controls=\\\"tab-9cb3\\\" aria-selected=\\\"true\\\" style=\\\"\\\"><input type=\\\"radio\\\" class=\\\"u-field-input u-grey-15 u-radius-15\\\" name=\\\"payment-group\\\" checked=\\\"checked\\\"><span>Paypal</span><svg class=\\\"u-svg-content\\\" xmlns=\\\"http://www.w3.org/2000/svg\\\" x=\\\"0px\\\" y=\\\"0px\\\"><path fill=\\\"#009EE3\\\" d=\\\"M11,5.9H18c3.8,0,5.2,1.9,4.9,4.7c-0.3,4.7-3.2,7.2-6.9,7.2h-1.9c-0.5,0-0.8,0.3-0.9,1.3l-0.8,4.3\\n  c-0.1,0.3-0.2,0.5-0.5,0.6H7.6c-0.4,0-0.5-0.3-0.4-1l2.6-16C9.9,6.3,10.2,5.9,11,5.9z\\\"></path><path fill=\\\"#113984\\\" d=\\\"M6.7,0h7.1c2,0,4.3,0.1,5.9,1.5c1.1,0.9,1.6,2.4,1.5,4c-0.4,5.4-3.7,8.5-8,8.5H9.6c-0.6,0-0.9,0.4-1.2,1.5\\n  l-0.9,5.1C7.4,21,7.3,21.3,7,21.3H2.6C2,21.3,1.9,21,2,20.1L5.2,1.3C5.3,0.4,5.7,0,6.7,0z\\\"></path><path fill=\\\"#172C70\\\" d=\\\"M8.6,14.8l1.3-7.9c0.1-0.7,0.5-1,1.3-1h7.1c1.2,0,2.1,0.2,2.8,0.5c-0.7,4.8-3.8,7.5-7.9,7.5H9.6\\n  C9.1,13.9,8.8,14.1,8.6,14.8z\\\"></path></svg>\\n</a>\\n</li><li class=\\\"u-tab-item u-block-b61c-42\\\" role=\\\"presentation\\\" style=\\\"\\\"><a class=\\\"u-active-grey-10 u-button-style u-payment-stripe u-tab-link u-text-body-color u-block-b61c-43\\\" id=\\\"link-tab-ab80\\\" href=\\\"#tab-ab80\\\" role=\\\"tab\\\" aria-controls=\\\"tab-ab80\\\" aria-selected=\\\"false\\\" style=\\\"\\\"><input type=\\\"radio\\\" class=\\\"u-field-input u-grey-15 u-radius-15\\\" name=\\\"payment-group\\\"><span>Stripe</span><svg class=\\\"u-svg-content\\\" xmlns=\\\"http://www.w3.org/2000/svg\\\" x=\\\"0px\\\" y=\\\"0px\\\" viewBox=\\\"0 0 24 24\\\"><path fill=\\\"#635BFF\\\" d=\\\"M14,9.2c-2.3-0.8-3.4-1.5-3.4-2.4c0-0.8,0.8-1.3,2-1.3c2.3,0,4.7,0.8,6.4,1.6l0.9-5.5\\n  c-1.3-0.5-4-1.6-7.7-1.6C9.6,0,7.5,0.7,5.8,1.9C4.1,3.2,3.4,4.9,3.4,7.2c0,4,2.6,5.7,6.8,7.2c2.7,0.9,3.6,1.6,3.6,2.5\\n  c0,0.9-0.9,1.6-2.4,1.6c-1.9,0-5.2-0.9-7.3-2.1L3,22c1.8,0.9,5.1,2,8.7,2c2.8,0,5.1-0.7,6.6-1.9c1.8-1.3,2.7-3.2,2.7-5.7\\n  C20.9,12.3,18.2,10.7,14,9.2L14,9.2z\\\"></path></svg>\\n</a>\\n</li></ul>\\n        <div class=\\\"u-tab-content u-block-b61c-44\\\" style=\\\"\\\">\\n          <div class=\\\"u-container-style u-payment-paypal u-tab-active u-tab-pane u-block-b61c-45\\\" id=\\\"tab-9cb3\\\" role=\\\"tabpanel\\\" aria-labelledby=\\\"link-tab-9cb3\\\" style=\\\"\\\">\\n            <div class=\\\"u-container-layout u-payment-services-inner u-block-b61c-46\\\" style=\\\"padding-top: 20px; padding-right: 0; padding-bottom: 0; padding-left: 0\\\" data-payment-loading-message=\\\"Loading...\\\">Here you will see the payment buttons on the live website.</div>\\n          </div>\\n          <div class=\\\"u-container-style u-payment-stripe u-tab-pane u-block-b61c-47\\\" id=\\\"tab-ab80\\\" role=\\\"tabpanel\\\" aria-labelledby=\\\"link-tab-ab80\\\" style=\\\"\\\">\\n            <div class=\\\"u-container-layout u-block-b61c-48\\\" style=\\\"padding-top: 20px; padding-right: 0; padding-bottom: 0; padding-left: 0\\\">\\n              <a href=\\\"#\\\" class=\\\"u-btn u-button-style u-stripe-button u-block-b61c-49\\\" style=\\\"width: 100%; margin-top: 0; margin-bottom: 0; margin-left: auto; margin-right: auto\\\">Pay with Stripe</a>\\n            </div>\\n          </div>\\n        </div>\\n      </div>\\n    </div><button class=\\\"u-dialog-close-button u-icon u-text-grey-40 u-block-b61c-4\\\" style=\\\"width: 20.0939px; height: 20.0939px; left: auto; top: 35.9532px; position: absolute; right: 35px; padding-top: 0px; padding-bottom: 0px; padding-left: 0px; padding-right: 0px\\\"><svg class=\\\"u-svg-link\\\" preserveAspectRatio=\\\"xMidYMin slice\\\" viewBox=\\\"0 0 16 16\\\" style=\\\"\\\"><use xmlns:xlink=\\\"http://www.w3.org/1999/xlink\\\" xlink:href=\\\"#svg-efe9\\\"></use></svg><svg xmlns=\\\"http://www.w3.org/2000/svg\\\" xmlns:xlink=\\\"http://www.w3.org/1999/xlink\\\" version=\\\"1.1\\\" xml:space=\\\"preserve\\\" class=\\\"u-svg-content\\\" viewBox=\\\"0 0 16 16\\\" x=\\\"0px\\\" y=\\\"0px\\\" id=\\\"svg-efe9\\\"><rect x=\\\"7\\\" y=\\\"0\\\" transform=\\\"matrix(0.7071 -0.7071 0.7071 0.7071 -3.3138 8.0002)\\\" width=\\\"2\\\" height=\\\"16\\\"></rect><rect x=\\\"0\\\" y=\\\"7\\\" transform=\\\"matrix(0.7071 -0.7071 0.7071 0.7071 -3.3138 8.0002)\\\" width=\\\"16\\\" height=\\\"2\\\"></rect></svg></button>\\n  </div>\\n  <style data-mode=\\\"XL\\\" data-visited=\\\"true\\\">@media (max-width: 0px) { .u-block-b61c-2 {width: 570px; min-height: 578px; height: auto; box-shadow: 0px 0px 8px 0px rgba(var(--black-r),var(--black-g),var(--black-b),0.2); margin-top: 60px; margin-bottom: 60px; margin-left: auto; margin-right: auto}\\n.u-block-b61c-3 {padding-top: 34px; padding-bottom: 34px; padding-left: 35px; padding-right: 35px}\\n.u-block-b61c-26 {font-weight: 700; margin-top: 0px; margin-right: 165.016px; margin-bottom: 0px; margin-left: 0px}\\n.u-block-b61c-5 {margin-top: 30px; margin-bottom: 0px}\\n.u-block-b61c-6 {grid-template-columns: 100%; min-height: 206px; grid-gap: 10px}\\n.u-block-b61c-8 {padding-top: 0px; padding-left: 0px; padding-right: 0px; padding-bottom: 30px}\\n.u-block-b61c-27 {background-image: none; margin-top: 0px; margin-bottom: 0px; margin-left: 0px; margin-right: 0px}\\n.u-block-b61c-29 {font-size: 0.875rem; margin-top: 20px; margin-left: 0px; margin-right: 0px; margin-bottom: 0px}\\n.u-block-b61c-35 {width: 125px; margin-top: 30px; margin-right: auto; margin-bottom: 0px; margin-left: 0px}\\n.u-block-b61c-12 {margin-top: -34px; margin-right: 0px; margin-bottom: 0px; margin-left: auto}\\n.u-block-b61c-38 {min-height: 250px; min-width: 50px; margin-top: 0px; margin-bottom: 0px; margin-left: 0px; margin-right: 0px}\\n.u-block-b61c-46 {padding-top: 20px; padding-right: 0; padding-bottom: 0; padding-left: 0}\\n.u-block-b61c-48 {padding-top: 20px; padding-right: 0; padding-bottom: 0; padding-left: 0}\\n.u-block-b61c-49 {width: 100%; margin-top: 0; margin-bottom: 0; margin-left: auto; margin-right: auto}\\n.u-block-b61c-4 {width: 20.0939px; height: 20.0939px; left: auto; top: 35.9532px; position: absolute; right: 35px; padding-top: 0px; padding-bottom: 0px; padding-left: 0px; padding-right: 0px} }</style>\\n  <style data-mode=\\\"LG\\\" data-visited=\\\"true\\\">@media (max-width: 0px) { .u-block-b61c-2 {box-shadow: 0px 0px 8px 0px rgba(var(--black-r),var(--black-g),var(--black-b),0.2); width: 570px; height: auto; margin-top: 60px; margin-left: auto; margin-right: auto; margin-bottom: 60px; min-height: 578px}\\n.u-block-b61c-3 {padding-top: 34px; padding-bottom: 34px; padding-left: 35px; padding-right: 35px}\\n.u-block-b61c-26 {font-weight: 700; margin-top: 0px; margin-right: 165px; margin-bottom: 0px; margin-left: 0px}\\n.u-block-b61c-5 {margin-top: 30px; margin-bottom: 0px}\\n.u-block-b61c-6 {grid-template-columns: 100%; min-height: 206px; grid-gap: 10px}\\n.u-block-b61c-8 {padding-top: 0px; padding-left: 0px; padding-right: 0px; padding-bottom: 30px}\\n.u-block-b61c-27 {background-image: none; margin-top: 0px; margin-bottom: 0px; margin-left: 0px; margin-right: 0px}\\n.u-block-b61c-29 {font-size: 0.875rem; margin-top: 20px; margin-left: 0px; margin-right: 0px; margin-bottom: 0px}\\n.u-block-b61c-35 {width: 125px; margin-top: 30px; margin-right: auto; margin-bottom: 0px; margin-left: 0px}\\n.u-block-b61c-12 {margin-top: -34px; margin-right: 0px; margin-bottom: 0px; margin-left: auto}\\n.u-block-b61c-38 {min-height: 250px; min-width: 50px; margin-top: 0px; margin-bottom: 0px}\\n.u-block-b61c-46 {padding-top: 20px; padding-bottom: 0; padding-left: 0; padding-right: 0}\\n.u-block-b61c-48 {padding-top: 20px; padding-bottom: 0; padding-left: 0; padding-right: 0}\\n.u-block-b61c-49 {width: 100%; margin-top: 0; margin-bottom: 0; margin-left: auto; margin-right: auto}\\n.u-block-b61c-4 {width: 20.0939px; height: 20.0939px; left: auto; top: 35.9532px; position: absolute; right: 35px; padding-top: 0px; padding-bottom: 0px; padding-left: 0px; padding-right: 0px} }</style>\\n  <style data-mode=\\\"MD\\\" data-visited=\\\"true\\\">@media (max-width: 0px) { .u-block-b61c-2 {box-shadow: 0px 0px 8px 0px rgba(var(--black-r),var(--black-g),var(--black-b),0.2); width: 570px; height: auto; margin-top: 60px; margin-left: auto; margin-right: auto; margin-bottom: 60px; min-height: 578px}\\n.u-block-b61c-3 {padding-top: 30px; padding-bottom: 30px; padding-left: 30px; padding-right: 30px}\\n.u-block-b61c-26 {font-weight: 700; margin-top: 0px; margin-right: 165px; margin-bottom: 0px; margin-left: 0px}\\n.u-block-b61c-5 {margin-top: 30px; margin-bottom: 0px}\\n.u-block-b61c-6 {grid-template-columns: 100%; min-height: 206px; grid-gap: 10px}\\n.u-block-b61c-8 {padding-top: 0px; padding-left: 0px; padding-right: 0px; padding-bottom: 30px}\\n.u-block-b61c-27 {background-image: none; margin-top: 0px; margin-bottom: 0px; margin-left: 0px; margin-right: 0px}\\n.u-block-b61c-29 {font-size: 0.875rem; margin-top: 20px; margin-left: 0px; margin-right: 0px; margin-bottom: 0px}\\n.u-block-b61c-35 {width: 125px; margin-top: 30px; margin-right: auto; margin-bottom: 0px; margin-left: 0px}\\n.u-block-b61c-12 {margin-top: -34px; margin-right: 0px; margin-bottom: 0px; margin-left: auto}\\n.u-block-b61c-38 {min-height: 250px; min-width: 50px; margin-top: 0px; margin-bottom: 0px}\\n.u-block-b61c-46 {padding-top: 20px; padding-bottom: 0px; padding-left: 0px; padding-right: 0px}\\n.u-block-b61c-48 {padding-top: 20px; padding-bottom: 0px; padding-left: 0px; padding-right: 0px}\\n.u-block-b61c-49 {width: 100%; margin-top: 0; margin-bottom: 0; margin-left: auto; margin-right: auto}\\n.u-block-b61c-4 {width: 20.0939px; height: 20.0939px; left: auto; top: 31.9532px; position: absolute; right: 30px; padding-top: 0px; padding-bottom: 0px; padding-left: 0px; padding-right: 0px} }</style>\\n  <style data-mode=\\\"SM\\\" data-visited=\\\"true\\\">@media (max-width: 0px) { .u-block-b61c-2 {box-shadow: 0px 0px 8px 0px rgba(var(--black-r),var(--black-g),var(--black-b),0.2); width: 540px; height: auto; margin-top: 60px; margin-left: auto; margin-right: auto; margin-bottom: 60px; min-height: 578px}\\n.u-block-b61c-3 {padding-top: 30px; padding-bottom: 30px; padding-left: 30px; padding-right: 30px}\\n.u-block-b61c-26 {font-weight: 700; margin-top: 0px; margin-right: 165px; margin-bottom: 0px; margin-left: 0px}\\n.u-block-b61c-5 {margin-top: 30px; margin-bottom: 0px}\\n.u-block-b61c-6 {grid-template-columns: 100%; min-height: 206px; grid-gap: 10px}\\n.u-block-b61c-8 {padding-top: 0px; padding-left: 0px; padding-right: 0px; padding-bottom: 30px}\\n.u-block-b61c-27 {background-image: none; margin-top: 0px; margin-bottom: 0px; margin-left: 0px; margin-right: 0px}\\n.u-block-b61c-29 {font-size: 0.875rem; margin-top: 20px; margin-left: 0px; margin-right: 0px; margin-bottom: 0px}\\n.u-block-b61c-35 {width: 125px; margin-top: 30px; margin-right: auto; margin-bottom: 0px; margin-left: 0px}\\n.u-block-b61c-12 {margin-top: -34px; margin-right: 0px; margin-bottom: 0px; margin-left: auto}\\n.u-block-b61c-38 {min-height: 250px; min-width: 50px; margin-top: 0px; margin-bottom: 0px}\\n.u-block-b61c-46 {padding-top: 20px; padding-bottom: 0px; padding-left: 0px; padding-right: 0px}\\n.u-block-b61c-48 {padding-top: 20px; padding-bottom: 0px; padding-left: 0px; padding-right: 0px}\\n.u-block-b61c-49 {width: 100%; margin-top: 0; margin-bottom: 0; margin-left: auto; margin-right: auto}\\n.u-block-b61c-4 {width: 20.0939px; height: 20.0939px; left: auto; top: 31.9532px; position: absolute; right: 30px; padding-top: 0px; padding-bottom: 0px; padding-left: 0px; padding-right: 0px} }</style>\\n  <style data-mode=\\\"XS\\\" data-visited=\\\"true\\\">@media (max-width: 0px) { .u-block-b61c-2 {box-shadow: 0px 0px 8px 0px rgba(var(--black-r),var(--black-g),var(--black-b),0.2); width: 340px; height: auto; margin-top: 60px; margin-left: auto; margin-right: auto; margin-bottom: 60px; min-height: 578px}\\n.u-block-b61c-3 {padding-top: 30px; padding-bottom: 30px; padding-left: 20px; padding-right: 20px}\\n.u-block-b61c-26 {font-weight: 700; margin-top: 0px; margin-right: 5px; margin-bottom: 0px; margin-left: 0px}\\n.u-block-b61c-5 {margin-top: 30px; margin-bottom: 0px}\\n.u-block-b61c-6 {grid-template-columns: 100%; min-height: 206px; grid-gap: 10px}\\n.u-block-b61c-8 {padding-top: 0px; padding-left: 0px; padding-right: 0px; padding-bottom: 30px}\\n.u-block-b61c-27 {background-image: none; margin-top: 0px; margin-bottom: 0px; margin-left: 0px; margin-right: 0px}\\n.u-block-b61c-29 {font-size: 0.875rem; margin-top: 20px; margin-left: 0px; margin-right: 0px; margin-bottom: 0px}\\n.u-block-b61c-35 {width: 125px; margin-top: 30px; margin-right: auto; margin-bottom: 0px; margin-left: 0px}\\n.u-block-b61c-12 {margin-top: -34px; margin-right: 0px; margin-bottom: 0px; margin-left: auto}\\n.u-block-b61c-38 {min-height: 250px; min-width: 50px; margin-top: 0px; margin-bottom: 0px}\\n.u-block-b61c-46 {padding-top: 20px; padding-bottom: 0px; padding-left: 0px; padding-right: 0px}\\n.u-block-b61c-48 {padding-top: 20px; padding-bottom: 0px; padding-left: 0px; padding-right: 0px}\\n.u-block-b61c-49 {width: 100%; margin-top: 0; margin-bottom: 0; margin-left: auto; margin-right: auto}\\n.u-block-b61c-4 {width: 20.0939px; height: 20.0939px; left: auto; top: 31.9532px; position: absolute; right: 20px; padding-top: 0px; padding-bottom: 0px; padding-left: 0px; padding-right: 0px} }</style>\\n</section>\",\"showOn\":\"click\",\"showOnList\":[]},{\"id\":\"2\",\"name\":\"Ventana emergente 1\",\"type\":\"default\",\"sectionAnchorId\":\"sec-4597\",\"html\":\"<section class=\\\"u-black u-clearfix u-container-style u-dialog-block u-opacity u-opacity-70 u-block-8a00-1\\\" style=\\\"\\\" data-id=\\\"8a00\\\" custom-posts-hash=\\\"[]\\\" data-style=\\\"dialogs-default\\\" id=\\\"sec-4597\\\" data-source=\\\"Sketch\\\">\\n  <style data-mode=\\\"XL\\\" data-visited=\\\"true\\\">@media (max-width: 0px) { .u-block-8a00-2 {width: 545.1px; min-height: 250px; height: auto; margin-top: 217.5px; margin-right: calc(50% - 301.938px); margin-bottom: 217.5px; margin-left: auto}\\n.u-block-8a00-3 {padding-top: 30px; padding-bottom: 30px; padding-left: 30px; padding-right: 30px}\\n.u-block-8a00-5 {margin-bottom: 0px; margin-top: 0px}\\n.u-block-8a00-8 {background-image: none}\\n.u-block-8a00-11 {background-image: none}\\n.u-block-8a00-13 {background-image: none}\\n.u-block-8a00-4 {width: 20px; height: 20px} }</style>\\n  <style data-mode=\\\"LG\\\">@media (max-width: 0px) { .u-block-8a00-2 {width: 545px; margin-top: 217.5px; margin-bottom: 217.5px; margin-left: auto; margin-right: calc(((100% - 940px) / 2) + 268px); min-height: 250px; height: auto}\\n.u-block-8a00-3 {padding-top: 30px; padding-bottom: 30px; padding-left: 30px; padding-right: 30px}\\n.u-block-8a00-5 {margin-bottom: 0px; margin-top: 0px}\\n.u-block-8a00-8 {background-image: none}\\n.u-block-8a00-11 {background-image: none}\\n.u-block-8a00-13 {background-image: none}\\n.u-block-8a00-4 {width: 20px; height: 20px} }</style>\\n  <style data-mode=\\\"MD\\\">@media (max-width: 0px) { .u-block-8a00-2 {width: 545px; margin-top: 217.5px; margin-bottom: 217.5px; margin-left: auto; margin-right: calc(((100% - 720px) / 2) + 175px); min-height: 250px; height: auto}\\n.u-block-8a00-3 {padding-top: 30px; padding-bottom: 30px; padding-left: 30px; padding-right: 30px}\\n.u-block-8a00-5 {margin-bottom: 0px; margin-top: 0px}\\n.u-block-8a00-8 {background-image: none}\\n.u-block-8a00-11 {background-image: none}\\n.u-block-8a00-13 {background-image: none}\\n.u-block-8a00-4 {width: 20px; height: 20px} }</style>\\n  <style data-mode=\\\"SM\\\">@media (max-width: 0px) { .u-block-8a00-2 {width: 540px; margin-top: 217.5px; margin-bottom: 217.5px; margin-left: auto; margin-right: calc(((100% - 540px) / 2) + 0px); min-height: 250px; height: auto}\\n.u-block-8a00-3 {padding-top: 30px; padding-bottom: 30px; padding-left: 10px; padding-right: 10px}\\n.u-block-8a00-5 {margin-bottom: 0px; margin-top: 0px}\\n.u-block-8a00-8 {background-image: none}\\n.u-block-8a00-11 {background-image: none}\\n.u-block-8a00-13 {background-image: none}\\n.u-block-8a00-4 {width: 20px; height: 20px} }</style>\\n  <style data-mode=\\\"XS\\\">@media (max-width: 0px) { .u-block-8a00-2 {width: 340px; margin-top: 217.5px; margin-bottom: 217.5px; margin-left: auto; margin-right: calc(((100% - 340px) / 2) + 0px); min-height: 250px; height: auto}\\n.u-block-8a00-3 {padding-top: 30px; padding-bottom: 30px; padding-left: 10px; padding-right: 10px}\\n.u-block-8a00-5 {margin-bottom: 0px; margin-top: 0px}\\n.u-block-8a00-8 {background-image: none}\\n.u-block-8a00-11 {background-image: none}\\n.u-block-8a00-13 {background-image: none}\\n.u-block-8a00-4 {width: 20px; height: 20px} }</style>\\n  <div style=\\\"width: 545.1px; min-height: 250px; height: auto; margin-top: 217.5px; margin-right: calc(50% - 301.938px); margin-bottom: 217.5px; margin-left: auto\\\" class=\\\"u-container-style u-custom-color-1 u-dialog u-block-8a00-2\\\">\\n    <div class=\\\"u-container-layout u-block-8a00-3\\\" style=\\\"padding-top: 30px; padding-bottom: 30px; padding-left: 30px; padding-right: 30px\\\"><div class=\\\"u-expanded-width u-form u-block-8a00-5\\\" style=\\\"margin-bottom: 0px; margin-top: 0px\\\">\\n    <form action=\\\"https://forms.nicepagesrv.com/v2/form/process\\\" method=\\\"POST\\\" class=\\\"u-clearfix u-form-spacing-10 u-form-vertical u-inner-form\\\" source=\\\"email\\\" data-services=\\\"63b6fbae659bf569b481d5f9d7f12a7d\\\" name=\\\"form-1\\\" style=\\\"padding: 10px;\\\">\\n        \\n        \\n\\n        <div class=\\\"u-form-group u-form-name u-block-8a00-6\\\" style=\\\"\\\">\\n            <label for=\\\"name-afb2\\\" class=\\\"u-label u-text-custom-color-5 u-block-8a00-7\\\" style=\\\"\\\">Nickname</label>\\n            <input type=\\\"text\\\" placeholder=\\\"Introduzca su nickname\\\" id=\\\"name-afb2\\\" name=\\\"nickname\\\" class=\\\"u-border-none u-input u-input-rectangle u-block-8a00-8\\\" required=\\\"\\\" style=\\\"background-image: none\\\">\\n        </div>\\n        <div class=\\\"u-form-email u-form-group u-block-8a00-9\\\" style=\\\"\\\">\\n            <label for=\\\"email-afb2\\\" class=\\\"u-label u-text-custom-color-5 u-block-8a00-10\\\" style=\\\"\\\">Contraseña</label>\\n            <input type=\\\"email\\\" placeholder=\\\"Introduzca su contraseña\\\" id=\\\"email-afb2\\\" name=\\\"contraseña\\\" class=\\\"u-border-none u-input u-input-rectangle u-block-8a00-11\\\" required=\\\"\\\" style=\\\"background-image: none\\\">\\n        </div>\\n        \\n        <div class=\\\"u-align-left u-form-group u-form-submit u-block-8a00-12\\\" style=\\\"\\\">\\n            <a href=\\\"#\\\" class=\\\"u-border-none u-btn u-btn-submit u-button-style u-custom-color-5 u-hover-custom-color-5 u-text-black u-text-hover-black u-block-8a00-13\\\" style=\\\"background-image: none\\\">Enviar</a>\\n            <input type=\\\"submit\\\" value=\\\"submit\\\" class=\\\"u-form-control-hidden\\\">\\n        </div>\\n        <div class=\\\"u-form-send-message u-form-send-success\\\">\\n            Gracias! Tu mensaje ha sido enviado.\\n        </div>\\n        <div class=\\\"u-form-send-error u-form-send-message\\\">\\n            No se puede enviar su mensaje. Por favor, corrija los errores y vuelva a intentarlo.\\n        </div>\\n        <input type=\\\"hidden\\\" value=\\\"\\\" name=\\\"recaptchaResponse\\\">\\n    </form>\\n</div></div><button class=\\\"u-dialog-close-button u-icon u-text-grey-40 u-block-8a00-4\\\" style=\\\"width: 20px; height: 20px\\\"><svg class=\\\"u-svg-link\\\" preserveAspectRatio=\\\"xMidYMin slice\\\" viewBox=\\\"0 0 16 16\\\" style=\\\"\\\"><use xmlns:xlink=\\\"http://www.w3.org/1999/xlink\\\" xlink:href=\\\"#svg-efe9\\\"></use></svg><svg xmlns=\\\"http://www.w3.org/2000/svg\\\" xmlns:xlink=\\\"http://www.w3.org/1999/xlink\\\" version=\\\"1.1\\\" xml:space=\\\"preserve\\\" class=\\\"u-svg-content\\\" viewBox=\\\"0 0 16 16\\\" x=\\\"0px\\\" y=\\\"0px\\\" id=\\\"svg-efe9\\\"><rect x=\\\"7\\\" y=\\\"0\\\" transform=\\\"matrix(0.7071 -0.7071 0.7071 0.7071 -3.3138 8.0002)\\\" width=\\\"2\\\" height=\\\"16\\\"></rect><rect x=\\\"0\\\" y=\\\"7\\\" transform=\\\"matrix(0.7071 -0.7071 0.7071 0.7071 -3.3138 8.0002)\\\" width=\\\"16\\\" height=\\\"2\\\"></rect></svg></button>\\n  </div>\\n</section>\",\"showOn\":\"click\",\"showOnList\":[]}],\"langs\":[{\"id\":\"1\",\"name\":\"es\",\"title\":\"Spanish\"}],\"homePageId\":\"66313835\",\"formServices\":{\"63b6fbae659bf569b481d5f9d7f12a7d\":{\"id\":\"63b6fbae659bf569b481d5f9d7f12a7d\",\"type\":\"email\",\"token\":\"62dc23a8-d596-f0fa-505b-2f67dee3ceb3\",\"email\":\"tryingtobefreemicro@gmail.com\",\"isVerified\":true}},\"payment\":{\"services\":{}},\"captchaSiteKey\":\"6Lc2HDEiAAAAALpe1yqNarK-BmlyYl_MNPZx7_AB\",\"captchaSecretKey\":\"\",\"cookiesSection\":\"<section class=\\\"u-align-center u-block-455d-1 u-clearfix u-cookies-consent u-grey-80\\\" custom-posts-hash=\\\"T\\\" style=\\\"background-image: none\\\" data-post-id=\\\"1\\\" data-section-properties=\\\"{&quot;stretch&quot;:true}\\\" data-id=\\\"455d\\\" data-posts-content=\\\"[{'images':[],'maps':[],'videos':[],'icons':[],'textWidth':1064,'textHeight':152,'id':1,'headingProp':'h3','textProp':'text'}]\\\" data-section-content=\\\"{'images':[],'headings':[],'texts':[],'textGroupCount':1}\\\" data-style=\\\"cookie-1\\\" id=\\\"sec-1606\\\" data-source=\\\"\\\">\\n  <div class=\\\"u-block-455d-2 u-clearfix u-sheet u-valign-middle\\\" style=\\\"min-height: 212px\\\" data-state=\\\"{&quot;margin-top&quot;:{&quot;shouldApplyDefaultMargins&quot;:{&quot;XL&quot;:false,&quot;LG&quot;:false,&quot;MD&quot;:false,&quot;SM&quot;:false,&quot;XS&quot;:false},&quot;parentVerticalAlign&quot;:{&quot;XL&quot;:&quot;middle&quot;,&quot;LG&quot;:&quot;middle&quot;,&quot;MD&quot;:&quot;middle&quot;,&quot;SM&quot;:&quot;middle&quot;,&quot;XS&quot;:&quot;middle&quot;}},&quot;margin-bottom&quot;:{&quot;shouldApplyDefaultMargins&quot;:{&quot;XL&quot;:false,&quot;LG&quot;:false,&quot;MD&quot;:false,&quot;SM&quot;:false,&quot;XS&quot;:false},&quot;parentVerticalAlign&quot;:{&quot;XL&quot;:&quot;middle&quot;,&quot;LG&quot;:&quot;middle&quot;,&quot;MD&quot;:&quot;middle&quot;,&quot;SM&quot;:&quot;middle&quot;,&quot;XS&quot;:&quot;middle&quot;}}}\\\" data-height-lg=\\\"158\\\" data-height-md=\\\"131\\\" data-height-sm=\\\"106\\\" data-height-xs=\\\"225\\\">\\n    <div class=\\\"u-block-455d-7 u-clearfix u-expanded-width u-layout-wrap\\\" style=\\\"margin-top: 30px; margin-bottom: 30px\\\" data-state=\\\"{&quot;margin-top&quot;:{&quot;shouldApplyDefaultMargins&quot;:{&quot;XL&quot;:false,&quot;LG&quot;:false,&quot;MD&quot;:false,&quot;SM&quot;:true,&quot;XS&quot;:true},&quot;parentVerticalAlign&quot;:{&quot;XL&quot;:&quot;middle&quot;,&quot;LG&quot;:&quot;middle&quot;,&quot;MD&quot;:&quot;middle&quot;,&quot;SM&quot;:&quot;middle&quot;,&quot;XS&quot;:&quot;middle&quot;}},&quot;margin-bottom&quot;:{&quot;shouldApplyDefaultMargins&quot;:{&quot;XL&quot;:false,&quot;LG&quot;:false,&quot;MD&quot;:false,&quot;SM&quot;:true,&quot;XS&quot;:true},&quot;parentVerticalAlign&quot;:{&quot;XL&quot;:&quot;middle&quot;,&quot;LG&quot;:&quot;middle&quot;,&quot;MD&quot;:&quot;middle&quot;,&quot;SM&quot;:&quot;middle&quot;,&quot;XS&quot;:&quot;middle&quot;}}}\\\">\\n      <div class=\\\"u-gutter-0 u-layout\\\">\\n        <div class=\\\"u-layout-row\\\">\\n          <div class=\\\"u-block-455d-8 u-container-style u-layout-cell u-left-cell u-size-43-md u-size-43-sm u-size-43-xs u-size-46-lg u-size-46-xl\\\" style=\\\"min-height: 152px\\\" data-state=\\\"{&quot;min-height&quot;:{&quot;expandedParent&quot;:{&quot;XL&quot;:true,&quot;LG&quot;:true,&quot;MD&quot;:true,&quot;SM&quot;:true,&quot;XS&quot;:true},&quot;cellMultiplier&quot;:{&quot;XL&quot;:1,&quot;LG&quot;:1,&quot;MD&quot;:0.9347826086956521,&quot;SM&quot;:1.3953488372093024,&quot;XS&quot;:1},&quot;canCollapse&quot;:{&quot;XL&quot;:false,&quot;LG&quot;:false,&quot;MD&quot;:true,&quot;SM&quot;:true,&quot;XS&quot;:true}}}\\\">\\n            <div class=\\\"u-block-455d-9 u-container-layout u-valign-middle\\\" style=\\\"padding-top: 30px; padding-bottom: 30px; padding-left: 60px; padding-right: 60px\\\" data-state=\\\"{&quot;min-height&quot;:{&quot;canCollapse&quot;:{&quot;XL&quot;:false,&quot;LG&quot;:false,&quot;MD&quot;:false,&quot;SM&quot;:false,&quot;XS&quot;:false}}}\\\">\\n              <h3 class=\\\"u-block-455d-6 u-text u-text-default\\\" style=\\\"margin-top: 0px; margin-right: 20px; margin-bottom: 0px;\\\">Cookies &amp; Privacy</h3>\\n              <p class=\\\"u-block-455d-5 u-text u-text-default\\\" style=\\\"margin: 8px 20px 0px 0px;\\\">This website uses cookies to ensure you get the best experience on our website.</p>\\n            </div>\\n          </div>\\n          <div class=\\\"u-align-left u-block-455d-10 u-container-style u-layout-cell u-right-cell u-size-14-lg u-size-14-xl u-size-17-md u-size-17-sm u-size-17-xs\\\" style=\\\"min-height: 152px\\\" data-state=\\\"{&quot;min-height&quot;:{&quot;expandedParent&quot;:{&quot;XL&quot;:true,&quot;LG&quot;:true,&quot;MD&quot;:true,&quot;SM&quot;:true,&quot;XS&quot;:true},&quot;cellMultiplier&quot;:{&quot;XL&quot;:1,&quot;LG&quot;:1,&quot;MD&quot;:1.2142857142857142,&quot;SM&quot;:3.5294117647058822,&quot;XS&quot;:1},&quot;canCollapse&quot;:{&quot;XL&quot;:false,&quot;LG&quot;:false,&quot;MD&quot;:true,&quot;SM&quot;:true,&quot;XS&quot;:true}}}\\\">\\n            <div class=\\\"u-block-455d-11 u-container-layout u-valign-middle-lg u-valign-middle-md u-valign-middle-xl u-valign-top-sm u-valign-top-xs\\\" style=\\\"padding-top: 30px; padding-bottom: 30px; padding-left: 30px; padding-right: 30px\\\" data-state=\\\"{&quot;min-height&quot;:{&quot;canCollapse&quot;:{&quot;XL&quot;:false,&quot;LG&quot;:false,&quot;MD&quot;:false,&quot;SM&quot;:false,&quot;XS&quot;:false}}}\\\">\\n              <a href=\\\"###\\\" class=\\\"u-block-455d-3 u-btn u-button-confirm u-button-style u-palette-1-base\\\" style=\\\"margin-top: 0px; margin-right: auto; margin-bottom: 0px; margin-left: 0px\\\">Confirm</a>\\n            </div>\\n          </div>\\n        </div>\\n      </div>\\n    </div>\\n  </div>\\n  <style data-mode=\\\"XL\\\">@media (max-width: 0px) { .u-block-455d-1 {background-image: none}\\n.u-block-455d-2 {min-height: 212px}\\n.u-block-455d-7 {margin-top: 30px; margin-bottom: 30px}\\n.u-block-455d-8 {min-height: 152px}\\n.u-block-455d-9 {padding-top: 30px; padding-bottom: 30px; padding-left: 60px; padding-right: 60px}\\n.u-block-455d-6 {margin-top: 0px; margin-right: 20px; margin-bottom: 0px}\\n.u-block-455d-5 {margin-top: 8px; margin-right: 20px; margin-bottom: 0px; margin-left: 0px}\\n.u-block-455d-10 {min-height: 152px}\\n.u-block-455d-11 {padding-top: 30px; padding-bottom: 30px; padding-left: 30px; padding-right: 30px}\\n.u-block-455d-3 {margin-top: 0px; margin-right: auto; margin-bottom: 0px; margin-left: 0px} }</style>\\n  <style data-mode=\\\"LG\\\">@media (max-width: 0px) { .u-block-455d-1 {background-image: none}\\n.u-block-455d-2 {min-height: 131px}\\n.u-block-455d-7 {margin-top: 30px; margin-bottom: 30px}\\n.u-block-455d-8 {min-height: 125px}\\n.u-block-455d-9 {padding-top: 30px; padding-bottom: 30px; padding-left: 60px; padding-right: 60px}\\n.u-block-455d-6 {margin-top: 0px; margin-right: 0px; margin-bottom: 0px}\\n.u-block-455d-5 {margin-top: 8px; margin-right: 0px; margin-bottom: 0px; margin-left: 0px}\\n.u-block-455d-10 {min-height: 125px}\\n.u-block-455d-11 {padding-top: 30px; padding-bottom: 30px; padding-left: 30px; padding-right: 30px}\\n.u-block-455d-3 {margin-top: 0px; margin-right: auto; margin-bottom: 0px; margin-left: 0px} }</style>\\n  <style data-mode=\\\"MD\\\" data-visited=\\\"true\\\">@media (max-width: 0px) { .u-block-455d-1 {background-image: none}\\n.u-block-455d-2 {min-height: 106px}\\n.u-block-455d-7 {margin-top: 30px; margin-bottom: 30px}\\n.u-block-455d-8 {min-height: 100px}\\n.u-block-455d-9 {padding-top: 30px; padding-bottom: 30px; padding-left: 30px; padding-right: 30px}\\n.u-block-455d-6 {margin-top: 0px; margin-right: 0px; margin-bottom: 0px}\\n.u-block-455d-5 {margin-top: 8px; margin-right: 0px; margin-bottom: 0px; margin-left: 0px}\\n.u-block-455d-10 {min-height: 100px}\\n.u-block-455d-11 {padding-top: 30px; padding-bottom: 30px; padding-left: 30px; padding-right: 30px}\\n.u-block-455d-3 {margin-top: 0px; margin-right: auto; margin-bottom: 0px; margin-left: 0px} }</style>\\n  <style data-mode=\\\"SM\\\" data-visited=\\\"true\\\">@media (max-width: 0px) { .u-block-455d-1 {background-image: none}\\n.u-block-455d-2 {min-height: 225px}\\n.u-block-455d-7 {margin-top: 30px; margin-bottom: 30px}\\n.u-block-455d-8 {min-height: 154px}\\n.u-block-455d-9 {padding-top: 30px; padding-left: 10px; padding-right: 10px; padding-bottom: 20px}\\n.u-block-455d-6 {margin-top: 0px; margin-right: 0px; margin-bottom: 0px}\\n.u-block-455d-5 {margin-top: 8px; margin-right: 0px; margin-bottom: 0px; margin-left: 0px}\\n.u-block-455d-10 {min-height: 65px}\\n.u-block-455d-11 {padding-top: 10px; padding-bottom: 10px; padding-left: 10px; padding-right: 10px}\\n.u-block-455d-3 {margin-top: 0px; margin-right: auto; margin-bottom: 0px; margin-left: 0px} }</style>\\n  <style data-mode=\\\"XS\\\" data-visited=\\\"true\\\">@media (max-width: 0px) { .u-block-455d-1 {background-image: none}\\n.u-block-455d-2 {min-height: 121px}\\n.u-block-455d-7 {margin-top: 30px; margin-bottom: 30px}\\n.u-block-455d-8 {min-height: 100px}\\n.u-block-455d-9 {padding-top: 30px; padding-bottom: 20px; padding-left: 10px; padding-right: 10px}\\n.u-block-455d-6 {margin-top: 0px; margin-right: 0px; margin-bottom: 0px}\\n.u-block-455d-5 {margin-top: 8px; margin-right: 0px; margin-bottom: 0px; margin-left: 0px}\\n.u-block-455d-10 {min-height: 15px}\\n.u-block-455d-11 {padding-top: 10px; padding-bottom: 10px; padding-left: 10px; padding-right: 10px}\\n.u-block-455d-3 {margin-top: 0px; margin-right: auto; margin-bottom: 0px; margin-left: 0px} }</style>\\n</section>\"}","title":"Site2","siteStyleCss":"<style id=\"color-scheme\" color-scheme=\"u13\" color-style=\"multicolor-1\">.u-body {\n--none: transparent;\n--none-darker: transparent;\n--none-r: 255;\n--none-g: 255;\n--none-b: 255;\n--none-contrast: body-color;\n--none-contrast-darker: body-color;\n--none-text-color: var(--body-color);\n--transparent: transparent;\n--transparent-darker: transparent;\n--transparent-r: 255;\n--transparent-g: 255;\n--transparent-b: 255;\n--transparent-contrast: body-color;\n--transparent-contrast-darker: body-color;\n--transparent-text-color: var(--body-color);\n--custom-color-1: #1b1447;\n--custom-color-1-darker: #181240;\n--custom-color-1-r: 27;\n--custom-color-1-g: 20;\n--custom-color-1-b: 71;\n--custom-color-1-contrast: white;\n--custom-color-1-contrast-darker: white;\n--custom-color-1-text-color: var(--body-alt-color);\n--custom-color-2: #1b1447;\n--custom-color-2-darker: #181240;\n--custom-color-2-r: 27;\n--custom-color-2-g: 20;\n--custom-color-2-b: 71;\n--custom-color-2-contrast: white;\n--custom-color-2-contrast-darker: white;\n--custom-color-2-text-color: var(--body-alt-color);\n--custom-color-3: #a5a5a5;\n--custom-color-3-darker: #959595;\n--custom-color-3-r: 165;\n--custom-color-3-g: 165;\n--custom-color-3-b: 165;\n--custom-color-3-contrast: white;\n--custom-color-3-contrast-darker: white;\n--custom-color-3-text-color: var(--body-alt-color);\n--custom-color-4: #32e81d;\n--custom-color-4-darker: #2ad516;\n--custom-color-4-r: 50;\n--custom-color-4-g: 232;\n--custom-color-4-b: 29;\n--custom-color-4-contrast: black;\n--custom-color-4-contrast-darker: white;\n--custom-color-4-text-color: var(--body-color);\n--custom-color-5: #3ad228;\n--custom-color-5-darker: #34bd24;\n--custom-color-5-r: 58;\n--custom-color-5-g: 210;\n--custom-color-5-b: 40;\n--custom-color-5-contrast: white;\n--custom-color-5-contrast-darker: white;\n--custom-color-5-text-color: var(--body-alt-color);\n--custom-color-6: #e0e0e0;\n--custom-color-6-darker: #cacaca;\n--custom-color-6-r: 224;\n--custom-color-6-g: 224;\n--custom-color-6-b: 224;\n--custom-color-6-contrast: black;\n--custom-color-6-contrast-darker: black;\n--custom-color-6-text-color: var(--body-color);\n--custom-color-7: #3bd12a;\n--custom-color-7-darker: #35bc26;\n--custom-color-7-r: 59;\n--custom-color-7-g: 209;\n--custom-color-7-b: 42;\n--custom-color-7-contrast: white;\n--custom-color-7-contrast-darker: white;\n--custom-color-7-text-color: var(--body-alt-color);\n--body-color: #111111;\n--body-color-darker: #0f0f0f;\n--body-color-r: 17;\n--body-color-g: 17;\n--body-color-b: 17;\n--body-color-contrast: white;\n--body-color-contrast-darker: white;\n--body-color-text-color: var(--body-alt-color);\n--body-alt-color: #ffffff;\n--body-alt-color-darker: #e6e6e6;\n--body-alt-color-r: 255;\n--body-alt-color-g: 255;\n--body-alt-color-b: 255;\n--body-alt-color-contrast: black;\n--body-alt-color-contrast-darker: black;\n--body-alt-color-text-color: var(--body-color);\n--bg-color: #ffffff;\n--bg-color-darker: #e6e6e6;\n--bg-color-r: 255;\n--bg-color-g: 255;\n--bg-color-b: 255;\n--bg-color-contrast: black;\n--bg-color-contrast-darker: black;\n--bg-color-text-color: var(--body-color);\n--palette-1-base: #654aff;\n--palette-1-base-darker: #4929ff;\n--palette-1-base-r: 101;\n--palette-1-base-g: 74;\n--palette-1-base-b: 255;\n--palette-1-base-contrast: white;\n--palette-1-base-contrast-darker: white;\n--palette-1-base-text-color: var(--body-alt-color);\n--palette-1-dark-3: #2a2933;\n--palette-1-dark-3-darker: #26252e;\n--palette-1-dark-3-r: 42;\n--palette-1-dark-3-g: 41;\n--palette-1-dark-3-b: 51;\n--palette-1-dark-3-contrast: white;\n--palette-1-dark-3-contrast-darker: white;\n--palette-1-dark-3-text-color: var(--body-alt-color);\n--palette-1-dark-2: #524b77;\n--palette-1-dark-2-darker: #4a436b;\n--palette-1-dark-2-r: 82;\n--palette-1-dark-2-g: 75;\n--palette-1-dark-2-b: 119;\n--palette-1-dark-2-contrast: white;\n--palette-1-dark-2-contrast-darker: white;\n--palette-1-dark-2-text-color: var(--body-alt-color);\n--palette-1-dark-1: #6556bb;\n--palette-1-dark-1-darker: #5646af;\n--palette-1-dark-1-r: 101;\n--palette-1-dark-1-g: 86;\n--palette-1-dark-1-b: 187;\n--palette-1-dark-1-contrast: white;\n--palette-1-dark-1-contrast-darker: white;\n--palette-1-dark-1-text-color: var(--body-alt-color);\n--palette-1: #654aff;\n--palette-1-darker: #4929ff;\n--palette-1-r: 101;\n--palette-1-g: 74;\n--palette-1-b: 255;\n--palette-1-contrast: white;\n--palette-1-contrast-darker: white;\n--palette-1-text-color: var(--body-alt-color);\n--palette-1-light-1: #9380ff;\n--palette-1-light-1-darker: #725aff;\n--palette-1-light-1-r: 147;\n--palette-1-light-1-g: 128;\n--palette-1-light-1-b: 255;\n--palette-1-light-1-contrast: white;\n--palette-1-light-1-contrast-darker: white;\n--palette-1-light-1-text-color: var(--body-alt-color);\n--palette-1-light-2: #c1b7ff;\n--palette-1-light-2-darker: #9b8bff;\n--palette-1-light-2-r: 193;\n--palette-1-light-2-g: 183;\n--palette-1-light-2-b: 255;\n--palette-1-light-2-contrast: black;\n--palette-1-light-2-contrast-darker: white;\n--palette-1-light-2-text-color: var(--body-color);\n--palette-1-light-3: #f0edff;\n--palette-1-light-3-darker: #c7bcff;\n--palette-1-light-3-r: 240;\n--palette-1-light-3-g: 237;\n--palette-1-light-3-b: 255;\n--palette-1-light-3-contrast: black;\n--palette-1-light-3-contrast-darker: black;\n--palette-1-light-3-text-color: var(--body-color);\n--palette-2-base: #5338ec;\n--palette-2-base-darker: #3c1de9;\n--palette-2-base-r: 83;\n--palette-2-base-g: 56;\n--palette-2-base-b: 236;\n--palette-2-base-contrast: white;\n--palette-2-base-contrast-darker: white;\n--palette-2-base-text-color: var(--body-alt-color);\n--palette-2-dark-3: #2a2933;\n--palette-2-dark-3-darker: #26252e;\n--palette-2-dark-3-r: 42;\n--palette-2-dark-3-g: 41;\n--palette-2-dark-3-b: 51;\n--palette-2-dark-3-contrast: white;\n--palette-2-dark-3-contrast-darker: white;\n--palette-2-dark-3-text-color: var(--body-alt-color);\n--palette-2-dark-2: #4c4571;\n--palette-2-dark-2-darker: #443e66;\n--palette-2-dark-2-r: 76;\n--palette-2-dark-2-g: 69;\n--palette-2-dark-2-b: 113;\n--palette-2-dark-2-contrast: white;\n--palette-2-dark-2-contrast-darker: white;\n--palette-2-dark-2-text-color: var(--body-alt-color);\n--palette-2-dark-1: #594aae;\n--palette-2-dark-1-darker: #50439d;\n--palette-2-dark-1-r: 89;\n--palette-2-dark-1-g: 74;\n--palette-2-dark-1-b: 174;\n--palette-2-dark-1-contrast: white;\n--palette-2-dark-1-contrast-darker: white;\n--palette-2-dark-1-text-color: var(--body-alt-color);\n--palette-2: #5338ec;\n--palette-2-darker: #3c1de9;\n--palette-2-r: 83;\n--palette-2-g: 56;\n--palette-2-b: 236;\n--palette-2-contrast: white;\n--palette-2-contrast-darker: white;\n--palette-2-text-color: var(--body-alt-color);\n--palette-2-light-1: #8471f2;\n--palette-2-light-1-darker: #6850ef;\n--palette-2-light-1-r: 132;\n--palette-2-light-1-g: 113;\n--palette-2-light-1-b: 242;\n--palette-2-light-1-contrast: white;\n--palette-2-light-1-contrast-darker: white;\n--palette-2-light-1-text-color: var(--body-alt-color);\n--palette-2-light-2: #b7acf7;\n--palette-2-light-2-darker: #9686f3;\n--palette-2-light-2-r: 183;\n--palette-2-light-2-g: 172;\n--palette-2-light-2-b: 247;\n--palette-2-light-2-contrast: white;\n--palette-2-light-2-contrast-darker: white;\n--palette-2-light-2-text-color: var(--body-alt-color);\n--palette-2-light-3: #edeafd;\n--palette-2-light-3-darker: #c7bef9;\n--palette-2-light-3-r: 237;\n--palette-2-light-3-g: 234;\n--palette-2-light-3-b: 253;\n--palette-2-light-3-contrast: black;\n--palette-2-light-3-contrast-darker: black;\n--palette-2-light-3-text-color: var(--body-color);\n--palette-3-base: #f1c50e;\n--palette-3-base-darker: #d9b10d;\n--palette-3-base-r: 241;\n--palette-3-base-g: 197;\n--palette-3-base-b: 14;\n--palette-3-base-contrast: black;\n--palette-3-base-contrast-darker: white;\n--palette-3-base-text-color: var(--body-color);\n--palette-3-dark-3: #333129;\n--palette-3-dark-3-darker: #2e2c25;\n--palette-3-dark-3-r: 51;\n--palette-3-dark-3-g: 49;\n--palette-3-dark-3-b: 41;\n--palette-3-dark-3-contrast: white;\n--palette-3-dark-3-contrast-darker: white;\n--palette-3-dark-3-text-color: var(--body-alt-color);\n--palette-3-dark-2: #72683f;\n--palette-3-dark-2-darker: #675e39;\n--palette-3-dark-2-r: 114;\n--palette-3-dark-2-g: 104;\n--palette-3-dark-2-b: 63;\n--palette-3-dark-2-contrast: white;\n--palette-3-dark-2-contrast-darker: white;\n--palette-3-dark-2-text-color: var(--body-alt-color);\n--palette-3-dark-1: #b29a36;\n--palette-3-dark-1-darker: #a08b31;\n--palette-3-dark-1-r: 178;\n--palette-3-dark-1-g: 154;\n--palette-3-dark-1-b: 54;\n--palette-3-dark-1-contrast: white;\n--palette-3-dark-1-contrast-darker: white;\n--palette-3-dark-1-text-color: var(--body-alt-color);\n--palette-3: #f1c50e;\n--palette-3-darker: #d9b10d;\n--palette-3-r: 241;\n--palette-3-g: 197;\n--palette-3-b: 14;\n--palette-3-contrast: black;\n--palette-3-contrast-darker: white;\n--palette-3-text-color: var(--body-color);\n--palette-3-light-1: #f5d654;\n--palette-3-light-1-darker: #f3cf35;\n--palette-3-light-1-r: 245;\n--palette-3-light-1-g: 214;\n--palette-3-light-1-b: 84;\n--palette-3-light-1-contrast: black;\n--palette-3-light-1-contrast-darker: black;\n--palette-3-light-1-text-color: var(--body-color);\n--palette-3-light-2: #f9e79b;\n--palette-3-light-2-darker: #f7de75;\n--palette-3-light-2-r: 249;\n--palette-3-light-2-g: 231;\n--palette-3-light-2-b: 155;\n--palette-3-light-2-contrast: black;\n--palette-3-light-2-contrast-darker: black;\n--palette-3-light-2-text-color: var(--body-color);\n--palette-3-light-3: #fef9e6;\n--palette-3-light-3-darker: #fceeb7;\n--palette-3-light-3-r: 254;\n--palette-3-light-3-g: 249;\n--palette-3-light-3-b: 230;\n--palette-3-light-3-contrast: black;\n--palette-3-light-3-contrast-darker: black;\n--palette-3-light-3-text-color: var(--body-color);\n--palette-4-base: #2cccc4;\n--palette-4-base-darker: #28b8b0;\n--palette-4-base-r: 44;\n--palette-4-base-g: 204;\n--palette-4-base-b: 196;\n--palette-4-base-contrast: white;\n--palette-4-base-contrast-darker: white;\n--palette-4-base-text-color: var(--body-alt-color);\n--palette-4-dark-3: #293332;\n--palette-4-dark-3-darker: #252e2d;\n--palette-4-dark-3-r: 41;\n--palette-4-dark-3-g: 51;\n--palette-4-dark-3-b: 50;\n--palette-4-dark-3-contrast: white;\n--palette-4-dark-3-contrast-darker: white;\n--palette-4-dark-3-text-color: var(--body-alt-color);\n--palette-4-dark-2: #41807c;\n--palette-4-dark-2-darker: #3a7370;\n--palette-4-dark-2-r: 65;\n--palette-4-dark-2-g: 128;\n--palette-4-dark-2-b: 124;\n--palette-4-dark-2-contrast: white;\n--palette-4-dark-2-contrast-darker: white;\n--palette-4-dark-2-text-color: var(--body-alt-color);\n--palette-4-dark-1: #2cccc4;\n--palette-4-dark-1-darker: #28b8b0;\n--palette-4-dark-1-r: 44;\n--palette-4-dark-1-g: 204;\n--palette-4-dark-1-b: 196;\n--palette-4-dark-1-contrast: white;\n--palette-4-dark-1-contrast-darker: white;\n--palette-4-dark-1-text-color: var(--body-alt-color);\n--palette-4: #3be8e0;\n--palette-4-darker: #21e5dc;\n--palette-4-r: 59;\n--palette-4-g: 232;\n--palette-4-b: 224;\n--palette-4-contrast: black;\n--palette-4-contrast-darker: black;\n--palette-4-text-color: var(--body-color);\n--palette-4-light-1: #72efe9;\n--palette-4-light-1-darker: #52ebe4;\n--palette-4-light-1-r: 114;\n--palette-4-light-1-g: 239;\n--palette-4-light-1-b: 233;\n--palette-4-light-1-contrast: black;\n--palette-4-light-1-contrast-darker: black;\n--palette-4-light-1-text-color: var(--body-color);\n--palette-4-light-2: #adf6f2;\n--palette-4-light-2-darker: #87f2ec;\n--palette-4-light-2-r: 173;\n--palette-4-light-2-g: 246;\n--palette-4-light-2-b: 242;\n--palette-4-light-2-contrast: black;\n--palette-4-light-2-contrast-darker: black;\n--palette-4-light-2-text-color: var(--body-color);\n--palette-4-light-3: #eafdfc;\n--palette-4-light-3-darker: #bef9f6;\n--palette-4-light-3-r: 234;\n--palette-4-light-3-g: 253;\n--palette-4-light-3-b: 252;\n--palette-4-light-3-contrast: black;\n--palette-4-light-3-contrast-darker: black;\n--palette-4-light-3-text-color: var(--body-color);\n--palette-5-base: #b9c1cc;\n--palette-5-base-darker: #a2adbc;\n--palette-5-base-r: 185;\n--palette-5-base-g: 193;\n--palette-5-base-b: 204;\n--palette-5-base-contrast: black;\n--palette-5-base-contrast-darker: white;\n--palette-5-base-text-color: var(--body-color);\n--palette-5-dark-3: #292d33;\n--palette-5-dark-3-darker: #25292e;\n--palette-5-dark-3-r: 41;\n--palette-5-dark-3-g: 45;\n--palette-5-dark-3-b: 51;\n--palette-5-dark-3-contrast: white;\n--palette-5-dark-3-contrast-darker: white;\n--palette-5-dark-3-text-color: var(--body-alt-color);\n--palette-5-dark-2: #555c66;\n--palette-5-dark-2-darker: #4d535c;\n--palette-5-dark-2-r: 85;\n--palette-5-dark-2-g: 92;\n--palette-5-dark-2-b: 102;\n--palette-5-dark-2-contrast: white;\n--palette-5-dark-2-contrast-darker: white;\n--palette-5-dark-2-text-color: var(--body-alt-color);\n--palette-5-dark-1: #858e99;\n--palette-5-dark-1-darker: #75808c;\n--palette-5-dark-1-r: 133;\n--palette-5-dark-1-g: 142;\n--palette-5-dark-1-b: 153;\n--palette-5-dark-1-contrast: white;\n--palette-5-dark-1-contrast-darker: white;\n--palette-5-dark-1-text-color: var(--body-alt-color);\n--palette-5: #b9c1cc;\n--palette-5-darker: #a2adbc;\n--palette-5-r: 185;\n--palette-5-g: 193;\n--palette-5-b: 204;\n--palette-5-contrast: black;\n--palette-5-contrast-darker: white;\n--palette-5-text-color: var(--body-color);\n--palette-5-light-1: #ccd3db;\n--palette-5-light-1-darker: #b3bec9;\n--palette-5-light-1-r: 204;\n--palette-5-light-1-g: 211;\n--palette-5-light-1-b: 219;\n--palette-5-light-1-contrast: black;\n--palette-5-light-1-contrast-darker: black;\n--palette-5-light-1-text-color: var(--body-color);\n--palette-5-light-2: #e0e5eb;\n--palette-5-light-2-darker: #c4ced9;\n--palette-5-light-2-r: 224;\n--palette-5-light-2-g: 229;\n--palette-5-light-2-b: 235;\n--palette-5-light-2-contrast: black;\n--palette-5-light-2-contrast-darker: black;\n--palette-5-light-2-text-color: var(--body-color);\n--palette-5-light-3: #f5f7fa;\n--palette-5-light-3-darker: #d4dde9;\n--palette-5-light-3-r: 245;\n--palette-5-light-3-g: 247;\n--palette-5-light-3-b: 250;\n--palette-5-light-3-contrast: black;\n--palette-5-light-3-contrast-darker: black;\n--palette-5-light-3-text-color: var(--body-color);\n--grey-40: #999999;\n--grey-40-darker: #8a8a8a;\n--grey-40-r: 153;\n--grey-40-g: 153;\n--grey-40-b: 153;\n--grey-40-contrast: white;\n--grey-40-contrast-darker: white;\n--grey-40-text-color: var(--body-alt-color);\n--grey-30: #b3b3b3;\n--grey-30-darker: #a1a1a1;\n--grey-30-r: 179;\n--grey-30-g: 179;\n--grey-30-b: 179;\n--grey-30-contrast: white;\n--grey-30-contrast-darker: white;\n--grey-30-text-color: var(--body-alt-color);\n--grey-25: #c0c0c0;\n--grey-25-darker: #adadad;\n--grey-25-r: 192;\n--grey-25-g: 192;\n--grey-25-b: 192;\n--grey-25-contrast: black;\n--grey-25-contrast-darker: white;\n--grey-25-text-color: var(--body-color);\n--white: #ffffff;\n--white-darker: #e6e6e6;\n--white-r: 255;\n--white-g: 255;\n--white-b: 255;\n--white-contrast: black;\n--white-contrast-darker: black;\n--white-text-color: var(--body-color);\n--grey-15: #d9d9d9;\n--grey-15-darker: #c3c3c3;\n--grey-15-r: 217;\n--grey-15-g: 217;\n--grey-15-b: 217;\n--grey-15-contrast: black;\n--grey-15-contrast-darker: black;\n--grey-15-text-color: var(--body-color);\n--grey-10: #e5e5e5;\n--grey-10-darker: #cecece;\n--grey-10-r: 229;\n--grey-10-g: 229;\n--grey-10-b: 229;\n--grey-10-contrast: black;\n--grey-10-contrast-darker: black;\n--grey-10-text-color: var(--body-color);\n--grey-5: #f2f2f2;\n--grey-5-darker: #dadada;\n--grey-5-r: 242;\n--grey-5-g: 242;\n--grey-5-b: 242;\n--grey-5-contrast: black;\n--grey-5-contrast-darker: black;\n--grey-5-text-color: var(--body-color);\n--grey-90: #1a1a1a;\n--grey-90-darker: #171717;\n--grey-90-r: 26;\n--grey-90-g: 26;\n--grey-90-b: 26;\n--grey-90-contrast: white;\n--grey-90-contrast-darker: white;\n--grey-90-text-color: var(--body-alt-color);\n--grey-80: #333333;\n--grey-80-darker: #2e2e2e;\n--grey-80-r: 51;\n--grey-80-g: 51;\n--grey-80-b: 51;\n--grey-80-contrast: white;\n--grey-80-contrast-darker: white;\n--grey-80-text-color: var(--body-alt-color);\n--grey-75: #404040;\n--grey-75-darker: #3a3a3a;\n--grey-75-r: 64;\n--grey-75-g: 64;\n--grey-75-b: 64;\n--grey-75-contrast: white;\n--grey-75-contrast-darker: white;\n--grey-75-text-color: var(--body-alt-color);\n--black: #000000;\n--black-darker: #000000;\n--black-r: 0;\n--black-g: 0;\n--black-b: 0;\n--black-contrast: white;\n--black-contrast-darker: white;\n--black-text-color: var(--body-alt-color);\n--grey-70: #4d4d4d;\n--grey-70-darker: #454545;\n--grey-70-r: 77;\n--grey-70-g: 77;\n--grey-70-b: 77;\n--grey-70-contrast: white;\n--grey-70-contrast-darker: white;\n--grey-70-text-color: var(--body-alt-color);\n--grey-60: #666666;\n--grey-60-darker: #5c5c5c;\n--grey-60-r: 102;\n--grey-60-g: 102;\n--grey-60-b: 102;\n--grey-60-contrast: white;\n--grey-60-contrast-darker: white;\n--grey-60-text-color: var(--body-alt-color);\n--grey-50: #808080;\n--grey-50-darker: #737373;\n--grey-50-r: 128;\n--grey-50-g: 128;\n--grey-50-b: 128;\n--grey-50-contrast: white;\n--grey-50-contrast-darker: white;\n--grey-50-text-color: var(--body-alt-color);\n--grey-dark-3: #212121;\n--grey-dark-3-darker: #1e1e1e;\n--grey-dark-3-r: 33;\n--grey-dark-3-g: 33;\n--grey-dark-3-b: 33;\n--grey-dark-3-contrast: white;\n--grey-dark-3-contrast-darker: white;\n--grey-dark-3-text-color: var(--body-alt-color);\n--grey-dark-2: #333333;\n--grey-dark-2-darker: #2e2e2e;\n--grey-dark-2-r: 51;\n--grey-dark-2-g: 51;\n--grey-dark-2-b: 51;\n--grey-dark-2-contrast: white;\n--grey-dark-2-contrast-darker: white;\n--grey-dark-2-text-color: var(--body-alt-color);\n--grey-dark-1: #454545;\n--grey-dark-1-darker: #3e3e3e;\n--grey-dark-1-r: 69;\n--grey-dark-1-g: 69;\n--grey-dark-1-b: 69;\n--grey-dark-1-contrast: white;\n--grey-dark-1-contrast-darker: white;\n--grey-dark-1-text-color: var(--body-alt-color);\n--grey: #b3b3b3;\n--grey-darker: #a1a1a1;\n--grey-r: 179;\n--grey-g: 179;\n--grey-b: 179;\n--grey-contrast: white;\n--grey-contrast-darker: white;\n--grey-text-color: var(--body-alt-color);\n--grey-light-1: #d9d9d9;\n--grey-light-1-darker: #c3c3c3;\n--grey-light-1-r: 217;\n--grey-light-1-g: 217;\n--grey-light-1-b: 217;\n--grey-light-1-contrast: black;\n--grey-light-1-contrast-darker: black;\n--grey-light-1-text-color: var(--body-color);\n--grey-light-2: #eeeeee;\n--grey-light-2-darker: #d6d6d6;\n--grey-light-2-r: 238;\n--grey-light-2-g: 238;\n--grey-light-2-b: 238;\n--grey-light-2-contrast: black;\n--grey-light-2-contrast-darker: black;\n--grey-light-2-text-color: var(--body-color);\n--grey-light-3: #f6f6f6;\n--grey-light-3-darker: #dddddd;\n--grey-light-3-r: 246;\n--grey-light-3-g: 246;\n--grey-light-3-b: 246;\n--grey-light-3-contrast: black;\n--grey-light-3-contrast-darker: black;\n--grey-light-3-text-color: var(--body-color);\n--color-1-base: #654aff;\n--color-1-base-darker: #4929ff;\n--color-1-base-r: 101;\n--color-1-base-g: 74;\n--color-1-base-b: 255;\n--color-1-base-contrast: white;\n--color-1-base-contrast-darker: white;\n--color-1-base-text-color: var(--body-alt-color);\n--color-1-dark-3: #2a2933;\n--color-1-dark-3-darker: #26252e;\n--color-1-dark-3-r: 42;\n--color-1-dark-3-g: 41;\n--color-1-dark-3-b: 51;\n--color-1-dark-3-contrast: white;\n--color-1-dark-3-contrast-darker: white;\n--color-1-dark-3-text-color: var(--body-alt-color);\n--color-1-dark-2: #524b77;\n--color-1-dark-2-darker: #4a436b;\n--color-1-dark-2-r: 82;\n--color-1-dark-2-g: 75;\n--color-1-dark-2-b: 119;\n--color-1-dark-2-contrast: white;\n--color-1-dark-2-contrast-darker: white;\n--color-1-dark-2-text-color: var(--body-alt-color);\n--color-1-dark-1: #6556bb;\n--color-1-dark-1-darker: #5646af;\n--color-1-dark-1-r: 101;\n--color-1-dark-1-g: 86;\n--color-1-dark-1-b: 187;\n--color-1-dark-1-contrast: white;\n--color-1-dark-1-contrast-darker: white;\n--color-1-dark-1-text-color: var(--body-alt-color);\n--color-1: #654aff;\n--color-1-darker: #4929ff;\n--color-1-r: 101;\n--color-1-g: 74;\n--color-1-b: 255;\n--color-1-contrast: white;\n--color-1-contrast-darker: white;\n--color-1-text-color: var(--body-alt-color);\n--color-1-light-1: #9380ff;\n--color-1-light-1-darker: #725aff;\n--color-1-light-1-r: 147;\n--color-1-light-1-g: 128;\n--color-1-light-1-b: 255;\n--color-1-light-1-contrast: white;\n--color-1-light-1-contrast-darker: white;\n--color-1-light-1-text-color: var(--body-alt-color);\n--color-1-light-2: #c1b7ff;\n--color-1-light-2-darker: #9b8bff;\n--color-1-light-2-r: 193;\n--color-1-light-2-g: 183;\n--color-1-light-2-b: 255;\n--color-1-light-2-contrast: black;\n--color-1-light-2-contrast-darker: white;\n--color-1-light-2-text-color: var(--body-color);\n--color-1-light-3: #f0edff;\n--color-1-light-3-darker: #c7bcff;\n--color-1-light-3-r: 240;\n--color-1-light-3-g: 237;\n--color-1-light-3-b: 255;\n--color-1-light-3-contrast: black;\n--color-1-light-3-contrast-darker: black;\n--color-1-light-3-text-color: var(--body-color);\n--color-2-base: #5338ec;\n--color-2-base-darker: #3c1de9;\n--color-2-base-r: 83;\n--color-2-base-g: 56;\n--color-2-base-b: 236;\n--color-2-base-contrast: white;\n--color-2-base-contrast-darker: white;\n--color-2-base-text-color: var(--body-alt-color);\n--color-2-dark-3: #2a2933;\n--color-2-dark-3-darker: #26252e;\n--color-2-dark-3-r: 42;\n--color-2-dark-3-g: 41;\n--color-2-dark-3-b: 51;\n--color-2-dark-3-contrast: white;\n--color-2-dark-3-contrast-darker: white;\n--color-2-dark-3-text-color: var(--body-alt-color);\n--color-2-dark-2: #4c4571;\n--color-2-dark-2-darker: #443e66;\n--color-2-dark-2-r: 76;\n--color-2-dark-2-g: 69;\n--color-2-dark-2-b: 113;\n--color-2-dark-2-contrast: white;\n--color-2-dark-2-contrast-darker: white;\n--color-2-dark-2-text-color: var(--body-alt-color);\n--color-2-dark-1: #594aae;\n--color-2-dark-1-darker: #50439d;\n--color-2-dark-1-r: 89;\n--color-2-dark-1-g: 74;\n--color-2-dark-1-b: 174;\n--color-2-dark-1-contrast: white;\n--color-2-dark-1-contrast-darker: white;\n--color-2-dark-1-text-color: var(--body-alt-color);\n--color-2: #5338ec;\n--color-2-darker: #3c1de9;\n--color-2-r: 83;\n--color-2-g: 56;\n--color-2-b: 236;\n--color-2-contrast: white;\n--color-2-contrast-darker: white;\n--color-2-text-color: var(--body-alt-color);\n--color-2-light-1: #8471f2;\n--color-2-light-1-darker: #6850ef;\n--color-2-light-1-r: 132;\n--color-2-light-1-g: 113;\n--color-2-light-1-b: 242;\n--color-2-light-1-contrast: white;\n--color-2-light-1-contrast-darker: white;\n--color-2-light-1-text-color: var(--body-alt-color);\n--color-2-light-2: #b7acf7;\n--color-2-light-2-darker: #9686f3;\n--color-2-light-2-r: 183;\n--color-2-light-2-g: 172;\n--color-2-light-2-b: 247;\n--color-2-light-2-contrast: white;\n--color-2-light-2-contrast-darker: white;\n--color-2-light-2-text-color: var(--body-alt-color);\n--color-2-light-3: #edeafd;\n--color-2-light-3-darker: #c7bef9;\n--color-2-light-3-r: 237;\n--color-2-light-3-g: 234;\n--color-2-light-3-b: 253;\n--color-2-light-3-contrast: black;\n--color-2-light-3-contrast-darker: black;\n--color-2-light-3-text-color: var(--body-color);\n--color-3-base: #f1c50e;\n--color-3-base-darker: #d9b10d;\n--color-3-base-r: 241;\n--color-3-base-g: 197;\n--color-3-base-b: 14;\n--color-3-base-contrast: black;\n--color-3-base-contrast-darker: white;\n--color-3-base-text-color: var(--body-color);\n--color-3-dark-3: #333129;\n--color-3-dark-3-darker: #2e2c25;\n--color-3-dark-3-r: 51;\n--color-3-dark-3-g: 49;\n--color-3-dark-3-b: 41;\n--color-3-dark-3-contrast: white;\n--color-3-dark-3-contrast-darker: white;\n--color-3-dark-3-text-color: var(--body-alt-color);\n--color-3-dark-2: #72683f;\n--color-3-dark-2-darker: #675e39;\n--color-3-dark-2-r: 114;\n--color-3-dark-2-g: 104;\n--color-3-dark-2-b: 63;\n--color-3-dark-2-contrast: white;\n--color-3-dark-2-contrast-darker: white;\n--color-3-dark-2-text-color: var(--body-alt-color);\n--color-3-dark-1: #b29a36;\n--color-3-dark-1-darker: #a08b31;\n--color-3-dark-1-r: 178;\n--color-3-dark-1-g: 154;\n--color-3-dark-1-b: 54;\n--color-3-dark-1-contrast: white;\n--color-3-dark-1-contrast-darker: white;\n--color-3-dark-1-text-color: var(--body-alt-color);\n--color-3: #f1c50e;\n--color-3-darker: #d9b10d;\n--color-3-r: 241;\n--color-3-g: 197;\n--color-3-b: 14;\n--color-3-contrast: black;\n--color-3-contrast-darker: white;\n--color-3-text-color: var(--body-color);\n--color-3-light-1: #f5d654;\n--color-3-light-1-darker: #f3cf35;\n--color-3-light-1-r: 245;\n--color-3-light-1-g: 214;\n--color-3-light-1-b: 84;\n--color-3-light-1-contrast: black;\n--color-3-light-1-contrast-darker: black;\n--color-3-light-1-text-color: var(--body-color);\n--color-3-light-2: #f9e79b;\n--color-3-light-2-darker: #f7de75;\n--color-3-light-2-r: 249;\n--color-3-light-2-g: 231;\n--color-3-light-2-b: 155;\n--color-3-light-2-contrast: black;\n--color-3-light-2-contrast-darker: black;\n--color-3-light-2-text-color: var(--body-color);\n--color-3-light-3: #fef9e6;\n--color-3-light-3-darker: #fceeb7;\n--color-3-light-3-r: 254;\n--color-3-light-3-g: 249;\n--color-3-light-3-b: 230;\n--color-3-light-3-contrast: black;\n--color-3-light-3-contrast-darker: black;\n--color-3-light-3-text-color: var(--body-color);\n--color-4-base: #2cccc4;\n--color-4-base-darker: #28b8b0;\n--color-4-base-r: 44;\n--color-4-base-g: 204;\n--color-4-base-b: 196;\n--color-4-base-contrast: white;\n--color-4-base-contrast-darker: white;\n--color-4-base-text-color: var(--body-alt-color);\n--color-4-dark-3: #293332;\n--color-4-dark-3-darker: #252e2d;\n--color-4-dark-3-r: 41;\n--color-4-dark-3-g: 51;\n--color-4-dark-3-b: 50;\n--color-4-dark-3-contrast: white;\n--color-4-dark-3-contrast-darker: white;\n--color-4-dark-3-text-color: var(--body-alt-color);\n--color-4-dark-2: #41807c;\n--color-4-dark-2-darker: #3a7370;\n--color-4-dark-2-r: 65;\n--color-4-dark-2-g: 128;\n--color-4-dark-2-b: 124;\n--color-4-dark-2-contrast: white;\n--color-4-dark-2-contrast-darker: white;\n--color-4-dark-2-text-color: var(--body-alt-color);\n--color-4-dark-1: #2cccc4;\n--color-4-dark-1-darker: #28b8b0;\n--color-4-dark-1-r: 44;\n--color-4-dark-1-g: 204;\n--color-4-dark-1-b: 196;\n--color-4-dark-1-contrast: white;\n--color-4-dark-1-contrast-darker: white;\n--color-4-dark-1-text-color: var(--body-alt-color);\n--color-4: #3be8e0;\n--color-4-darker: #21e5dc;\n--color-4-r: 59;\n--color-4-g: 232;\n--color-4-b: 224;\n--color-4-contrast: black;\n--color-4-contrast-darker: black;\n--color-4-text-color: var(--body-color);\n--color-4-light-1: #72efe9;\n--color-4-light-1-darker: #52ebe4;\n--color-4-light-1-r: 114;\n--color-4-light-1-g: 239;\n--color-4-light-1-b: 233;\n--color-4-light-1-contrast: black;\n--color-4-light-1-contrast-darker: black;\n--color-4-light-1-text-color: var(--body-color);\n--color-4-light-2: #adf6f2;\n--color-4-light-2-darker: #87f2ec;\n--color-4-light-2-r: 173;\n--color-4-light-2-g: 246;\n--color-4-light-2-b: 242;\n--color-4-light-2-contrast: black;\n--color-4-light-2-contrast-darker: black;\n--color-4-light-2-text-color: var(--body-color);\n--color-4-light-3: #eafdfc;\n--color-4-light-3-darker: #bef9f6;\n--color-4-light-3-r: 234;\n--color-4-light-3-g: 253;\n--color-4-light-3-b: 252;\n--color-4-light-3-contrast: black;\n--color-4-light-3-contrast-darker: black;\n--color-4-light-3-text-color: var(--body-color);\n--color-5-base: #b9c1cc;\n--color-5-base-darker: #a2adbc;\n--color-5-base-r: 185;\n--color-5-base-g: 193;\n--color-5-base-b: 204;\n--color-5-base-contrast: black;\n--color-5-base-contrast-darker: white;\n--color-5-base-text-color: var(--body-color);\n--color-5-dark-3: #292d33;\n--color-5-dark-3-darker: #25292e;\n--color-5-dark-3-r: 41;\n--color-5-dark-3-g: 45;\n--color-5-dark-3-b: 51;\n--color-5-dark-3-contrast: white;\n--color-5-dark-3-contrast-darker: white;\n--color-5-dark-3-text-color: var(--body-alt-color);\n--color-5-dark-2: #555c66;\n--color-5-dark-2-darker: #4d535c;\n--color-5-dark-2-r: 85;\n--color-5-dark-2-g: 92;\n--color-5-dark-2-b: 102;\n--color-5-dark-2-contrast: white;\n--color-5-dark-2-contrast-darker: white;\n--color-5-dark-2-text-color: var(--body-alt-color);\n--color-5-dark-1: #858e99;\n--color-5-dark-1-darker: #75808c;\n--color-5-dark-1-r: 133;\n--color-5-dark-1-g: 142;\n--color-5-dark-1-b: 153;\n--color-5-dark-1-contrast: white;\n--color-5-dark-1-contrast-darker: white;\n--color-5-dark-1-text-color: var(--body-alt-color);\n--color-5: #b9c1cc;\n--color-5-darker: #a2adbc;\n--color-5-r: 185;\n--color-5-g: 193;\n--color-5-b: 204;\n--color-5-contrast: black;\n--color-5-contrast-darker: white;\n--color-5-text-color: var(--body-color);\n--color-5-light-1: #ccd3db;\n--color-5-light-1-darker: #b3bec9;\n--color-5-light-1-r: 204;\n--color-5-light-1-g: 211;\n--color-5-light-1-b: 219;\n--color-5-light-1-contrast: black;\n--color-5-light-1-contrast-darker: black;\n--color-5-light-1-text-color: var(--body-color);\n--color-5-light-2: #e0e5eb;\n--color-5-light-2-darker: #c4ced9;\n--color-5-light-2-r: 224;\n--color-5-light-2-g: 229;\n--color-5-light-2-b: 235;\n--color-5-light-2-contrast: black;\n--color-5-light-2-contrast-darker: black;\n--color-5-light-2-text-color: var(--body-color);\n--color-5-light-3: #f5f7fa;\n--color-5-light-3-darker: #d4dde9;\n--color-5-light-3-r: 245;\n--color-5-light-3-g: 247;\n--color-5-light-3-b: 250;\n--color-5-light-3-contrast: black;\n--color-5-light-3-contrast-darker: black;\n--color-5-light-3-text-color: var(--body-color);\n--white-contrast: var(--body-color);\n--shading-contrast: var(--body-alt-color);\n--bg-contrast: var(--body-color);\n}.u-custom-color-1,\n        .u-body.u-custom-color-1,\n        section.u-custom-color-1:before,\n        .u-custom-color-1 > .u-audio-main-layout-wrapper:before,\n        .u-custom-color-1 > .u-container-layout:before,\n        .u-custom-color-1 > .u-inner-container-layout:before,\n        .u-custom-color-1.u-sidenav:before,\n        .u-container-layout.u-container-layout.u-custom-color-1:before,\n        .u-table-alt-custom-color-1 tr:nth-child(even)\n        {\n            color: var(--custom-color-1-text-color);\n            background-color: var(--custom-color-1);\n        }\n\n        .u-input.u-custom-color-1,\n        .u-field-input.u-custom-color-1,\n        .u-button-style.u-custom-color-1,\n        .u-button-style.u-custom-color-1[class*=\"u-border-\"]\n        {\n            color: var(--custom-color-1-text-color) !important;\n            background-color: var(--custom-color-1) !important;\n        }\n\n        .u-button-style.u-custom-color-1:hover,\n        .u-button-style.u-custom-color-1[class*=\"u-border-\"]:hover,\n        .u-button-style.u-custom-color-1:focus,\n        .u-button-style.u-custom-color-1[class*=\"u-border-\"]:focus,\n        .u-button-style.u-button-style.u-custom-color-1:active,\n        .u-button-style.u-button-style.u-custom-color-1[class*=\"u-border-\"]:active,\n        .u-button-style.u-button-style.u-custom-color-1.active,\n        .u-button-style.u-button-style.u-custom-color-1[class*=\"u-border-\"].active,\n        li.active > .u-button-style.u-button-style.u-custom-color-1,\n        li.active > .u-button-style.u-button-style.u-custom-color-1[class*=\"u-border-\"]\n        {\n            color: var(--custom-color-1-text-color) !important;\n            background-color: var(--custom-color-1-darker) !important;\n        }\n\n        .u-hover-custom-color-1:hover,\n        .u-hover-custom-color-1[class*=\"u-border-\"]:hover,\n        .u-hover-custom-color-1:focus,\n        .u-hover-custom-color-1[class*=\"u-border-\"]:focus,\n        .u-active-custom-color-1.u-active.u-active,\n        .u-active-custom-color-1[class*=\"u-border-\"].u-active.u-active,\n        a.u-button-style.u-hover-custom-color-1:hover,\n        a.u-button-style.u-hover-custom-color-1.hover,\n        a.u-button-style.u-hover-custom-color-1[class*=\"u-border-\"]:hover,\n        a.u-button-style.u-hover-custom-color-1[class*=\"u-border-\"].hover,\n        a.u-button-style:hover > .u-hover-custom-color-1,\n        a.u-button-style:hover > .u-hover-custom-color-1[class*=\"u-border-\"],\n        a.u-button-style.u-hover-custom-color-1:focus,\n        a.u-button-style.u-hover-custom-color-1[class*=\"u-border-\"]:focus,\n        a.u-button-style.u-button-style.u-active-custom-color-1:active,\n        a.u-button-style.u-button-style.u-active-custom-color-1[class*=\"u-border-\"]:active,\n        a.u-button-style.u-button-style.u-active-custom-color-1.active,\n        a.u-button-style.u-button-style.u-active-custom-color-1[class*=\"u-border-\"].active,\n        a.u-button-style.u-button-style.active > .u-active-custom-color-1,\n        a.u-button-style.u-button-style.active > .u-active-custom-color-1[class*=\"u-border-\"],\n        li.active > a.u-button-style.u-button-style.u-active-custom-color-1,\n        li.active > a.u-button-style.u-button-style.u-active-custom-color-1[class*=\"u-border-\"],\n        input.u-field-input.u-field-input.u-active-custom-color-1:checked\n        {\n            color: var(--custom-color-1-text-color) !important;\n            background-color: var(--custom-color-1) !important;\n        }\n\n        a.u-link.u-hover-custom-color-1:hover {\n            color: var(--custom-color-1) !important;\n        }\n\n        \n        \n        .u-custom-color-2,\n        .u-body.u-custom-color-2,\n        section.u-custom-color-2:before,\n        .u-custom-color-2 > .u-audio-main-layout-wrapper:before,\n        .u-custom-color-2 > .u-container-layout:before,\n        .u-custom-color-2 > .u-inner-container-layout:before,\n        .u-custom-color-2.u-sidenav:before,\n        .u-container-layout.u-container-layout.u-custom-color-2:before,\n        .u-table-alt-custom-color-2 tr:nth-child(even)\n        {\n            color: var(--custom-color-2-text-color);\n            background-color: var(--custom-color-2);\n        }\n\n        .u-input.u-custom-color-2,\n        .u-field-input.u-custom-color-2,\n        .u-button-style.u-custom-color-2,\n        .u-button-style.u-custom-color-2[class*=\"u-border-\"]\n        {\n            color: var(--custom-color-2-text-color) !important;\n            background-color: var(--custom-color-2) !important;\n        }\n\n        .u-button-style.u-custom-color-2:hover,\n        .u-button-style.u-custom-color-2[class*=\"u-border-\"]:hover,\n        .u-button-style.u-custom-color-2:focus,\n        .u-button-style.u-custom-color-2[class*=\"u-border-\"]:focus,\n        .u-button-style.u-button-style.u-custom-color-2:active,\n        .u-button-style.u-button-style.u-custom-color-2[class*=\"u-border-\"]:active,\n        .u-button-style.u-button-style.u-custom-color-2.active,\n        .u-button-style.u-button-style.u-custom-color-2[class*=\"u-border-\"].active,\n        li.active > .u-button-style.u-button-style.u-custom-color-2,\n        li.active > .u-button-style.u-button-style.u-custom-color-2[class*=\"u-border-\"]\n        {\n            color: var(--custom-color-2-text-color) !important;\n            background-color: var(--custom-color-2-darker) !important;\n        }\n\n        .u-hover-custom-color-2:hover,\n        .u-hover-custom-color-2[class*=\"u-border-\"]:hover,\n        .u-hover-custom-color-2:focus,\n        .u-hover-custom-color-2[class*=\"u-border-\"]:focus,\n        .u-active-custom-color-2.u-active.u-active,\n        .u-active-custom-color-2[class*=\"u-border-\"].u-active.u-active,\n        a.u-button-style.u-hover-custom-color-2:hover,\n        a.u-button-style.u-hover-custom-color-2.hover,\n        a.u-button-style.u-hover-custom-color-2[class*=\"u-border-\"]:hover,\n        a.u-button-style.u-hover-custom-color-2[class*=\"u-border-\"].hover,\n        a.u-button-style:hover > .u-hover-custom-color-2,\n        a.u-button-style:hover > .u-hover-custom-color-2[class*=\"u-border-\"],\n        a.u-button-style.u-hover-custom-color-2:focus,\n        a.u-button-style.u-hover-custom-color-2[class*=\"u-border-\"]:focus,\n        a.u-button-style.u-button-style.u-active-custom-color-2:active,\n        a.u-button-style.u-button-style.u-active-custom-color-2[class*=\"u-border-\"]:active,\n        a.u-button-style.u-button-style.u-active-custom-color-2.active,\n        a.u-button-style.u-button-style.u-active-custom-color-2[class*=\"u-border-\"].active,\n        a.u-button-style.u-button-style.active > .u-active-custom-color-2,\n        a.u-button-style.u-button-style.active > .u-active-custom-color-2[class*=\"u-border-\"],\n        li.active > a.u-button-style.u-button-style.u-active-custom-color-2,\n        li.active > a.u-button-style.u-button-style.u-active-custom-color-2[class*=\"u-border-\"],\n        input.u-field-input.u-field-input.u-active-custom-color-2:checked\n        {\n            color: var(--custom-color-2-text-color) !important;\n            background-color: var(--custom-color-2) !important;\n        }\n\n        a.u-link.u-hover-custom-color-2:hover {\n            color: var(--custom-color-2) !important;\n        }\n\n        \n        \n        .u-custom-color-3,\n        .u-body.u-custom-color-3,\n        section.u-custom-color-3:before,\n        .u-custom-color-3 > .u-audio-main-layout-wrapper:before,\n        .u-custom-color-3 > .u-container-layout:before,\n        .u-custom-color-3 > .u-inner-container-layout:before,\n        .u-custom-color-3.u-sidenav:before,\n        .u-container-layout.u-container-layout.u-custom-color-3:before,\n        .u-table-alt-custom-color-3 tr:nth-child(even)\n        {\n            color: var(--custom-color-3-text-color);\n            background-color: var(--custom-color-3);\n        }\n\n        .u-input.u-custom-color-3,\n        .u-field-input.u-custom-color-3,\n        .u-button-style.u-custom-color-3,\n        .u-button-style.u-custom-color-3[class*=\"u-border-\"]\n        {\n            color: var(--custom-color-3-text-color) !important;\n            background-color: var(--custom-color-3) !important;\n        }\n\n        .u-button-style.u-custom-color-3:hover,\n        .u-button-style.u-custom-color-3[class*=\"u-border-\"]:hover,\n        .u-button-style.u-custom-color-3:focus,\n        .u-button-style.u-custom-color-3[class*=\"u-border-\"]:focus,\n        .u-button-style.u-button-style.u-custom-color-3:active,\n        .u-button-style.u-button-style.u-custom-color-3[class*=\"u-border-\"]:active,\n        .u-button-style.u-button-style.u-custom-color-3.active,\n        .u-button-style.u-button-style.u-custom-color-3[class*=\"u-border-\"].active,\n        li.active > .u-button-style.u-button-style.u-custom-color-3,\n        li.active > .u-button-style.u-button-style.u-custom-color-3[class*=\"u-border-\"]\n        {\n            color: var(--custom-color-3-text-color) !important;\n            background-color: var(--custom-color-3-darker) !important;\n        }\n\n        .u-hover-custom-color-3:hover,\n        .u-hover-custom-color-3[class*=\"u-border-\"]:hover,\n        .u-hover-custom-color-3:focus,\n        .u-hover-custom-color-3[class*=\"u-border-\"]:focus,\n        .u-active-custom-color-3.u-active.u-active,\n        .u-active-custom-color-3[class*=\"u-border-\"].u-active.u-active,\n        a.u-button-style.u-hover-custom-color-3:hover,\n        a.u-button-style.u-hover-custom-color-3.hover,\n        a.u-button-style.u-hover-custom-color-3[class*=\"u-border-\"]:hover,\n        a.u-button-style.u-hover-custom-color-3[class*=\"u-border-\"].hover,\n        a.u-button-style:hover > .u-hover-custom-color-3,\n        a.u-button-style:hover > .u-hover-custom-color-3[class*=\"u-border-\"],\n        a.u-button-style.u-hover-custom-color-3:focus,\n        a.u-button-style.u-hover-custom-color-3[class*=\"u-border-\"]:focus,\n        a.u-button-style.u-button-style.u-active-custom-color-3:active,\n        a.u-button-style.u-button-style.u-active-custom-color-3[class*=\"u-border-\"]:active,\n        a.u-button-style.u-button-style.u-active-custom-color-3.active,\n        a.u-button-style.u-button-style.u-active-custom-color-3[class*=\"u-border-\"].active,\n        a.u-button-style.u-button-style.active > .u-active-custom-color-3,\n        a.u-button-style.u-button-style.active > .u-active-custom-color-3[class*=\"u-border-\"],\n        li.active > a.u-button-style.u-button-style.u-active-custom-color-3,\n        li.active > a.u-button-style.u-button-style.u-active-custom-color-3[class*=\"u-border-\"],\n        input.u-field-input.u-field-input.u-active-custom-color-3:checked\n        {\n            color: var(--custom-color-3-text-color) !important;\n            background-color: var(--custom-color-3) !important;\n        }\n\n        a.u-link.u-hover-custom-color-3:hover {\n            color: var(--custom-color-3) !important;\n        }\n\n        \n        \n        .u-custom-color-4,\n        .u-body.u-custom-color-4,\n        section.u-custom-color-4:before,\n        .u-custom-color-4 > .u-audio-main-layout-wrapper:before,\n        .u-custom-color-4 > .u-container-layout:before,\n        .u-custom-color-4 > .u-inner-container-layout:before,\n        .u-custom-color-4.u-sidenav:before,\n        .u-container-layout.u-container-layout.u-custom-color-4:before,\n        .u-table-alt-custom-color-4 tr:nth-child(even)\n        {\n            color: var(--custom-color-4-text-color);\n            background-color: var(--custom-color-4);\n        }\n\n        .u-input.u-custom-color-4,\n        .u-field-input.u-custom-color-4,\n        .u-button-style.u-custom-color-4,\n        .u-button-style.u-custom-color-4[class*=\"u-border-\"]\n        {\n            color: var(--custom-color-4-text-color) !important;\n            background-color: var(--custom-color-4) !important;\n        }\n\n        .u-button-style.u-custom-color-4:hover,\n        .u-button-style.u-custom-color-4[class*=\"u-border-\"]:hover,\n        .u-button-style.u-custom-color-4:focus,\n        .u-button-style.u-custom-color-4[class*=\"u-border-\"]:focus,\n        .u-button-style.u-button-style.u-custom-color-4:active,\n        .u-button-style.u-button-style.u-custom-color-4[class*=\"u-border-\"]:active,\n        .u-button-style.u-button-style.u-custom-color-4.active,\n        .u-button-style.u-button-style.u-custom-color-4[class*=\"u-border-\"].active,\n        li.active > .u-button-style.u-button-style.u-custom-color-4,\n        li.active > .u-button-style.u-button-style.u-custom-color-4[class*=\"u-border-\"]\n        {\n            color: var(--custom-color-4-text-color) !important;\n            background-color: var(--custom-color-4-darker) !important;\n        }\n\n        .u-hover-custom-color-4:hover,\n        .u-hover-custom-color-4[class*=\"u-border-\"]:hover,\n        .u-hover-custom-color-4:focus,\n        .u-hover-custom-color-4[class*=\"u-border-\"]:focus,\n        .u-active-custom-color-4.u-active.u-active,\n        .u-active-custom-color-4[class*=\"u-border-\"].u-active.u-active,\n        a.u-button-style.u-hover-custom-color-4:hover,\n        a.u-button-style.u-hover-custom-color-4.hover,\n        a.u-button-style.u-hover-custom-color-4[class*=\"u-border-\"]:hover,\n        a.u-button-style.u-hover-custom-color-4[class*=\"u-border-\"].hover,\n        a.u-button-style:hover > .u-hover-custom-color-4,\n        a.u-button-style:hover > .u-hover-custom-color-4[class*=\"u-border-\"],\n        a.u-button-style.u-hover-custom-color-4:focus,\n        a.u-button-style.u-hover-custom-color-4[class*=\"u-border-\"]:focus,\n        a.u-button-style.u-button-style.u-active-custom-color-4:active,\n        a.u-button-style.u-button-style.u-active-custom-color-4[class*=\"u-border-\"]:active,\n        a.u-button-style.u-button-style.u-active-custom-color-4.active,\n        a.u-button-style.u-button-style.u-active-custom-color-4[class*=\"u-border-\"].active,\n        a.u-button-style.u-button-style.active > .u-active-custom-color-4,\n        a.u-button-style.u-button-style.active > .u-active-custom-color-4[class*=\"u-border-\"],\n        li.active > a.u-button-style.u-button-style.u-active-custom-color-4,\n        li.active > a.u-button-style.u-button-style.u-active-custom-color-4[class*=\"u-border-\"],\n        input.u-field-input.u-field-input.u-active-custom-color-4:checked\n        {\n            color: var(--custom-color-4-text-color) !important;\n            background-color: var(--custom-color-4) !important;\n        }\n\n        a.u-link.u-hover-custom-color-4:hover {\n            color: var(--custom-color-4) !important;\n        }\n\n        \n        \n        .u-custom-color-5,\n        .u-body.u-custom-color-5,\n        section.u-custom-color-5:before,\n        .u-custom-color-5 > .u-audio-main-layout-wrapper:before,\n        .u-custom-color-5 > .u-container-layout:before,\n        .u-custom-color-5 > .u-inner-container-layout:before,\n        .u-custom-color-5.u-sidenav:before,\n        .u-container-layout.u-container-layout.u-custom-color-5:before,\n        .u-table-alt-custom-color-5 tr:nth-child(even)\n        {\n            color: var(--custom-color-5-text-color);\n            background-color: var(--custom-color-5);\n        }\n\n        .u-input.u-custom-color-5,\n        .u-field-input.u-custom-color-5,\n        .u-button-style.u-custom-color-5,\n        .u-button-style.u-custom-color-5[class*=\"u-border-\"]\n        {\n            color: var(--custom-color-5-text-color) !important;\n            background-color: var(--custom-color-5) !important;\n        }\n\n        .u-button-style.u-custom-color-5:hover,\n        .u-button-style.u-custom-color-5[class*=\"u-border-\"]:hover,\n        .u-button-style.u-custom-color-5:focus,\n        .u-button-style.u-custom-color-5[class*=\"u-border-\"]:focus,\n        .u-button-style.u-button-style.u-custom-color-5:active,\n        .u-button-style.u-button-style.u-custom-color-5[class*=\"u-border-\"]:active,\n        .u-button-style.u-button-style.u-custom-color-5.active,\n        .u-button-style.u-button-style.u-custom-color-5[class*=\"u-border-\"].active,\n        li.active > .u-button-style.u-button-style.u-custom-color-5,\n        li.active > .u-button-style.u-button-style.u-custom-color-5[class*=\"u-border-\"]\n        {\n            color: var(--custom-color-5-text-color) !important;\n            background-color: var(--custom-color-5-darker) !important;\n        }\n\n        .u-hover-custom-color-5:hover,\n        .u-hover-custom-color-5[class*=\"u-border-\"]:hover,\n        .u-hover-custom-color-5:focus,\n        .u-hover-custom-color-5[class*=\"u-border-\"]:focus,\n        .u-active-custom-color-5.u-active.u-active,\n        .u-active-custom-color-5[class*=\"u-border-\"].u-active.u-active,\n        a.u-button-style.u-hover-custom-color-5:hover,\n        a.u-button-style.u-hover-custom-color-5.hover,\n        a.u-button-style.u-hover-custom-color-5[class*=\"u-border-\"]:hover,\n        a.u-button-style.u-hover-custom-color-5[class*=\"u-border-\"].hover,\n        a.u-button-style:hover > .u-hover-custom-color-5,\n        a.u-button-style:hover > .u-hover-custom-color-5[class*=\"u-border-\"],\n        a.u-button-style.u-hover-custom-color-5:focus,\n        a.u-button-style.u-hover-custom-color-5[class*=\"u-border-\"]:focus,\n        a.u-button-style.u-button-style.u-active-custom-color-5:active,\n        a.u-button-style.u-button-style.u-active-custom-color-5[class*=\"u-border-\"]:active,\n        a.u-button-style.u-button-style.u-active-custom-color-5.active,\n        a.u-button-style.u-button-style.u-active-custom-color-5[class*=\"u-border-\"].active,\n        a.u-button-style.u-button-style.active > .u-active-custom-color-5,\n        a.u-button-style.u-button-style.active > .u-active-custom-color-5[class*=\"u-border-\"],\n        li.active > a.u-button-style.u-button-style.u-active-custom-color-5,\n        li.active > a.u-button-style.u-button-style.u-active-custom-color-5[class*=\"u-border-\"],\n        input.u-field-input.u-field-input.u-active-custom-color-5:checked\n        {\n            color: var(--custom-color-5-text-color) !important;\n            background-color: var(--custom-color-5) !important;\n        }\n\n        a.u-link.u-hover-custom-color-5:hover {\n            color: var(--custom-color-5) !important;\n        }\n\n        \n        \n        .u-custom-color-6,\n        .u-body.u-custom-color-6,\n        section.u-custom-color-6:before,\n        .u-custom-color-6 > .u-audio-main-layout-wrapper:before,\n        .u-custom-color-6 > .u-container-layout:before,\n        .u-custom-color-6 > .u-inner-container-layout:before,\n        .u-custom-color-6.u-sidenav:before,\n        .u-container-layout.u-container-layout.u-custom-color-6:before,\n        .u-table-alt-custom-color-6 tr:nth-child(even)\n        {\n            color: var(--custom-color-6-text-color);\n            background-color: var(--custom-color-6);\n        }\n\n        .u-input.u-custom-color-6,\n        .u-field-input.u-custom-color-6,\n        .u-button-style.u-custom-color-6,\n        .u-button-style.u-custom-color-6[class*=\"u-border-\"]\n        {\n            color: var(--custom-color-6-text-color) !important;\n            background-color: var(--custom-color-6) !important;\n        }\n\n        .u-button-style.u-custom-color-6:hover,\n        .u-button-style.u-custom-color-6[class*=\"u-border-\"]:hover,\n        .u-button-style.u-custom-color-6:focus,\n        .u-button-style.u-custom-color-6[class*=\"u-border-\"]:focus,\n        .u-button-style.u-button-style.u-custom-color-6:active,\n        .u-button-style.u-button-style.u-custom-color-6[class*=\"u-border-\"]:active,\n        .u-button-style.u-button-style.u-custom-color-6.active,\n        .u-button-style.u-button-style.u-custom-color-6[class*=\"u-border-\"].active,\n        li.active > .u-button-style.u-button-style.u-custom-color-6,\n        li.active > .u-button-style.u-button-style.u-custom-color-6[class*=\"u-border-\"]\n        {\n            color: var(--custom-color-6-text-color) !important;\n            background-color: var(--custom-color-6-darker) !important;\n        }\n\n        .u-hover-custom-color-6:hover,\n        .u-hover-custom-color-6[class*=\"u-border-\"]:hover,\n        .u-hover-custom-color-6:focus,\n        .u-hover-custom-color-6[class*=\"u-border-\"]:focus,\n        .u-active-custom-color-6.u-active.u-active,\n        .u-active-custom-color-6[class*=\"u-border-\"].u-active.u-active,\n        a.u-button-style.u-hover-custom-color-6:hover,\n        a.u-button-style.u-hover-custom-color-6.hover,\n        a.u-button-style.u-hover-custom-color-6[class*=\"u-border-\"]:hover,\n        a.u-button-style.u-hover-custom-color-6[class*=\"u-border-\"].hover,\n        a.u-button-style:hover > .u-hover-custom-color-6,\n        a.u-button-style:hover > .u-hover-custom-color-6[class*=\"u-border-\"],\n        a.u-button-style.u-hover-custom-color-6:focus,\n        a.u-button-style.u-hover-custom-color-6[class*=\"u-border-\"]:focus,\n        a.u-button-style.u-button-style.u-active-custom-color-6:active,\n        a.u-button-style.u-button-style.u-active-custom-color-6[class*=\"u-border-\"]:active,\n        a.u-button-style.u-button-style.u-active-custom-color-6.active,\n        a.u-button-style.u-button-style.u-active-custom-color-6[class*=\"u-border-\"].active,\n        a.u-button-style.u-button-style.active > .u-active-custom-color-6,\n        a.u-button-style.u-button-style.active > .u-active-custom-color-6[class*=\"u-border-\"],\n        li.active > a.u-button-style.u-button-style.u-active-custom-color-6,\n        li.active > a.u-button-style.u-button-style.u-active-custom-color-6[class*=\"u-border-\"],\n        input.u-field-input.u-field-input.u-active-custom-color-6:checked\n        {\n            color: var(--custom-color-6-text-color) !important;\n            background-color: var(--custom-color-6) !important;\n        }\n\n        a.u-link.u-hover-custom-color-6:hover {\n            color: var(--custom-color-6) !important;\n        }\n\n        \n        \n        .u-custom-color-7,\n        .u-body.u-custom-color-7,\n        section.u-custom-color-7:before,\n        .u-custom-color-7 > .u-audio-main-layout-wrapper:before,\n        .u-custom-color-7 > .u-container-layout:before,\n        .u-custom-color-7 > .u-inner-container-layout:before,\n        .u-custom-color-7.u-sidenav:before,\n        .u-container-layout.u-container-layout.u-custom-color-7:before,\n        .u-table-alt-custom-color-7 tr:nth-child(even)\n        {\n            color: var(--custom-color-7-text-color);\n            background-color: var(--custom-color-7);\n        }\n\n        .u-input.u-custom-color-7,\n        .u-field-input.u-custom-color-7,\n        .u-button-style.u-custom-color-7,\n        .u-button-style.u-custom-color-7[class*=\"u-border-\"]\n        {\n            color: var(--custom-color-7-text-color) !important;\n            background-color: var(--custom-color-7) !important;\n        }\n\n        .u-button-style.u-custom-color-7:hover,\n        .u-button-style.u-custom-color-7[class*=\"u-border-\"]:hover,\n        .u-button-style.u-custom-color-7:focus,\n        .u-button-style.u-custom-color-7[class*=\"u-border-\"]:focus,\n        .u-button-style.u-button-style.u-custom-color-7:active,\n        .u-button-style.u-button-style.u-custom-color-7[class*=\"u-border-\"]:active,\n        .u-button-style.u-button-style.u-custom-color-7.active,\n        .u-button-style.u-button-style.u-custom-color-7[class*=\"u-border-\"].active,\n        li.active > .u-button-style.u-button-style.u-custom-color-7,\n        li.active > .u-button-style.u-button-style.u-custom-color-7[class*=\"u-border-\"]\n        {\n            color: var(--custom-color-7-text-color) !important;\n            background-color: var(--custom-color-7-darker) !important;\n        }\n\n        .u-hover-custom-color-7:hover,\n        .u-hover-custom-color-7[class*=\"u-border-\"]:hover,\n        .u-hover-custom-color-7:focus,\n        .u-hover-custom-color-7[class*=\"u-border-\"]:focus,\n        .u-active-custom-color-7.u-active.u-active,\n        .u-active-custom-color-7[class*=\"u-border-\"].u-active.u-active,\n        a.u-button-style.u-hover-custom-color-7:hover,\n        a.u-button-style.u-hover-custom-color-7.hover,\n        a.u-button-style.u-hover-custom-color-7[class*=\"u-border-\"]:hover,\n        a.u-button-style.u-hover-custom-color-7[class*=\"u-border-\"].hover,\n        a.u-button-style:hover > .u-hover-custom-color-7,\n        a.u-button-style:hover > .u-hover-custom-color-7[class*=\"u-border-\"],\n        a.u-button-style.u-hover-custom-color-7:focus,\n        a.u-button-style.u-hover-custom-color-7[class*=\"u-border-\"]:focus,\n        a.u-button-style.u-button-style.u-active-custom-color-7:active,\n        a.u-button-style.u-button-style.u-active-custom-color-7[class*=\"u-border-\"]:active,\n        a.u-button-style.u-button-style.u-active-custom-color-7.active,\n        a.u-button-style.u-button-style.u-active-custom-color-7[class*=\"u-border-\"].active,\n        a.u-button-style.u-button-style.active > .u-active-custom-color-7,\n        a.u-button-style.u-button-style.active > .u-active-custom-color-7[class*=\"u-border-\"],\n        li.active > a.u-button-style.u-button-style.u-active-custom-color-7,\n        li.active > a.u-button-style.u-button-style.u-active-custom-color-7[class*=\"u-border-\"],\n        input.u-field-input.u-field-input.u-active-custom-color-7:checked\n        {\n            color: var(--custom-color-7-text-color) !important;\n            background-color: var(--custom-color-7) !important;\n        }\n\n        a.u-link.u-hover-custom-color-7:hover {\n            color: var(--custom-color-7) !important;\n        }\n\n        \n\n        \n        .u-border-custom-color-1,\n        .u-border-custom-color-1.u-input,\n        .u-border-custom-color-1.u-field-input.u-field-input,\n        .u-separator-custom-color-1:after\n        {\n            border-color: var(--custom-color-1);\n            stroke: var(--custom-color-1);\n        }\n\n        .u-button-style.u-border-custom-color-1\n        {\n            border-color: var(--custom-color-1) !important;\n            color: var(--custom-color-1) !important;\n            background-color: transparent !important;\n        }\n\n        .u-button-style.u-border-custom-color-1:hover,\n        .u-button-style.u-border-custom-color-1:focus\n        {\n            border-color: transparent !important;\n            color: var(--custom-color-1-darker) !important;\n            background-color: transparent !important;\n        }\n\n        .u-border-hover-custom-color-1:hover,\n        .u-border-hover-custom-color-1:focus,\n        .u-border-active-custom-color-1.u-active.u-active,\n        a.u-button-style.u-border-hover-custom-color-1:hover,\n        a.u-button-style:hover > .u-border-hover-custom-color-1,\n        a.u-button-style.u-border-hover-custom-color-1:focus,\n        a.u-button-style.u-button-style.u-border-active-custom-color-1:active,\n        a.u-button-style.u-button-style.u-border-active-custom-color-1.active,\n        a.u-button-style.u-button-style.active > .u-border-active-custom-color-1,\n        li.active > a.u-button-style.u-button-style.u-border-active-custom-color-1,\n        input.u-field-input.u-field-input.u-border-active-custom-color-1:checked\n        {\n            color: var(--custom-color-1) !important;\n            border-color: var(--custom-color-1) !important;\n        }\n\n        .u-link.u-border-custom-color-1[class*=\"u-border-\"]\n        {\n            border-color: var(--custom-color-1) !important;\n        }\n\n        .u-link.u-border-custom-color-1[class*=\"u-border-\"]:hover\n        {\n            border-color: var(--custom-color-1-darker) !important;\n        }\n        \n        \n        .u-border-custom-color-2,\n        .u-border-custom-color-2.u-input,\n        .u-border-custom-color-2.u-field-input.u-field-input,\n        .u-separator-custom-color-2:after\n        {\n            border-color: var(--custom-color-2);\n            stroke: var(--custom-color-2);\n        }\n\n        .u-button-style.u-border-custom-color-2\n        {\n            border-color: var(--custom-color-2) !important;\n            color: var(--custom-color-2) !important;\n            background-color: transparent !important;\n        }\n\n        .u-button-style.u-border-custom-color-2:hover,\n        .u-button-style.u-border-custom-color-2:focus\n        {\n            border-color: transparent !important;\n            color: var(--custom-color-2-darker) !important;\n            background-color: transparent !important;\n        }\n\n        .u-border-hover-custom-color-2:hover,\n        .u-border-hover-custom-color-2:focus,\n        .u-border-active-custom-color-2.u-active.u-active,\n        a.u-button-style.u-border-hover-custom-color-2:hover,\n        a.u-button-style:hover > .u-border-hover-custom-color-2,\n        a.u-button-style.u-border-hover-custom-color-2:focus,\n        a.u-button-style.u-button-style.u-border-active-custom-color-2:active,\n        a.u-button-style.u-button-style.u-border-active-custom-color-2.active,\n        a.u-button-style.u-button-style.active > .u-border-active-custom-color-2,\n        li.active > a.u-button-style.u-button-style.u-border-active-custom-color-2,\n        input.u-field-input.u-field-input.u-border-active-custom-color-2:checked\n        {\n            color: var(--custom-color-2) !important;\n            border-color: var(--custom-color-2) !important;\n        }\n\n        .u-link.u-border-custom-color-2[class*=\"u-border-\"]\n        {\n            border-color: var(--custom-color-2) !important;\n        }\n\n        .u-link.u-border-custom-color-2[class*=\"u-border-\"]:hover\n        {\n            border-color: var(--custom-color-2-darker) !important;\n        }\n        \n        \n        .u-border-custom-color-3,\n        .u-border-custom-color-3.u-input,\n        .u-border-custom-color-3.u-field-input.u-field-input,\n        .u-separator-custom-color-3:after\n        {\n            border-color: var(--custom-color-3);\n            stroke: var(--custom-color-3);\n        }\n\n        .u-button-style.u-border-custom-color-3\n        {\n            border-color: var(--custom-color-3) !important;\n            color: var(--custom-color-3) !important;\n            background-color: transparent !important;\n        }\n\n        .u-button-style.u-border-custom-color-3:hover,\n        .u-button-style.u-border-custom-color-3:focus\n        {\n            border-color: transparent !important;\n            color: var(--custom-color-3-darker) !important;\n            background-color: transparent !important;\n        }\n\n        .u-border-hover-custom-color-3:hover,\n        .u-border-hover-custom-color-3:focus,\n        .u-border-active-custom-color-3.u-active.u-active,\n        a.u-button-style.u-border-hover-custom-color-3:hover,\n        a.u-button-style:hover > .u-border-hover-custom-color-3,\n        a.u-button-style.u-border-hover-custom-color-3:focus,\n        a.u-button-style.u-button-style.u-border-active-custom-color-3:active,\n        a.u-button-style.u-button-style.u-border-active-custom-color-3.active,\n        a.u-button-style.u-button-style.active > .u-border-active-custom-color-3,\n        li.active > a.u-button-style.u-button-style.u-border-active-custom-color-3,\n        input.u-field-input.u-field-input.u-border-active-custom-color-3:checked\n        {\n            color: var(--custom-color-3) !important;\n            border-color: var(--custom-color-3) !important;\n        }\n\n        .u-link.u-border-custom-color-3[class*=\"u-border-\"]\n        {\n            border-color: var(--custom-color-3) !important;\n        }\n\n        .u-link.u-border-custom-color-3[class*=\"u-border-\"]:hover\n        {\n            border-color: var(--custom-color-3-darker) !important;\n        }\n        \n        \n        .u-border-custom-color-4,\n        .u-border-custom-color-4.u-input,\n        .u-border-custom-color-4.u-field-input.u-field-input,\n        .u-separator-custom-color-4:after\n        {\n            border-color: var(--custom-color-4);\n            stroke: var(--custom-color-4);\n        }\n\n        .u-button-style.u-border-custom-color-4\n        {\n            border-color: var(--custom-color-4) !important;\n            color: var(--custom-color-4) !important;\n            background-color: transparent !important;\n        }\n\n        .u-button-style.u-border-custom-color-4:hover,\n        .u-button-style.u-border-custom-color-4:focus\n        {\n            border-color: transparent !important;\n            color: var(--custom-color-4-darker) !important;\n            background-color: transparent !important;\n        }\n\n        .u-border-hover-custom-color-4:hover,\n        .u-border-hover-custom-color-4:focus,\n        .u-border-active-custom-color-4.u-active.u-active,\n        a.u-button-style.u-border-hover-custom-color-4:hover,\n        a.u-button-style:hover > .u-border-hover-custom-color-4,\n        a.u-button-style.u-border-hover-custom-color-4:focus,\n        a.u-button-style.u-button-style.u-border-active-custom-color-4:active,\n        a.u-button-style.u-button-style.u-border-active-custom-color-4.active,\n        a.u-button-style.u-button-style.active > .u-border-active-custom-color-4,\n        li.active > a.u-button-style.u-button-style.u-border-active-custom-color-4,\n        input.u-field-input.u-field-input.u-border-active-custom-color-4:checked\n        {\n            color: var(--custom-color-4) !important;\n            border-color: var(--custom-color-4) !important;\n        }\n\n        .u-link.u-border-custom-color-4[class*=\"u-border-\"]\n        {\n            border-color: var(--custom-color-4) !important;\n        }\n\n        .u-link.u-border-custom-color-4[class*=\"u-border-\"]:hover\n        {\n            border-color: var(--custom-color-4-darker) !important;\n        }\n        \n        \n        .u-border-custom-color-5,\n        .u-border-custom-color-5.u-input,\n        .u-border-custom-color-5.u-field-input.u-field-input,\n        .u-separator-custom-color-5:after\n        {\n            border-color: var(--custom-color-5);\n            stroke: var(--custom-color-5);\n        }\n\n        .u-button-style.u-border-custom-color-5\n        {\n            border-color: var(--custom-color-5) !important;\n            color: var(--custom-color-5) !important;\n            background-color: transparent !important;\n        }\n\n        .u-button-style.u-border-custom-color-5:hover,\n        .u-button-style.u-border-custom-color-5:focus\n        {\n            border-color: transparent !important;\n            color: var(--custom-color-5-darker) !important;\n            background-color: transparent !important;\n        }\n\n        .u-border-hover-custom-color-5:hover,\n        .u-border-hover-custom-color-5:focus,\n        .u-border-active-custom-color-5.u-active.u-active,\n        a.u-button-style.u-border-hover-custom-color-5:hover,\n        a.u-button-style:hover > .u-border-hover-custom-color-5,\n        a.u-button-style.u-border-hover-custom-color-5:focus,\n        a.u-button-style.u-button-style.u-border-active-custom-color-5:active,\n        a.u-button-style.u-button-style.u-border-active-custom-color-5.active,\n        a.u-button-style.u-button-style.active > .u-border-active-custom-color-5,\n        li.active > a.u-button-style.u-button-style.u-border-active-custom-color-5,\n        input.u-field-input.u-field-input.u-border-active-custom-color-5:checked\n        {\n            color: var(--custom-color-5) !important;\n            border-color: var(--custom-color-5) !important;\n        }\n\n        .u-link.u-border-custom-color-5[class*=\"u-border-\"]\n        {\n            border-color: var(--custom-color-5) !important;\n        }\n\n        .u-link.u-border-custom-color-5[class*=\"u-border-\"]:hover\n        {\n            border-color: var(--custom-color-5-darker) !important;\n        }\n        \n        \n        .u-border-custom-color-6,\n        .u-border-custom-color-6.u-input,\n        .u-border-custom-color-6.u-field-input.u-field-input,\n        .u-separator-custom-color-6:after\n        {\n            border-color: var(--custom-color-6);\n            stroke: var(--custom-color-6);\n        }\n\n        .u-button-style.u-border-custom-color-6\n        {\n            border-color: var(--custom-color-6) !important;\n            color: var(--custom-color-6) !important;\n            background-color: transparent !important;\n        }\n\n        .u-button-style.u-border-custom-color-6:hover,\n        .u-button-style.u-border-custom-color-6:focus\n        {\n            border-color: transparent !important;\n            color: var(--custom-color-6-darker) !important;\n            background-color: transparent !important;\n        }\n\n        .u-border-hover-custom-color-6:hover,\n        .u-border-hover-custom-color-6:focus,\n        .u-border-active-custom-color-6.u-active.u-active,\n        a.u-button-style.u-border-hover-custom-color-6:hover,\n        a.u-button-style:hover > .u-border-hover-custom-color-6,\n        a.u-button-style.u-border-hover-custom-color-6:focus,\n        a.u-button-style.u-button-style.u-border-active-custom-color-6:active,\n        a.u-button-style.u-button-style.u-border-active-custom-color-6.active,\n        a.u-button-style.u-button-style.active > .u-border-active-custom-color-6,\n        li.active > a.u-button-style.u-button-style.u-border-active-custom-color-6,\n        input.u-field-input.u-field-input.u-border-active-custom-color-6:checked\n        {\n            color: var(--custom-color-6) !important;\n            border-color: var(--custom-color-6) !important;\n        }\n\n        .u-link.u-border-custom-color-6[class*=\"u-border-\"]\n        {\n            border-color: var(--custom-color-6) !important;\n        }\n\n        .u-link.u-border-custom-color-6[class*=\"u-border-\"]:hover\n        {\n            border-color: var(--custom-color-6-darker) !important;\n        }\n        \n        \n        .u-border-custom-color-7,\n        .u-border-custom-color-7.u-input,\n        .u-border-custom-color-7.u-field-input.u-field-input,\n        .u-separator-custom-color-7:after\n        {\n            border-color: var(--custom-color-7);\n            stroke: var(--custom-color-7);\n        }\n\n        .u-button-style.u-border-custom-color-7\n        {\n            border-color: var(--custom-color-7) !important;\n            color: var(--custom-color-7) !important;\n            background-color: transparent !important;\n        }\n\n        .u-button-style.u-border-custom-color-7:hover,\n        .u-button-style.u-border-custom-color-7:focus\n        {\n            border-color: transparent !important;\n            color: var(--custom-color-7-darker) !important;\n            background-color: transparent !important;\n        }\n\n        .u-border-hover-custom-color-7:hover,\n        .u-border-hover-custom-color-7:focus,\n        .u-border-active-custom-color-7.u-active.u-active,\n        a.u-button-style.u-border-hover-custom-color-7:hover,\n        a.u-button-style:hover > .u-border-hover-custom-color-7,\n        a.u-button-style.u-border-hover-custom-color-7:focus,\n        a.u-button-style.u-button-style.u-border-active-custom-color-7:active,\n        a.u-button-style.u-button-style.u-border-active-custom-color-7.active,\n        a.u-button-style.u-button-style.active > .u-border-active-custom-color-7,\n        li.active > a.u-button-style.u-button-style.u-border-active-custom-color-7,\n        input.u-field-input.u-field-input.u-border-active-custom-color-7:checked\n        {\n            color: var(--custom-color-7) !important;\n            border-color: var(--custom-color-7) !important;\n        }\n\n        .u-link.u-border-custom-color-7[class*=\"u-border-\"]\n        {\n            border-color: var(--custom-color-7) !important;\n        }\n\n        .u-link.u-border-custom-color-7[class*=\"u-border-\"]:hover\n        {\n            border-color: var(--custom-color-7-darker) !important;\n        }\n        \n\n        \n        .u-text-custom-color-1,\n        .u-input.u-text-custom-color-1,\n        .u-input.u-text-custom-color-1[class*=\"u-border-\"],\n        li.active > a.u-button-style.u-text-custom-color-1,\n        li.active > a.u-button-style.u-text-custom-color-1[class*=\"u-border-\"],\n        a.u-button-style.u-text-custom-color-1,\n        a.u-button-style.u-text-custom-color-1[class*=\"u-border-\"]\n        {\n            color: var(--custom-color-1) !important;\n        }\n\n        a.u-button-style.u-text-custom-color-1:hover,\n        a.u-button-style.u-text-custom-color-1[class*=\"u-border-\"]:hover,\n        a.u-button-style.u-text-custom-color-1:focus,\n        a.u-button-style.u-text-custom-color-1[class*=\"u-border-\"]:focus,\n        a.u-button-style.u-button-style.u-text-custom-color-1:active,\n        a.u-button-style.u-button-style.u-text-custom-color-1[class*=\"u-border-\"]:active,\n        a.u-button-style.u-button-style.u-text-custom-color-1.active,\n        a.u-button-style.u-button-style.u-text-custom-color-1[class*=\"u-border-\"].active\n        {\n            color: var(--custom-color-1-darker) !important;\n        }\n\n        /* hover */\n        a.u-button-style:hover > .u-text-hover-custom-color-1,\n        a.u-button-style:hover > .u-text-hover-custom-color-1[class*=\"u-border-\"],\n        a.u-button-style.u-button-style.u-text-hover-custom-color-1:hover,\n        a.u-button-style.u-button-style.u-text-hover-custom-color-1[class*=\"u-border-\"]:hover,\n        a.u-button-style.u-button-style.u-button-style.u-text-hover-custom-color-1.active,\n        a.u-button-style.u-button-style.u-button-style.u-text-hover-custom-color-1[class*=\"u-border-\"].active,\n        a.u-button-style.u-button-style.u-button-style.u-text-hover-custom-color-1:active,\n        a.u-button-style.u-button-style.u-button-style.u-text-hover-custom-color-1[class*=\"u-border-\"]:active,\n        a.u-button-style.u-button-style.u-text-hover-custom-color-1:focus,\n        a.u-button-style.u-button-style.u-text-hover-custom-color-1[class*=\"u-border-\"]:focus,\n        /* active */\n        a.u-button-style.u-button-style.u-button-style.u-button-style.u-text-active-custom-color-1:active,\n        a.u-button-style.u-button-style.u-button-style.u-button-style.u-text-active-custom-color-1[class*=\"u-border-\"]:active,\n        a.u-button-style.u-button-style.u-button-style.u-button-style.u-text-active-custom-color-1.active,\n        a.u-button-style.u-button-style.u-button-style.u-button-style.u-text-active-custom-color-1[class*=\"u-border-\"].active,\n        a.u-button-style.u-button-style.active > .u-text-active-custom-color-1,\n        a.u-button-style.u-button-style.active > .u-text-active-custom-color-1[class*=\"u-border-\"],\n        :not(.level-2) > .u-nav > .u-nav-item > a.u-nav-link.u-text-hover-custom-color-1:hover,\n        :not(.level-2) > .u-nav > .u-nav-item > a.u-nav-link.u-nav-link.u-text-active-custom-color-1.active,\n        .u-text-hover-custom-color-1.u-language-url:hover,\n        .u-text-hover-custom-color-1 .u-language-url:hover,\n        .u-text-hover-custom-color-1.u-carousel-control:hover,\n        .u-text-hover-custom-color-1.u-gallery-nav:hover,\n        .u-popupmenu-items.u-text-hover-custom-color-1 .u-nav-link:hover,\n        .u-popupmenu-items.u-popupmenu-items.u-text-active-custom-color-1 .u-nav-link.active\n        {\n            color: var(--custom-color-1) !important;\n        }\n\n        .u-text-custom-color-1 .u-svg-link,\n        .u-text-hover-custom-color-1:hover .u-svg-link,\n        .u-text-hover-custom-color-1:focus .u-svg-link,\n        .u-text-active-custom-color-1:active .u-svg-link.u-svg-link,\n        .u-button-style:hover > .u-text-hover-custom-color-1 .u-svg-link,\n        .u-button-style.u-button-style:active > .u-text-active-custom-color-1 .u-svg-link,\n        .u-button-style.u-button-style.active > .u-text-active-custom-color-1 .u-svg-link\n        {\n            fill: var(--custom-color-1);\n        }\n\n        .u-link.u-text-custom-color-1:hover\n        {\n            color: var(--custom-color-1-darker) !important;\n        }\n\n        a.u-link.u-text-hover-custom-color-1:hover\n        {\n            color: var(--custom-color-1) !important;\n        }\n        \n        \n        .u-text-custom-color-2,\n        .u-input.u-text-custom-color-2,\n        .u-input.u-text-custom-color-2[class*=\"u-border-\"],\n        li.active > a.u-button-style.u-text-custom-color-2,\n        li.active > a.u-button-style.u-text-custom-color-2[class*=\"u-border-\"],\n        a.u-button-style.u-text-custom-color-2,\n        a.u-button-style.u-text-custom-color-2[class*=\"u-border-\"]\n        {\n            color: var(--custom-color-2) !important;\n        }\n\n        a.u-button-style.u-text-custom-color-2:hover,\n        a.u-button-style.u-text-custom-color-2[class*=\"u-border-\"]:hover,\n        a.u-button-style.u-text-custom-color-2:focus,\n        a.u-button-style.u-text-custom-color-2[class*=\"u-border-\"]:focus,\n        a.u-button-style.u-button-style.u-text-custom-color-2:active,\n        a.u-button-style.u-button-style.u-text-custom-color-2[class*=\"u-border-\"]:active,\n        a.u-button-style.u-button-style.u-text-custom-color-2.active,\n        a.u-button-style.u-button-style.u-text-custom-color-2[class*=\"u-border-\"].active\n        {\n            color: var(--custom-color-2-darker) !important;\n        }\n\n        /* hover */\n        a.u-button-style:hover > .u-text-hover-custom-color-2,\n        a.u-button-style:hover > .u-text-hover-custom-color-2[class*=\"u-border-\"],\n        a.u-button-style.u-button-style.u-text-hover-custom-color-2:hover,\n        a.u-button-style.u-button-style.u-text-hover-custom-color-2[class*=\"u-border-\"]:hover,\n        a.u-button-style.u-button-style.u-button-style.u-text-hover-custom-color-2.active,\n        a.u-button-style.u-button-style.u-button-style.u-text-hover-custom-color-2[class*=\"u-border-\"].active,\n        a.u-button-style.u-button-style.u-button-style.u-text-hover-custom-color-2:active,\n        a.u-button-style.u-button-style.u-button-style.u-text-hover-custom-color-2[class*=\"u-border-\"]:active,\n        a.u-button-style.u-button-style.u-text-hover-custom-color-2:focus,\n        a.u-button-style.u-button-style.u-text-hover-custom-color-2[class*=\"u-border-\"]:focus,\n        /* active */\n        a.u-button-style.u-button-style.u-button-style.u-button-style.u-text-active-custom-color-2:active,\n        a.u-button-style.u-button-style.u-button-style.u-button-style.u-text-active-custom-color-2[class*=\"u-border-\"]:active,\n        a.u-button-style.u-button-style.u-button-style.u-button-style.u-text-active-custom-color-2.active,\n        a.u-button-style.u-button-style.u-button-style.u-button-style.u-text-active-custom-color-2[class*=\"u-border-\"].active,\n        a.u-button-style.u-button-style.active > .u-text-active-custom-color-2,\n        a.u-button-style.u-button-style.active > .u-text-active-custom-color-2[class*=\"u-border-\"],\n        :not(.level-2) > .u-nav > .u-nav-item > a.u-nav-link.u-text-hover-custom-color-2:hover,\n        :not(.level-2) > .u-nav > .u-nav-item > a.u-nav-link.u-nav-link.u-text-active-custom-color-2.active,\n        .u-text-hover-custom-color-2.u-language-url:hover,\n        .u-text-hover-custom-color-2 .u-language-url:hover,\n        .u-text-hover-custom-color-2.u-carousel-control:hover,\n        .u-text-hover-custom-color-2.u-gallery-nav:hover,\n        .u-popupmenu-items.u-text-hover-custom-color-2 .u-nav-link:hover,\n        .u-popupmenu-items.u-popupmenu-items.u-text-active-custom-color-2 .u-nav-link.active\n        {\n            color: var(--custom-color-2) !important;\n        }\n\n        .u-text-custom-color-2 .u-svg-link,\n        .u-text-hover-custom-color-2:hover .u-svg-link,\n        .u-text-hover-custom-color-2:focus .u-svg-link,\n        .u-text-active-custom-color-2:active .u-svg-link.u-svg-link,\n        .u-button-style:hover > .u-text-hover-custom-color-2 .u-svg-link,\n        .u-button-style.u-button-style:active > .u-text-active-custom-color-2 .u-svg-link,\n        .u-button-style.u-button-style.active > .u-text-active-custom-color-2 .u-svg-link\n        {\n            fill: var(--custom-color-2);\n        }\n\n        .u-link.u-text-custom-color-2:hover\n        {\n            color: var(--custom-color-2-darker) !important;\n        }\n\n        a.u-link.u-text-hover-custom-color-2:hover\n        {\n            color: var(--custom-color-2) !important;\n        }\n        \n        \n        .u-text-custom-color-3,\n        .u-input.u-text-custom-color-3,\n        .u-input.u-text-custom-color-3[class*=\"u-border-\"],\n        li.active > a.u-button-style.u-text-custom-color-3,\n        li.active > a.u-button-style.u-text-custom-color-3[class*=\"u-border-\"],\n        a.u-button-style.u-text-custom-color-3,\n        a.u-button-style.u-text-custom-color-3[class*=\"u-border-\"]\n        {\n            color: var(--custom-color-3) !important;\n        }\n\n        a.u-button-style.u-text-custom-color-3:hover,\n        a.u-button-style.u-text-custom-color-3[class*=\"u-border-\"]:hover,\n        a.u-button-style.u-text-custom-color-3:focus,\n        a.u-button-style.u-text-custom-color-3[class*=\"u-border-\"]:focus,\n        a.u-button-style.u-button-style.u-text-custom-color-3:active,\n        a.u-button-style.u-button-style.u-text-custom-color-3[class*=\"u-border-\"]:active,\n        a.u-button-style.u-button-style.u-text-custom-color-3.active,\n        a.u-button-style.u-button-style.u-text-custom-color-3[class*=\"u-border-\"].active\n        {\n            color: var(--custom-color-3-darker) !important;\n        }\n\n        /* hover */\n        a.u-button-style:hover > .u-text-hover-custom-color-3,\n        a.u-button-style:hover > .u-text-hover-custom-color-3[class*=\"u-border-\"],\n        a.u-button-style.u-button-style.u-text-hover-custom-color-3:hover,\n        a.u-button-style.u-button-style.u-text-hover-custom-color-3[class*=\"u-border-\"]:hover,\n        a.u-button-style.u-button-style.u-button-style.u-text-hover-custom-color-3.active,\n        a.u-button-style.u-button-style.u-button-style.u-text-hover-custom-color-3[class*=\"u-border-\"].active,\n        a.u-button-style.u-button-style.u-button-style.u-text-hover-custom-color-3:active,\n        a.u-button-style.u-button-style.u-button-style.u-text-hover-custom-color-3[class*=\"u-border-\"]:active,\n        a.u-button-style.u-button-style.u-text-hover-custom-color-3:focus,\n        a.u-button-style.u-button-style.u-text-hover-custom-color-3[class*=\"u-border-\"]:focus,\n        /* active */\n        a.u-button-style.u-button-style.u-button-style.u-button-style.u-text-active-custom-color-3:active,\n        a.u-button-style.u-button-style.u-button-style.u-button-style.u-text-active-custom-color-3[class*=\"u-border-\"]:active,\n        a.u-button-style.u-button-style.u-button-style.u-button-style.u-text-active-custom-color-3.active,\n        a.u-button-style.u-button-style.u-button-style.u-button-style.u-text-active-custom-color-3[class*=\"u-border-\"].active,\n        a.u-button-style.u-button-style.active > .u-text-active-custom-color-3,\n        a.u-button-style.u-button-style.active > .u-text-active-custom-color-3[class*=\"u-border-\"],\n        :not(.level-2) > .u-nav > .u-nav-item > a.u-nav-link.u-text-hover-custom-color-3:hover,\n        :not(.level-2) > .u-nav > .u-nav-item > a.u-nav-link.u-nav-link.u-text-active-custom-color-3.active,\n        .u-text-hover-custom-color-3.u-language-url:hover,\n        .u-text-hover-custom-color-3 .u-language-url:hover,\n        .u-text-hover-custom-color-3.u-carousel-control:hover,\n        .u-text-hover-custom-color-3.u-gallery-nav:hover,\n        .u-popupmenu-items.u-text-hover-custom-color-3 .u-nav-link:hover,\n        .u-popupmenu-items.u-popupmenu-items.u-text-active-custom-color-3 .u-nav-link.active\n        {\n            color: var(--custom-color-3) !important;\n        }\n\n        .u-text-custom-color-3 .u-svg-link,\n        .u-text-hover-custom-color-3:hover .u-svg-link,\n        .u-text-hover-custom-color-3:focus .u-svg-link,\n        .u-text-active-custom-color-3:active .u-svg-link.u-svg-link,\n        .u-button-style:hover > .u-text-hover-custom-color-3 .u-svg-link,\n        .u-button-style.u-button-style:active > .u-text-active-custom-color-3 .u-svg-link,\n        .u-button-style.u-button-style.active > .u-text-active-custom-color-3 .u-svg-link\n        {\n            fill: var(--custom-color-3);\n        }\n\n        .u-link.u-text-custom-color-3:hover\n        {\n            color: var(--custom-color-3-darker) !important;\n        }\n\n        a.u-link.u-text-hover-custom-color-3:hover\n        {\n            color: var(--custom-color-3) !important;\n        }\n        \n        \n        .u-text-custom-color-4,\n        .u-input.u-text-custom-color-4,\n        .u-input.u-text-custom-color-4[class*=\"u-border-\"],\n        li.active > a.u-button-style.u-text-custom-color-4,\n        li.active > a.u-button-style.u-text-custom-color-4[class*=\"u-border-\"],\n        a.u-button-style.u-text-custom-color-4,\n        a.u-button-style.u-text-custom-color-4[class*=\"u-border-\"]\n        {\n            color: var(--custom-color-4) !important;\n        }\n\n        a.u-button-style.u-text-custom-color-4:hover,\n        a.u-button-style.u-text-custom-color-4[class*=\"u-border-\"]:hover,\n        a.u-button-style.u-text-custom-color-4:focus,\n        a.u-button-style.u-text-custom-color-4[class*=\"u-border-\"]:focus,\n        a.u-button-style.u-button-style.u-text-custom-color-4:active,\n        a.u-button-style.u-button-style.u-text-custom-color-4[class*=\"u-border-\"]:active,\n        a.u-button-style.u-button-style.u-text-custom-color-4.active,\n        a.u-button-style.u-button-style.u-text-custom-color-4[class*=\"u-border-\"].active\n        {\n            color: var(--custom-color-4-darker) !important;\n        }\n\n        /* hover */\n        a.u-button-style:hover > .u-text-hover-custom-color-4,\n        a.u-button-style:hover > .u-text-hover-custom-color-4[class*=\"u-border-\"],\n        a.u-button-style.u-button-style.u-text-hover-custom-color-4:hover,\n        a.u-button-style.u-button-style.u-text-hover-custom-color-4[class*=\"u-border-\"]:hover,\n        a.u-button-style.u-button-style.u-button-style.u-text-hover-custom-color-4.active,\n        a.u-button-style.u-button-style.u-button-style.u-text-hover-custom-color-4[class*=\"u-border-\"].active,\n        a.u-button-style.u-button-style.u-button-style.u-text-hover-custom-color-4:active,\n        a.u-button-style.u-button-style.u-button-style.u-text-hover-custom-color-4[class*=\"u-border-\"]:active,\n        a.u-button-style.u-button-style.u-text-hover-custom-color-4:focus,\n        a.u-button-style.u-button-style.u-text-hover-custom-color-4[class*=\"u-border-\"]:focus,\n        /* active */\n        a.u-button-style.u-button-style.u-button-style.u-button-style.u-text-active-custom-color-4:active,\n        a.u-button-style.u-button-style.u-button-style.u-button-style.u-text-active-custom-color-4[class*=\"u-border-\"]:active,\n        a.u-button-style.u-button-style.u-button-style.u-button-style.u-text-active-custom-color-4.active,\n        a.u-button-style.u-button-style.u-button-style.u-button-style.u-text-active-custom-color-4[class*=\"u-border-\"].active,\n        a.u-button-style.u-button-style.active > .u-text-active-custom-color-4,\n        a.u-button-style.u-button-style.active > .u-text-active-custom-color-4[class*=\"u-border-\"],\n        :not(.level-2) > .u-nav > .u-nav-item > a.u-nav-link.u-text-hover-custom-color-4:hover,\n        :not(.level-2) > .u-nav > .u-nav-item > a.u-nav-link.u-nav-link.u-text-active-custom-color-4.active,\n        .u-text-hover-custom-color-4.u-language-url:hover,\n        .u-text-hover-custom-color-4 .u-language-url:hover,\n        .u-text-hover-custom-color-4.u-carousel-control:hover,\n        .u-text-hover-custom-color-4.u-gallery-nav:hover,\n        .u-popupmenu-items.u-text-hover-custom-color-4 .u-nav-link:hover,\n        .u-popupmenu-items.u-popupmenu-items.u-text-active-custom-color-4 .u-nav-link.active\n        {\n            color: var(--custom-color-4) !important;\n        }\n\n        .u-text-custom-color-4 .u-svg-link,\n        .u-text-hover-custom-color-4:hover .u-svg-link,\n        .u-text-hover-custom-color-4:focus .u-svg-link,\n        .u-text-active-custom-color-4:active .u-svg-link.u-svg-link,\n        .u-button-style:hover > .u-text-hover-custom-color-4 .u-svg-link,\n        .u-button-style.u-button-style:active > .u-text-active-custom-color-4 .u-svg-link,\n        .u-button-style.u-button-style.active > .u-text-active-custom-color-4 .u-svg-link\n        {\n            fill: var(--custom-color-4);\n        }\n\n        .u-link.u-text-custom-color-4:hover\n        {\n            color: var(--custom-color-4-darker) !important;\n        }\n\n        a.u-link.u-text-hover-custom-color-4:hover\n        {\n            color: var(--custom-color-4) !important;\n        }\n        \n        \n        .u-text-custom-color-5,\n        .u-input.u-text-custom-color-5,\n        .u-input.u-text-custom-color-5[class*=\"u-border-\"],\n        li.active > a.u-button-style.u-text-custom-color-5,\n        li.active > a.u-button-style.u-text-custom-color-5[class*=\"u-border-\"],\n        a.u-button-style.u-text-custom-color-5,\n        a.u-button-style.u-text-custom-color-5[class*=\"u-border-\"]\n        {\n            color: var(--custom-color-5) !important;\n        }\n\n        a.u-button-style.u-text-custom-color-5:hover,\n        a.u-button-style.u-text-custom-color-5[class*=\"u-border-\"]:hover,\n        a.u-button-style.u-text-custom-color-5:focus,\n        a.u-button-style.u-text-custom-color-5[class*=\"u-border-\"]:focus,\n        a.u-button-style.u-button-style.u-text-custom-color-5:active,\n        a.u-button-style.u-button-style.u-text-custom-color-5[class*=\"u-border-\"]:active,\n        a.u-button-style.u-button-style.u-text-custom-color-5.active,\n        a.u-button-style.u-button-style.u-text-custom-color-5[class*=\"u-border-\"].active\n        {\n            color: var(--custom-color-5-darker) !important;\n        }\n\n        /* hover */\n        a.u-button-style:hover > .u-text-hover-custom-color-5,\n        a.u-button-style:hover > .u-text-hover-custom-color-5[class*=\"u-border-\"],\n        a.u-button-style.u-button-style.u-text-hover-custom-color-5:hover,\n        a.u-button-style.u-button-style.u-text-hover-custom-color-5[class*=\"u-border-\"]:hover,\n        a.u-button-style.u-button-style.u-button-style.u-text-hover-custom-color-5.active,\n        a.u-button-style.u-button-style.u-button-style.u-text-hover-custom-color-5[class*=\"u-border-\"].active,\n        a.u-button-style.u-button-style.u-button-style.u-text-hover-custom-color-5:active,\n        a.u-button-style.u-button-style.u-button-style.u-text-hover-custom-color-5[class*=\"u-border-\"]:active,\n        a.u-button-style.u-button-style.u-text-hover-custom-color-5:focus,\n        a.u-button-style.u-button-style.u-text-hover-custom-color-5[class*=\"u-border-\"]:focus,\n        /* active */\n        a.u-button-style.u-button-style.u-button-style.u-button-style.u-text-active-custom-color-5:active,\n        a.u-button-style.u-button-style.u-button-style.u-button-style.u-text-active-custom-color-5[class*=\"u-border-\"]:active,\n        a.u-button-style.u-button-style.u-button-style.u-button-style.u-text-active-custom-color-5.active,\n        a.u-button-style.u-button-style.u-button-style.u-button-style.u-text-active-custom-color-5[class*=\"u-border-\"].active,\n        a.u-button-style.u-button-style.active > .u-text-active-custom-color-5,\n        a.u-button-style.u-button-style.active > .u-text-active-custom-color-5[class*=\"u-border-\"],\n        :not(.level-2) > .u-nav > .u-nav-item > a.u-nav-link.u-text-hover-custom-color-5:hover,\n        :not(.level-2) > .u-nav > .u-nav-item > a.u-nav-link.u-nav-link.u-text-active-custom-color-5.active,\n        .u-text-hover-custom-color-5.u-language-url:hover,\n        .u-text-hover-custom-color-5 .u-language-url:hover,\n        .u-text-hover-custom-color-5.u-carousel-control:hover,\n        .u-text-hover-custom-color-5.u-gallery-nav:hover,\n        .u-popupmenu-items.u-text-hover-custom-color-5 .u-nav-link:hover,\n        .u-popupmenu-items.u-popupmenu-items.u-text-active-custom-color-5 .u-nav-link.active\n        {\n            color: var(--custom-color-5) !important;\n        }\n\n        .u-text-custom-color-5 .u-svg-link,\n        .u-text-hover-custom-color-5:hover .u-svg-link,\n        .u-text-hover-custom-color-5:focus .u-svg-link,\n        .u-text-active-custom-color-5:active .u-svg-link.u-svg-link,\n        .u-button-style:hover > .u-text-hover-custom-color-5 .u-svg-link,\n        .u-button-style.u-button-style:active > .u-text-active-custom-color-5 .u-svg-link,\n        .u-button-style.u-button-style.active > .u-text-active-custom-color-5 .u-svg-link\n        {\n            fill: var(--custom-color-5);\n        }\n\n        .u-link.u-text-custom-color-5:hover\n        {\n            color: var(--custom-color-5-darker) !important;\n        }\n\n        a.u-link.u-text-hover-custom-color-5:hover\n        {\n            color: var(--custom-color-5) !important;\n        }\n        \n        \n        .u-text-custom-color-6,\n        .u-input.u-text-custom-color-6,\n        .u-input.u-text-custom-color-6[class*=\"u-border-\"],\n        li.active > a.u-button-style.u-text-custom-color-6,\n        li.active > a.u-button-style.u-text-custom-color-6[class*=\"u-border-\"],\n        a.u-button-style.u-text-custom-color-6,\n        a.u-button-style.u-text-custom-color-6[class*=\"u-border-\"]\n        {\n            color: var(--custom-color-6) !important;\n        }\n\n        a.u-button-style.u-text-custom-color-6:hover,\n        a.u-button-style.u-text-custom-color-6[class*=\"u-border-\"]:hover,\n        a.u-button-style.u-text-custom-color-6:focus,\n        a.u-button-style.u-text-custom-color-6[class*=\"u-border-\"]:focus,\n        a.u-button-style.u-button-style.u-text-custom-color-6:active,\n        a.u-button-style.u-button-style.u-text-custom-color-6[class*=\"u-border-\"]:active,\n        a.u-button-style.u-button-style.u-text-custom-color-6.active,\n        a.u-button-style.u-button-style.u-text-custom-color-6[class*=\"u-border-\"].active\n        {\n            color: var(--custom-color-6-darker) !important;\n        }\n\n        /* hover */\n        a.u-button-style:hover > .u-text-hover-custom-color-6,\n        a.u-button-style:hover > .u-text-hover-custom-color-6[class*=\"u-border-\"],\n        a.u-button-style.u-button-style.u-text-hover-custom-color-6:hover,\n        a.u-button-style.u-button-style.u-text-hover-custom-color-6[class*=\"u-border-\"]:hover,\n        a.u-button-style.u-button-style.u-button-style.u-text-hover-custom-color-6.active,\n        a.u-button-style.u-button-style.u-button-style.u-text-hover-custom-color-6[class*=\"u-border-\"].active,\n        a.u-button-style.u-button-style.u-button-style.u-text-hover-custom-color-6:active,\n        a.u-button-style.u-button-style.u-button-style.u-text-hover-custom-color-6[class*=\"u-border-\"]:active,\n        a.u-button-style.u-button-style.u-text-hover-custom-color-6:focus,\n        a.u-button-style.u-button-style.u-text-hover-custom-color-6[class*=\"u-border-\"]:focus,\n        /* active */\n        a.u-button-style.u-button-style.u-button-style.u-button-style.u-text-active-custom-color-6:active,\n        a.u-button-style.u-button-style.u-button-style.u-button-style.u-text-active-custom-color-6[class*=\"u-border-\"]:active,\n        a.u-button-style.u-button-style.u-button-style.u-button-style.u-text-active-custom-color-6.active,\n        a.u-button-style.u-button-style.u-button-style.u-button-style.u-text-active-custom-color-6[class*=\"u-border-\"].active,\n        a.u-button-style.u-button-style.active > .u-text-active-custom-color-6,\n        a.u-button-style.u-button-style.active > .u-text-active-custom-color-6[class*=\"u-border-\"],\n        :not(.level-2) > .u-nav > .u-nav-item > a.u-nav-link.u-text-hover-custom-color-6:hover,\n        :not(.level-2) > .u-nav > .u-nav-item > a.u-nav-link.u-nav-link.u-text-active-custom-color-6.active,\n        .u-text-hover-custom-color-6.u-language-url:hover,\n        .u-text-hover-custom-color-6 .u-language-url:hover,\n        .u-text-hover-custom-color-6.u-carousel-control:hover,\n        .u-text-hover-custom-color-6.u-gallery-nav:hover,\n        .u-popupmenu-items.u-text-hover-custom-color-6 .u-nav-link:hover,\n        .u-popupmenu-items.u-popupmenu-items.u-text-active-custom-color-6 .u-nav-link.active\n        {\n            color: var(--custom-color-6) !important;\n        }\n\n        .u-text-custom-color-6 .u-svg-link,\n        .u-text-hover-custom-color-6:hover .u-svg-link,\n        .u-text-hover-custom-color-6:focus .u-svg-link,\n        .u-text-active-custom-color-6:active .u-svg-link.u-svg-link,\n        .u-button-style:hover > .u-text-hover-custom-color-6 .u-svg-link,\n        .u-button-style.u-button-style:active > .u-text-active-custom-color-6 .u-svg-link,\n        .u-button-style.u-button-style.active > .u-text-active-custom-color-6 .u-svg-link\n        {\n            fill: var(--custom-color-6);\n        }\n\n        .u-link.u-text-custom-color-6:hover\n        {\n            color: var(--custom-color-6-darker) !important;\n        }\n\n        a.u-link.u-text-hover-custom-color-6:hover\n        {\n            color: var(--custom-color-6) !important;\n        }\n        \n        \n        .u-text-custom-color-7,\n        .u-input.u-text-custom-color-7,\n        .u-input.u-text-custom-color-7[class*=\"u-border-\"],\n        li.active > a.u-button-style.u-text-custom-color-7,\n        li.active > a.u-button-style.u-text-custom-color-7[class*=\"u-border-\"],\n        a.u-button-style.u-text-custom-color-7,\n        a.u-button-style.u-text-custom-color-7[class*=\"u-border-\"]\n        {\n            color: var(--custom-color-7) !important;\n        }\n\n        a.u-button-style.u-text-custom-color-7:hover,\n        a.u-button-style.u-text-custom-color-7[class*=\"u-border-\"]:hover,\n        a.u-button-style.u-text-custom-color-7:focus,\n        a.u-button-style.u-text-custom-color-7[class*=\"u-border-\"]:focus,\n        a.u-button-style.u-button-style.u-text-custom-color-7:active,\n        a.u-button-style.u-button-style.u-text-custom-color-7[class*=\"u-border-\"]:active,\n        a.u-button-style.u-button-style.u-text-custom-color-7.active,\n        a.u-button-style.u-button-style.u-text-custom-color-7[class*=\"u-border-\"].active\n        {\n            color: var(--custom-color-7-darker) !important;\n        }\n\n        /* hover */\n        a.u-button-style:hover > .u-text-hover-custom-color-7,\n        a.u-button-style:hover > .u-text-hover-custom-color-7[class*=\"u-border-\"],\n        a.u-button-style.u-button-style.u-text-hover-custom-color-7:hover,\n        a.u-button-style.u-button-style.u-text-hover-custom-color-7[class*=\"u-border-\"]:hover,\n        a.u-button-style.u-button-style.u-button-style.u-text-hover-custom-color-7.active,\n        a.u-button-style.u-button-style.u-button-style.u-text-hover-custom-color-7[class*=\"u-border-\"].active,\n        a.u-button-style.u-button-style.u-button-style.u-text-hover-custom-color-7:active,\n        a.u-button-style.u-button-style.u-button-style.u-text-hover-custom-color-7[class*=\"u-border-\"]:active,\n        a.u-button-style.u-button-style.u-text-hover-custom-color-7:focus,\n        a.u-button-style.u-button-style.u-text-hover-custom-color-7[class*=\"u-border-\"]:focus,\n        /* active */\n        a.u-button-style.u-button-style.u-button-style.u-button-style.u-text-active-custom-color-7:active,\n        a.u-button-style.u-button-style.u-button-style.u-button-style.u-text-active-custom-color-7[class*=\"u-border-\"]:active,\n        a.u-button-style.u-button-style.u-button-style.u-button-style.u-text-active-custom-color-7.active,\n        a.u-button-style.u-button-style.u-button-style.u-button-style.u-text-active-custom-color-7[class*=\"u-border-\"].active,\n        a.u-button-style.u-button-style.active > .u-text-active-custom-color-7,\n        a.u-button-style.u-button-style.active > .u-text-active-custom-color-7[class*=\"u-border-\"],\n        :not(.level-2) > .u-nav > .u-nav-item > a.u-nav-link.u-text-hover-custom-color-7:hover,\n        :not(.level-2) > .u-nav > .u-nav-item > a.u-nav-link.u-nav-link.u-text-active-custom-color-7.active,\n        .u-text-hover-custom-color-7.u-language-url:hover,\n        .u-text-hover-custom-color-7 .u-language-url:hover,\n        .u-text-hover-custom-color-7.u-carousel-control:hover,\n        .u-text-hover-custom-color-7.u-gallery-nav:hover,\n        .u-popupmenu-items.u-text-hover-custom-color-7 .u-nav-link:hover,\n        .u-popupmenu-items.u-popupmenu-items.u-text-active-custom-color-7 .u-nav-link.active\n        {\n            color: var(--custom-color-7) !important;\n        }\n\n        .u-text-custom-color-7 .u-svg-link,\n        .u-text-hover-custom-color-7:hover .u-svg-link,\n        .u-text-hover-custom-color-7:focus .u-svg-link,\n        .u-text-active-custom-color-7:active .u-svg-link.u-svg-link,\n        .u-button-style:hover > .u-text-hover-custom-color-7 .u-svg-link,\n        .u-button-style.u-button-style:active > .u-text-active-custom-color-7 .u-svg-link,\n        .u-button-style.u-button-style.active > .u-text-active-custom-color-7 .u-svg-link\n        {\n            fill: var(--custom-color-7);\n        }\n\n        .u-link.u-text-custom-color-7:hover\n        {\n            color: var(--custom-color-7-darker) !important;\n        }\n\n        a.u-link.u-text-hover-custom-color-7:hover\n        {\n            color: var(--custom-color-7) !important;\n        }</style><style id=\"typography\" typography=\"custom-page-typography-3\">\n        .u-body\n        {\n        --title-font-size: 4.5rem;\n        --title-line-height: 1.1;\n        --title-margin-top: 20px;\n        --title-margin-bottom: 20px;\n        --title-font-weight: 800;\n        --subtitle-font-weight: 400;\n        --subtitle-font-size: 2.25rem;\n        --subtitle-line-height: 1.1;\n        --subtitle-margin-top: 20px;\n        --subtitle-margin-bottom: 20px;\n        --h1-font-size: 3rem;\n        --h1-line-height: 1.1;\n        --h1-margin-top: 20px;\n        --h1-margin-bottom: 20px;\n        --h1-font-weight: 800;\n        --h2-font-size: 3rem;\n        --h2-line-height: 1.1;\n        --h2-margin-top: 20px;\n        --h2-margin-bottom: 20px;\n        --h2-font-weight: 800;\n        --h2-list-icon-spacing: 0.3;\n        --h2-list-icon-size: 0.8;\n        --h2-font-family: var(--heading-font);\n        --h3-font-size: 1.875rem;\n        --h3-line-height: 1.2;\n        --h3-margin-top: 20px;\n        --h3-margin-bottom: 20px;\n        --h3-font-weight: 800;\n        --h4-font-weight: 400;\n        --h4-font-size: 1.5rem;\n        --h4-line-height: 1.2;\n        --h4-margin-top: 20px;\n        --h4-margin-bottom: 20px;\n        --h5-font-weight: 400;\n        --h5-font-size: 1.25rem;\n        --h5-line-height: 1.2;\n        --h5-margin-top: 20px;\n        --h5-margin-bottom: 20px;\n        --h6-font-weight: 400;\n        --h6-font-size: 1.125rem;\n        --h6-line-height: 1.2;\n        --h6-margin-top: 20px;\n        --h6-margin-bottom: 20px;\n        --largeText-font-size: 1.25rem;\n        --largeText-margin-top: 20px;\n        --largeText-margin-bottom: 20px;\n        --smallText-font-size: 0.875rem;\n        --smallText-margin-top: 20px;\n        --smallText-margin-bottom: 20px;\n        --text-margin-top: 20px;\n        --text-margin-bottom: 20px;\n        --text-line-height: 1.6;\n        --text-list-icon-spacing: 0.3;\n        --text-list-icon-size: 0.8;\n        --text-font-weight: 400;\n        --hyperlink-color: var(--palette-1-base);\n        --hyperlink-alt-text-color: var(--palette-1-light-2);\n        --hyperlink-hover-color: var(--palette-1-base-darker);\n        --hyperlink-hover-alt-text-color: var(--grey-30-darker);\n        --button-margin-top: 20px;\n        --button-margin-bottom: 20px;\n        --button-text-transform: uppercase;\n        --button-background-color: var(--palette-2-base);\n        --button-color: var(--white);\n        --button-alt-background-color: var(--palette-2-light-3);\n        --button-alt-color: var(--black);\n        --button-hover-background-color: var(--palette-2-base-darker);\n        --button-hover-color: var(--white-darker);\n        --button-hover-alt-background-color: var(--palette-2-light-3-darker);\n        --button-hover-alt-color: var(--white);\n        --button-hover-background-color: var(--palette-2-base-darker);\n        --button-hover-color: var(--white-darker);\n        --button-hover-alt-background-color: var(--palette-2-light-3-darker);\n        --button-hover-alt-color: var(--white);\n        --button-active-background-color: var(--palette-2-base-darker);\n        --button-active-color: var(--white-darker);\n        --button-active-alt-background-color: var(--palette-2-light-3-darker);\n        --button-active-alt-color: var(--white);\n        --blockquote-font-style: italic;\n        --blockquote-padding-left: 20px;\n        --blockquote-border-width: 4px;\n        --blockquote-border-color: var(--palette-1-base);\n        --blockquote-margin-top: 20px;\n        --blockquote-margin-bottom: 20px;\n        --metadata-margin-top: 20px;\n        --metadata-margin-bottom: 20px;\n        --list-margin-top: 20px;\n        --list-margin-bottom: 20px;\n        --orderedlist-margin-top: 20px;\n        --orderedlist-margin-bottom: 20px;\n        --postContent-margin-top: 20px;\n        --postContent-margin-bottom: 20px;\n        --theme-sheet-width-xl: 1140px;\n        --theme-sheet-width-lg: 940px;\n        --theme-sheet-width-md: 720px;\n        --theme-sheet-width-sm: 540px;\n        --theme-sheet-width-xs: 340px;\n        --form-input-border-width: 1px;\n        --form-input-border-color: var(--grey-30);\n        --form-input-borders: top right bottom left;\n        --form-input-background-color: var(--white);\n        --form-input-color: var(--black);\n        --title-font-size-sm: 3.75rem;\n        --title-font-size-xs: 3rem;\n        --subtitle-font-size-xs: 1.5rem;\n        --h1-font-size-xs: 2.25rem;\n        --h2-font-size-xs: 1.5rem;\n        --h3-font-size-xs: 1.5rem;\n        }\n\n        /** common-rules **/\n        h1.u-title\n        {\n        font-size: var(--title-font-size);\n        line-height: var(--title-line-height);\n        margin-top: var(--title-margin-top);\n        margin-bottom: var(--title-margin-bottom);\n        font-weight: var(--title-font-weight);\n        }\n        h2.u-subtitle\n        {\n        font-weight: var(--subtitle-font-weight);\n        font-size: var(--subtitle-font-size);\n        line-height: var(--subtitle-line-height);\n        margin-top: var(--subtitle-margin-top);\n        margin-bottom: var(--subtitle-margin-bottom);\n        }\n        h1:not(.u-title)\n        {\n        font-size: var(--h1-font-size);\n        line-height: var(--h1-line-height);\n        margin-top: var(--h1-margin-top);\n        margin-bottom: var(--h1-margin-bottom);\n        font-weight: var(--h1-font-weight);\n        }\n        h2:not(.u-subtitle)\n        {\n        font-size: var(--h2-font-size);\n        line-height: var(--h2-line-height);\n        margin-top: var(--h2-margin-top);\n        margin-bottom: var(--h2-margin-bottom);\n        font-weight: var(--h2-font-weight);\n        list-icon-spacing: var(--h2-list-icon-spacing);\n        list-icon-size: var(--h2-list-icon-size);\n        font-family: var(--h2-font-family);\n        }\n        h3\n        {\n        font-size: var(--h3-font-size);\n        line-height: var(--h3-line-height);\n        margin-top: var(--h3-margin-top);\n        margin-bottom: var(--h3-margin-bottom);\n        font-weight: var(--h3-font-weight);\n        }\n        h4\n        {\n        font-weight: var(--h4-font-weight);\n        font-size: var(--h4-font-size);\n        line-height: var(--h4-line-height);\n        margin-top: var(--h4-margin-top);\n        margin-bottom: var(--h4-margin-bottom);\n        }\n        h5\n        {\n        font-weight: var(--h5-font-weight);\n        font-size: var(--h5-font-size);\n        line-height: var(--h5-line-height);\n        margin-top: var(--h5-margin-top);\n        margin-bottom: var(--h5-margin-bottom);\n        }\n        h6\n        {\n        font-weight: var(--h6-font-weight);\n        font-size: var(--h6-font-size);\n        line-height: var(--h6-line-height);\n        margin-top: var(--h6-margin-top);\n        margin-bottom: var(--h6-margin-bottom);\n        }\n        p.u-large-text\n        {\n        font-size: var(--largeText-font-size);\n        margin-top: var(--largeText-margin-top);\n        margin-bottom: var(--largeText-margin-bottom);\n        }\n        p.u-small-text\n        {\n        font-size: var(--smallText-font-size);\n        margin-top: var(--smallText-margin-top);\n        margin-bottom: var(--smallText-margin-bottom);\n        }\n        p:not(.u-text-variant)\n        {\n        margin-top: var(--text-margin-top);\n        margin-bottom: var(--text-margin-bottom);\n        line-height: var(--text-line-height);\n        list-icon-spacing: var(--text-list-icon-spacing);\n        list-icon-size: var(--text-list-icon-size);\n        font-weight: var(--text-font-weight);\n        }\n        .u-btn\n        {\n        margin-top: var(--button-margin-top);\n        margin-bottom: var(--button-margin-bottom);\n        text-transform: var(--button-text-transform);\n        }\n        blockquote\n        {\n        font-style: var(--blockquote-font-style);\n        padding-left: var(--blockquote-padding-left);\n        border-width: var(--blockquote-border-width);\n        margin-top: var(--blockquote-margin-top);\n        margin-bottom: var(--blockquote-margin-bottom);\n        }\n        .u-metadata\n        {\n        margin-top: var(--metadata-margin-top);\n        margin-bottom: var(--metadata-margin-bottom);\n        }\n        ul:not(.u-unstyled)\n        {\n        margin-top: var(--list-margin-top);\n        margin-bottom: var(--list-margin-bottom);\n        }\n        ol\n        {\n        margin-top: var(--orderedlist-margin-top);\n        margin-bottom: var(--orderedlist-margin-bottom);\n        }\n        .u-post-content\n        {\n        margin-top: var(--postContent-margin-top);\n        margin-bottom: var(--postContent-margin-bottom);\n        }\n        .u-input\n        {\n        border-width: var(--form-input-border-width);\n        borders: var(--form-input-borders);\n        }\n        /** common-rules **/\n\n        /** publish-rules **/\n        /*begin-media rules*/\n        @media (max-width: 767px) {\n        h1.u-title\n        {\n        font-size: var(--title-font-size-sm);\n        }\n        }\n        @media (max-width: 575px) {\n        h1.u-title\n        {\n        font-size: var(--title-font-size-xs);\n        }\n        }\n        @media (max-width: 575px) {\n        h2.u-subtitle\n        {\n        font-size: var(--subtitle-font-size-xs);\n        }\n        }\n        @media (max-width: 575px) {\n        h1:not(.u-title)\n        {\n        font-size: var(--h1-font-size-xs);\n        }\n        }\n        @media (max-width: 575px) {\n        h2:not(.u-subtitle)\n        {\n        font-size: var(--h2-font-size-xs);\n        }\n        }\n        @media (max-width: 575px) {\n        h3\n        {\n        font-size: var(--h3-font-size-xs);\n        }\n        }\n        /*end-media rules*/\n        /** publish-rules **/\n\n        \n\n        /** cms-rules **/\n        /*begin-responsive rules*/\n        .u-sm h1.u-title\n        {\n        font-size: var(--title-font-size-sm);\n        }\n        .u-xs h1.u-title\n        {\n        font-size: var(--title-font-size-xs);\n        }\n        .u-xs h2.u-subtitle\n        {\n        font-size: var(--subtitle-font-size-xs);\n        }\n        .u-xs h1:not(.u-title)\n        {\n        font-size: var(--h1-font-size-xs);\n        }\n        .u-xs h2:not(.u-subtitle)\n        {\n        font-size: var(--h2-font-size-xs);\n        }\n        .u-xs h3\n        {\n        font-size: var(--h3-font-size-xs);\n        }\n        /*end-responsive rules*/\n        /** cms-rules **/\n\n        /** color-rules **/\n        .u-overlap.u-overlap-transparent:not(.u-overlap-contrast) .u-header :not(.u-nav-item) > a,\n        .u-gradient > .u-container-layout > a,\n        .u-image:not(.u-shading) > .u-container-layout > a,\n        a\n        {\n        color: var(--hyperlink-color);\n        }\n        .u-overlap.u-overlap-transparent:not(.u-overlap-contrast) .u-header :not(.u-nav-item) > a:hover,\n        .u-gradient > .u-container-layout > a:hover,\n        .u-image:not(.u-shading) > .u-container-layout > a:hover,\n        a:hover\n        {\n        color: var(--hyperlink-hover-color);\n        }\n        .u-overlap.u-overlap-transparent:not(.u-overlap-contrast) .u-header :not(.u-nav-item) > .u-btn,\n        .u-gradient > .u-container-layout > .u-btn,\n        .u-image:not(.u-shading) > .u-container-layout > .u-btn,\n        .u-btn\n        {\n        background-color: var(--button-background-color);\n        color: var(--button-color);\n        }\n        .u-overlap.u-overlap-transparent:not(.u-overlap-contrast) .u-header :not(.u-nav-item) > .u-btn:hover,\n        .u-gradient > .u-container-layout > .u-btn:hover,\n        .u-image:not(.u-shading) > .u-container-layout > .u-btn:hover,\n        .u-btn:hover\n        {\n        background-color: var(--button-hover-background-color);\n        color: var(--button-hover-color);\n        }\n        .u-overlap.u-overlap-transparent:not(.u-overlap-contrast) .u-header :not(.u-nav-item) > .u-btn:focus,\n        .u-gradient > .u-container-layout > .u-btn:focus,\n        .u-image:not(.u-shading) > .u-container-layout > .u-btn:focus,\n        .u-btn:focus\n        {\n        background-color: var(--button-hover-background-color);\n        color: var(--button-hover-color);\n        }\n        .u-overlap.u-overlap-transparent:not(.u-overlap-contrast) .u-header :not(.u-nav-item) > .u-btn:active,\n        .u-gradient > .u-container-layout > .u-btn:active,\n        .u-image:not(.u-shading) > .u-container-layout > .u-btn:active,\n        .u-btn:active\n        {\n        background-color: var(--button-active-background-color);\n        color: var(--button-active-color);\n        }\n        .u-overlap.u-overlap-transparent:not(.u-overlap-contrast) .u-header :not(.u-nav-item) > blockquote,\n        .u-gradient > .u-container-layout > blockquote,\n        .u-image:not(.u-shading) > .u-container-layout > blockquote,\n        blockquote\n        {\n        border-color: var(--blockquote-border-color);\n        }\n        .u-overlap.u-overlap-transparent:not(.u-overlap-contrast) .u-header :not(.u-nav-item) > .u-input,\n        .u-gradient > .u-container-layout > .u-input,\n        .u-image:not(.u-shading) > .u-container-layout > .u-input,\n        .u-input\n        {\n        border-color: var(--form-input-border-color);\n        background-color: var(--form-input-background-color);\n        color: var(--form-input-color);\n        }\n        /** color-rules **/\n\n        /** alt-color-rules **/\n        .u-custom-color-1 a,.u-custom-color-2 a,.u-custom-color-3 a,.u-custom-color-5 a,.u-custom-color-7 a,.u-body-color a,.u-palette-1-base a,.u-palette-1-dark-3 a,.u-palette-1-dark-2 a,.u-palette-1-dark-1 a,.u-palette-1 a,.u-palette-1-light-1 a,.u-palette-2-base a,.u-palette-2-dark-3 a,.u-palette-2-dark-2 a,.u-palette-2-dark-1 a,.u-palette-2 a,.u-palette-2-light-1 a,.u-palette-2-light-2 a,.u-palette-3-dark-3 a,.u-palette-3-dark-2 a,.u-palette-3-dark-1 a,.u-palette-4-base a,.u-palette-4-dark-3 a,.u-palette-4-dark-2 a,.u-palette-4-dark-1 a,.u-palette-5-dark-3 a,.u-palette-5-dark-2 a,.u-palette-5-dark-1 a,.u-grey-40 a,.u-grey-30 a,.u-grey-90 a,.u-grey-80 a,.u-grey-75 a,.u-black a,.u-grey-70 a,.u-grey-60 a,.u-grey-50 a,.u-grey-dark-3 a,.u-grey-dark-2 a,.u-grey-dark-1 a,.u-grey a,.u-shading a,.u-overlap-contrast .u-header a:not(.u-nav-link):not(.u-btn)\n        {\n        color: var(--hyperlink-alt-text-color);\n        }\n        .u-custom-color-1 a:hover,.u-custom-color-2 a:hover,.u-custom-color-3 a:hover,.u-custom-color-5 a:hover,.u-custom-color-7 a:hover,.u-body-color a:hover,.u-palette-1-base a:hover,.u-palette-1-dark-3 a:hover,.u-palette-1-dark-2 a:hover,.u-palette-1-dark-1 a:hover,.u-palette-1 a:hover,.u-palette-1-light-1 a:hover,.u-palette-2-base a:hover,.u-palette-2-dark-3 a:hover,.u-palette-2-dark-2 a:hover,.u-palette-2-dark-1 a:hover,.u-palette-2 a:hover,.u-palette-2-light-1 a:hover,.u-palette-2-light-2 a:hover,.u-palette-3-dark-3 a:hover,.u-palette-3-dark-2 a:hover,.u-palette-3-dark-1 a:hover,.u-palette-4-base a:hover,.u-palette-4-dark-3 a:hover,.u-palette-4-dark-2 a:hover,.u-palette-4-dark-1 a:hover,.u-palette-5-dark-3 a:hover,.u-palette-5-dark-2 a:hover,.u-palette-5-dark-1 a:hover,.u-grey-40 a:hover,.u-grey-30 a:hover,.u-grey-90 a:hover,.u-grey-80 a:hover,.u-grey-75 a:hover,.u-black a:hover,.u-grey-70 a:hover,.u-grey-60 a:hover,.u-grey-50 a:hover,.u-grey-dark-3 a:hover,.u-grey-dark-2 a:hover,.u-grey-dark-1 a:hover,.u-grey a:hover\n        {\n        color: var(--hyperlink-hover-alt-text-color);\n        }\n        .u-custom-color-1 .u-btn,.u-custom-color-2 .u-btn,.u-custom-color-3 .u-btn,.u-custom-color-5 .u-btn,.u-custom-color-7 .u-btn,.u-body-color .u-btn,.u-palette-1-base .u-btn,.u-palette-1-dark-3 .u-btn,.u-palette-1-dark-2 .u-btn,.u-palette-1-dark-1 .u-btn,.u-palette-1 .u-btn,.u-palette-1-light-1 .u-btn,.u-palette-2-base .u-btn,.u-palette-2-dark-3 .u-btn,.u-palette-2-dark-2 .u-btn,.u-palette-2-dark-1 .u-btn,.u-palette-2 .u-btn,.u-palette-2-light-1 .u-btn,.u-palette-2-light-2 .u-btn,.u-palette-3-dark-3 .u-btn,.u-palette-3-dark-2 .u-btn,.u-palette-3-dark-1 .u-btn,.u-palette-4-base .u-btn,.u-palette-4-dark-3 .u-btn,.u-palette-4-dark-2 .u-btn,.u-palette-4-dark-1 .u-btn,.u-palette-5-dark-3 .u-btn,.u-palette-5-dark-2 .u-btn,.u-palette-5-dark-1 .u-btn,.u-grey-40 .u-btn,.u-grey-30 .u-btn,.u-grey-90 .u-btn,.u-grey-80 .u-btn,.u-grey-75 .u-btn,.u-black .u-btn,.u-grey-70 .u-btn,.u-grey-60 .u-btn,.u-grey-50 .u-btn,.u-grey-dark-3 .u-btn,.u-grey-dark-2 .u-btn,.u-grey-dark-1 .u-btn,.u-grey .u-btn,.u-shading .u-btn,.u-overlap-contrast .u-header .u-btn\n        {\n        background-color: var(--button-alt-background-color);\n        color: var(--button-alt-color);\n        }\n        .u-custom-color-1 .u-btn:hover,.u-custom-color-2 .u-btn:hover,.u-custom-color-3 .u-btn:hover,.u-custom-color-5 .u-btn:hover,.u-custom-color-7 .u-btn:hover,.u-body-color .u-btn:hover,.u-palette-1-base .u-btn:hover,.u-palette-1-dark-3 .u-btn:hover,.u-palette-1-dark-2 .u-btn:hover,.u-palette-1-dark-1 .u-btn:hover,.u-palette-1 .u-btn:hover,.u-palette-1-light-1 .u-btn:hover,.u-palette-2-base .u-btn:hover,.u-palette-2-dark-3 .u-btn:hover,.u-palette-2-dark-2 .u-btn:hover,.u-palette-2-dark-1 .u-btn:hover,.u-palette-2 .u-btn:hover,.u-palette-2-light-1 .u-btn:hover,.u-palette-2-light-2 .u-btn:hover,.u-palette-3-dark-3 .u-btn:hover,.u-palette-3-dark-2 .u-btn:hover,.u-palette-3-dark-1 .u-btn:hover,.u-palette-4-base .u-btn:hover,.u-palette-4-dark-3 .u-btn:hover,.u-palette-4-dark-2 .u-btn:hover,.u-palette-4-dark-1 .u-btn:hover,.u-palette-5-dark-3 .u-btn:hover,.u-palette-5-dark-2 .u-btn:hover,.u-palette-5-dark-1 .u-btn:hover,.u-grey-40 .u-btn:hover,.u-grey-30 .u-btn:hover,.u-grey-90 .u-btn:hover,.u-grey-80 .u-btn:hover,.u-grey-75 .u-btn:hover,.u-black .u-btn:hover,.u-grey-70 .u-btn:hover,.u-grey-60 .u-btn:hover,.u-grey-50 .u-btn:hover,.u-grey-dark-3 .u-btn:hover,.u-grey-dark-2 .u-btn:hover,.u-grey-dark-1 .u-btn:hover,.u-grey .u-btn:hover,.u-shading .u-btn:hover,.u-overlap-contrast .u-header .u-btn:hover\n        {\n        background-color: var(--button-hover-alt-background-color);\n        color: var(--button-hover-alt-color);\n        }\n        .u-custom-color-1 .u-btn:active,.u-custom-color-2 .u-btn:active,.u-custom-color-3 .u-btn:active,.u-custom-color-5 .u-btn:active,.u-custom-color-7 .u-btn:active,.u-body-color .u-btn:active,.u-palette-1-base .u-btn:active,.u-palette-1-dark-3 .u-btn:active,.u-palette-1-dark-2 .u-btn:active,.u-palette-1-dark-1 .u-btn:active,.u-palette-1 .u-btn:active,.u-palette-1-light-1 .u-btn:active,.u-palette-2-base .u-btn:active,.u-palette-2-dark-3 .u-btn:active,.u-palette-2-dark-2 .u-btn:active,.u-palette-2-dark-1 .u-btn:active,.u-palette-2 .u-btn:active,.u-palette-2-light-1 .u-btn:active,.u-palette-2-light-2 .u-btn:active,.u-palette-3-dark-3 .u-btn:active,.u-palette-3-dark-2 .u-btn:active,.u-palette-3-dark-1 .u-btn:active,.u-palette-4-base .u-btn:active,.u-palette-4-dark-3 .u-btn:active,.u-palette-4-dark-2 .u-btn:active,.u-palette-4-dark-1 .u-btn:active,.u-palette-5-dark-3 .u-btn:active,.u-palette-5-dark-2 .u-btn:active,.u-palette-5-dark-1 .u-btn:active,.u-grey-40 .u-btn:active,.u-grey-30 .u-btn:active,.u-grey-90 .u-btn:active,.u-grey-80 .u-btn:active,.u-grey-75 .u-btn:active,.u-black .u-btn:active,.u-grey-70 .u-btn:active,.u-grey-60 .u-btn:active,.u-grey-50 .u-btn:active,.u-grey-dark-3 .u-btn:active,.u-grey-dark-2 .u-btn:active,.u-grey-dark-1 .u-btn:active,.u-grey .u-btn:active,.u-shading .u-btn:active,.u-overlap-contrast .u-header .u-btn:active\n        {\n        background-color: var(--button-active-alt-background-color);\n        color: var(--button-active-alt-color);\n        }\n        /** alt-color-rules **/\n    </style><style id=\"font-scheme\" font-scheme=\"Montserrat-Raleway\" heading-font=\"Montserrat,sans-serif\" text-font=\"Raleway,sans-serif\">.u-body {\n   --text-font: Raleway,sans-serif;\n   --heading-font: Montserrat,sans-serif;\n}</style>","appVersion":"6.15.2","publicUrl":null,"customDomainUrl":null,"subDomain":null,"datePublished":null,"isTrial":true,"serverSiteId":null}
